all_awardings|allow_live_comments|author|author_flair_css_class|author_flair_richtext|author_flair_text|author_flair_type|author_fullname|author_patreon_flair|author_premium|awarders|can_mod_post|contest_mode|created_utc|domain|full_link|gildings|id|is_crosspostable|is_meta|is_original_content|is_reddit_media_domain|is_robot_indexable|is_self|is_video|link_flair_background_color|link_flair_css_class|link_flair_richtext|link_flair_template_id|link_flair_text|link_flair_text_color|link_flair_type|locked|media_only|no_follow|num_comments|num_crossposts|over_18|parent_whitelist_status|permalink|pinned|pwls|retrieved_on|score|selftext|send_replies|spoiler|stickied|subreddit|subreddit_id|subreddit_subscribers|subreddit_type|suggested_sort|thumbnail|title|total_awards_received|treatment_tags|upvote_ratio|url|whitelist_status|wls|post_hint|preview|author_flair_background_color|author_flair_template_id|author_flair_text_color|edited|media_metadata|thumbnail_height|thumbnail_width|date|ticker
[]|False|h8nshorts||[]||text|t2_a2rl0hbu|False|False|[]|False|False|2021-03-31 15:22:32|self.wallstreetbets|https://www.reddit.com/r/wallstreetbets/comments/mh8gan/new_york_population_of_over_19_million/|{}|mh8gan|True|False|False|False|True|True|False|#800080|question|[{'e': 'text', 't': 'Discussion'}]|96f6c79e-b853-11e5-a4cb-0ebdf030e05d|Discussion|light|richtext|False|False|True|1|0|False|some_ads|/r/wallstreetbets/comments/mh8gan/new_york_population_of_over_19_million/|False|7|1617204162|1|With Gov. Cuomo signing cannabis legalization into law today, NY stands to become the epicenter for weed in the US.   I’d like to hear your thoughts on what this means for APHA, TLRY, CURLF, etc.  My first impression is that they plan on taxing the sh!t out of it.   Also, APHA and TLRY for example will need to take a hard look at merging with CURLF for example to immediately capture their 23 state  licenses and revenues to splash into the US market.|True|False|False|wallstreetbets|t5_2th52|9699360|public|confidence|self|New York - Population of over 19 million|0.0|[]|1.0|https://www.reddit.com/r/wallstreetbets/comments/mh8gan/new_york_population_of_over_19_million/|some_ads|7||||||||||2021-03-31|CURLF
[]|False|FutureKing75||[]||text|t2_a2rxl7ym|False|False|[]|False|False|2021-03-29 12:36:16|self.wallstreetbets|https://www.reddit.com/r/wallstreetbets/comments/mfomp7/marijuana_stocks/|{}|mfomp7|True|False|False|False|True|True|False|#800080|question|[{'e': 'text', 't': 'Discussion'}]|96f6c79e-b853-11e5-a4cb-0ebdf030e05d|Discussion|light|richtext|False|False|False|0|0|False|some_ads|/r/wallstreetbets/comments/mfomp7/marijuana_stocks/|False|7|1617021386|1|I’m unable to buy American marijuana stocks on Robinhood &amp; Merrill Lynch. Can anyone tell me which brokers allow me to buy CRLBF &amp; CURLF????|True|False|False|wallstreetbets|t5_2th52|9685016|public|confidence|self|Marijuana Stocks....|0.0|[]|1.0|https://www.reddit.com/r/wallstreetbets/comments/mfomp7/marijuana_stocks/|some_ads|7||||||||||2021-03-29|CURLF
[]|False|Poshbasher6971||[]||text|t2_122ck6|False|False|[]|False|False|2021-03-12 01:36:13|self.wallstreetbets|https://www.reddit.com/r/wallstreetbets/comments/m36ce0/curlf_a_tail_of_us_cannabis/|{}|m36ce0|True|False|False|False|True|True|False|#365b8c|dd|[{'e': 'text', 't': 'DD'}]|5692ce02-b860-11e5-b542-0edc7016bbd3|DD|light|richtext|False|False|True|57|0|False|some_ads|/r/wallstreetbets/comments/m36ce0/curlf_a_tail_of_us_cannabis/|False|7|1615512984|1|Disclaimer, the following doesn't have anything to do with short squeezes, gamma squeezes, or fucking 🌈🐻's.  I'm not a financial advisor, nor am I giving any financial advice. This is purely my opinion. If you invest based on what I say alone, you are definitely retarded.   If you have been following weed investing, you will notice that despite superior earnings and performance, US cannabis trades for less and in relatively low volume.  As of right now they cannot trade on any major exchange only OTC.  If what the CEO said in a recent report is correct, this may change very soon.  https://www.bnnbloomberg.ca/marijuana/video/curaleaf-exec-expects-u-s-pot-companies-soon-to-uplist-on-major-exchanges~2157478   Curaleaf ($CURLF) just crushed quarterly earnings and as far as I can tell, no other company is even close;  Total Revenue for the fourth quarter of 2020 was a record $230.3 million, an increase of 205.1% compared to $75.5 million in the fourth quarter of 2019. Total Revenue for the fourth quarter of 2020 increased 26.2% sequentially.  (SOURCE)(https://ir.curaleaf.com/2021-03-09-Curaleaf-Reports-Record-Fourth-Quarter-and-Fiscal-Year-End-2020-Financial-and-Operational-Results#:~:text=Total%20Revenue%20for%20the%20fourth,of%202020%20increased%2026.2%25%20sequentially.)  This is mostly because of their thirsty executive team re-investing their profits to expand to every state possible in the US.  They also just recently announced a European acquisition making them only one of 2 companies legally selling in the two largest markets in the world with ambitions of also opening up in Africa as well.  (SOURCE)(https://www.forbes.com/sites/willyakowicz/2021/03/10/curaleaf-to-expand-to-europe-with-286-million-acquisition-eyes-eastern-europe-and-africa-next/?sh=5225bd621f04)  They are already the biggest company in the US, will soon be the biggest in the world.  One of the other issues facing the US industry as a whole is banking.  Because weed is still illegal, most companies have a hard time renting or purchasing spaces.  If the owner of the building has a mortgage with Wells Fargo or JP Morgan, the building is basically unavailable.  This is why cannabis REITS have been crushing it this year.  The Senate Majority leader, Chuck Schumer, has recently rekindled the idea about passing the SAFE act.  This would allow these companies to use major banks if they are in legal states.  Besides the fact that this would enhance their ability to set up shop around the US, think about what this could mean for companies looking to go global like Curaleaf.  https://www.marketplace.org/2021/02/26/will-congress-consider-giving-marijuana-companies-access-to-big-banks/  I don't know if legalization is around the corner, but frankly I don't care.  Regardless of what government does, Curaleaf is going to find a way to move their product around the world and own the market.  If the government does move towards legalization, moving onto any US based cannabis company will be a good play.  Positions: 5,000 Shares $CURLF 1,000 Shares GME 10 19 MAR @ $165 call GME 500 PYPL 10 JAN 23 @ $17 call SQQQ 200 Shares VOO    If I am way off on this, tell me why I'm wrong.|True|False|False|wallstreetbets|t5_2th52|9511877|public|confidence|self|$CURLF a tail of US cannabis|0.0|[]|1.0|https://www.reddit.com/r/wallstreetbets/comments/m36ce0/curlf_a_tail_of_us_cannabis/|some_ads|7|self|{'enabled': False, 'images': [{'id': 'tBiH3oA8YbHMXoMuDCkXXudaN3aySOhoBoAT4H8u9gY', 'resolutions': [{'height': 60, 'url': 'https://external-preview.redd.it/MQOOYs5sWdBKiU4-WyPVXw0YhqKjHppMCzZhkGfykmM.jpg?width=108&amp;crop=smart&amp;auto=webp&amp;s=e0ac873663af24380ff1685c1f7c3ba66a075c94', 'width': 108}, {'height': 121, 'url': 'https://external-preview.redd.it/MQOOYs5sWdBKiU4-WyPVXw0YhqKjHppMCzZhkGfykmM.jpg?width=216&amp;crop=smart&amp;auto=webp&amp;s=b1f6bb915761f31162ba17aa32ad14f800ce7107', 'width': 216}, {'height': 179, 'url': 'https://external-preview.redd.it/MQOOYs5sWdBKiU4-WyPVXw0YhqKjHppMCzZhkGfykmM.jpg?width=320&amp;crop=smart&amp;auto=webp&amp;s=997b10f1ea5aeebccfe3c48a0c55d018ce08a4f1', 'width': 320}, {'height': 359, 'url': 'https://external-preview.redd.it/MQOOYs5sWdBKiU4-WyPVXw0YhqKjHppMCzZhkGfykmM.jpg?width=640&amp;crop=smart&amp;auto=webp&amp;s=66653209246859a0efb5cff813c10e5520576555', 'width': 640}, {'height': 539, 'url': 'https://external-preview.redd.it/MQOOYs5sWdBKiU4-WyPVXw0YhqKjHppMCzZhkGfykmM.jpg?width=960&amp;crop=smart&amp;auto=webp&amp;s=d0fc05fb6b3b0c8886311f4ec9f412be64062ffa', 'width': 960}], 'source': {'height': 551, 'url': 'https://external-preview.redd.it/MQOOYs5sWdBKiU4-WyPVXw0YhqKjHppMCzZhkGfykmM.jpg?auto=webp&amp;s=22d39b36b760c5a417aa5eccb58fc24973d8ebd7', 'width': 980}, 'variants': {}}]}||||||||2021-03-12|CURLF
"[{'award_sub_type': 'GLOBAL', 'award_type': 'global', 'awardings_required_to_grant_benefits': None, 'coin_price': 100, 'coin_reward': 0, 'count': 1, 'days_of_drip_extension': 0, 'days_of_premium': 0, 'description': ""Shows the Silver Award... and that's it."", 'end_date': None, 'giver_coin_reward': None, 'icon_format': None, 'icon_height': 512, 'icon_url': 'https://www.redditstatic.com/gold/awards/icon/silver_512.png', 'icon_width': 512, 'id': 'gid_1', 'is_enabled': True, 'is_new': False, 'name': 'Silver', 'penny_donate': None, 'penny_price': None, 'resized_icons': [{'height': 16, 'url': 'https://www.redditstatic.com/gold/awards/icon/silver_16.png', 'width': 16}, {'height': 32, 'url': 'https://www.redditstatic.com/gold/awards/icon/silver_32.png', 'width': 32}, {'height': 48, 'url': 'https://www.redditstatic.com/gold/awards/icon/silver_48.png', 'width': 48}, {'height': 64, 'url': 'https://www.redditstatic.com/gold/awards/icon/silver_64.png', 'width': 64}, {'height': 128, 'url': 'https://www.redditstatic.com/gold/awards/icon/silver_128.png', 'width': 128}], 'resized_static_icons': [{'height': 16, 'url': 'https://www.redditstatic.com/gold/awards/icon/silver_16.png', 'width': 16}, {'height': 32, 'url': 'https://www.redditstatic.com/gold/awards/icon/silver_32.png', 'width': 32}, {'height': 48, 'url': 'https://www.redditstatic.com/gold/awards/icon/silver_48.png', 'width': 48}, {'height': 64, 'url': 'https://www.redditstatic.com/gold/awards/icon/silver_64.png', 'width': 64}, {'height': 128, 'url': 'https://www.redditstatic.com/gold/awards/icon/silver_128.png', 'width': 128}], 'start_date': None, 'static_icon_height': 512, 'static_icon_url': 'https://www.redditstatic.com/gold/awards/icon/silver_512.png', 'static_icon_width': 512, 'subreddit_coin_reward': 0, 'subreddit_id': None, 'tiers_by_required_awardings': None}]"|False|seebz69||[{'e': 'text', 't': 'WeeDD'}]|WeeDD|richtext|t2_bmu1q|False|True|[]|False|False|2021-02-24 13:58:01|self.wallstreetbets|https://www.reddit.com/r/wallstreetbets/comments/lrdhk1/the_advisorshares_pure_us_cannabis_etf_mso_the/|{'gid_1': 1}|lrdhk1|True|False|False|False|True|True|False|#365b8c|dd|[{'e': 'text', 't': 'DD'}]|5692ce02-b860-11e5-b542-0edc7016bbd3|DD|light|richtext|False|False|False|11|0|False|some_ads|/r/wallstreetbets/comments/lrdhk1/the_advisorshares_pure_us_cannabis_etf_mso_the/|False|7|1614314152|22|"TYPO - ($MSOS*)  The AdvisorShares Pure US Cannabis ETF has surpassed $1 billion in AUM in just six months,[according to a company statement released Tuesday.](https://www.prnewswire.com/news-releases/msos-the-first-ever-us-cannabis-etf-surpasses-1-billion-in-assets-under-management-301233503.html)  - The fund was the first US ETF to focus solely on American cannabis companies and multi-state operations.   - The ETF has returned 110% since its inception.  &gt;The ETF, which trades under the ticker MSOS, launched on September 2, 2020 and has grown from $2.5 million in assets to now $1 billion in just six months. The fund has returned 110% since its inception and 37% in 2021 alone.  *""There's a lot of excitement surrounding the cannabis investment space right now and for a variety of reasons,"" said Dan Ahrens, AdvisorShares' chief operating officer and portfolio manager of MSOS. ""We firmly believe that the U.S. cannabis market provides a compelling long-term investment opportunity that clearly differentiates itself from other areas of the globe.""*  **Top Holdings** - Green Thumb Industries Inc. - Trulieve Cannabis Corp. - Curaleaf Holdings, Inc. - Cresco Labs, Inc. - TerrAscend Corp. - Innovative Industrial Properties Inc - Columbia Care, Inc. - GrowGeneration Corp.  [AdvisorShares](https://advisorshares.com/etfs/msos/)  Initial PT —&gt; $75usd  Eyeing 1/21/2022 $75 Cs @ &lt;7.00  Stay safe &amp; GLTA!  *I am not a Financial Advisor, so please do your own DD*"|True|False|False|wallstreetbets|t5_2th52|9301387|public|confidence|self|The AdvisorShares Pure US Cannabis ETF ($MSO) - The First to Reach $1bil AUM|1.0|[]|0.8|https://www.reddit.com/r/wallstreetbets/comments/lrdhk1/the_advisorshares_pure_us_cannabis_etf_mso_the/|some_ads|7|self|{'enabled': False, 'images': [{'id': 'vWRN65ucJJRn_nUS52yMFCszZUKINZzWgJy6RDMHiYE', 'resolutions': [{'height': 56, 'url': 'https://external-preview.redd.it/_m1IYAAm2xua7KOdF2K1FeVRwJ1i_kvYfj4BPNqmsw0.jpg?width=108&amp;crop=smart&amp;auto=webp&amp;s=a43d1e16e3e16913ff99b66f5da94d3e2c57096a', 'width': 108}, {'height': 113, 'url': 'https://external-preview.redd.it/_m1IYAAm2xua7KOdF2K1FeVRwJ1i_kvYfj4BPNqmsw0.jpg?width=216&amp;crop=smart&amp;auto=webp&amp;s=6f820385d98de6dcbc47351a2ebaa743742e032f', 'width': 216}, {'height': 167, 'url': 'https://external-preview.redd.it/_m1IYAAm2xua7KOdF2K1FeVRwJ1i_kvYfj4BPNqmsw0.jpg?width=320&amp;crop=smart&amp;auto=webp&amp;s=99ddbd093e92af8eeae061ced83a69c5c4ed0c48', 'width': 320}, {'height': 334, 'url': 'https://external-preview.redd.it/_m1IYAAm2xua7KOdF2K1FeVRwJ1i_kvYfj4BPNqmsw0.jpg?width=640&amp;crop=smart&amp;auto=webp&amp;s=cab8b1051b12b18ef0ef20bd7470806b17fcf4ae', 'width': 640}, {'height': 502, 'url': 'https://external-preview.redd.it/_m1IYAAm2xua7KOdF2K1FeVRwJ1i_kvYfj4BPNqmsw0.jpg?width=960&amp;crop=smart&amp;auto=webp&amp;s=c5265cb7f35758f9632d6600c08322e0723a3907', 'width': 960}, {'height': 565, 'url': 'https://external-preview.redd.it/_m1IYAAm2xua7KOdF2K1FeVRwJ1i_kvYfj4BPNqmsw0.jpg?width=1080&amp;crop=smart&amp;auto=webp&amp;s=3d7657bc3670f6591c3ba9939fa46c772c130552', 'width': 1080}], 'source': {'height': 785, 'url': 'https://external-preview.redd.it/_m1IYAAm2xua7KOdF2K1FeVRwJ1i_kvYfj4BPNqmsw0.jpg?auto=webp&amp;s=de47521b96bba602d518698bf4773aaa9db1c24c', 'width': 1500}, 'variants': {}}]}|#46d160|45b14952-0d2e-11ea-8d6d-0e9a93171619|light|1614176935.0||||2021-02-24|CURLF
[]|False|ctr1497||[]||text|t2_56lbvp3d|False|False|[]|False|False|2021-02-22 20:50:10|self.wallstreetbets|https://www.reddit.com/r/wallstreetbets/comments/lpzhn0/nj_legalizes_weed_officially_lets_own_the_legal/|{}|lpzhn0|True|False|False|False|True|True|False|#349e48|profit|[{'e': 'text', 't': 'Gain'}]|6bd9394c-0a95-11e9-82db-0eb3a11267a0|Gain|light|richtext|False|False|True|0|0|False|some_ads|/r/wallstreetbets/comments/lpzhn0/nj_legalizes_weed_officially_lets_own_the_legal/|False|7|1614027021|1|New Jersey officially legalized weed today. I noticed Curaleaf, a public company, owns a dispensary and its stock is listed as CURLF at $16 a share. Not a bad buy, especially with pending federal legalization as well. I bought CURLF and was wondering A. Who’s with me and B. What other companies are there to invest in when it comes to weed?|True|False|False|wallstreetbets|t5_2th52|9210650|public|confidence|self|NJ Legalizes Weed officially. Let’s own the legal marijuana market|0.0|[]|1.0|https://www.reddit.com/r/wallstreetbets/comments/lpzhn0/nj_legalizes_weed_officially_lets_own_the_legal/|some_ads|7||||||||||2021-02-22|CURLF
[]|False|bbakes25||[]||text|t2_2y0du1pr|False|False|[]|False|False|2021-02-11 16:38:46|self.wallstreetbets|https://www.reddit.com/r/wallstreetbets/comments/lhoklf/why_playing_the_cannabis_long_game_in_the_us_is_a/|{}|lhoklf|True|False|False|False|True|True|False|#800080|question|[{'e': 'text', 't': 'Discussion'}]|96f6c79e-b853-11e5-a4cb-0ebdf030e05d|Discussion|light|richtext|False|False|True|249|0|False|some_ads|/r/wallstreetbets/comments/lhoklf/why_playing_the_cannabis_long_game_in_the_us_is_a/|False|7|1613061536|1|If you have serious interest in playing the LONG game in Cannabis, and you’re a Robinhood user, please understand that United States companies that have far better revenue growth and fundamentals are being swept under the rug. JUST WAIT  Once these companies get uplisting onto the NASDAQ , and become available on Robinhood, a lot of people will begin to realize the staggering revenue difference between US operators and Canadian ones that already exists. As we seem to be trending toward legalization in the US, time is slowly running out to get in but it’s far from too late.  There will be a pullback in the sector as a whole soon as the hype dies down again which will make the opportunity even JUICIER.  My favorites are the etf MSOS (only thing available on Robinhood that gives users a portion of US companies), which holds operators like TCNNF, GTBIF (first public offering was just bought by blackrock for $100 million), CURLF, and GRAMF (a Jay-Z and Rihanna backed company that off the star power alone may have a ton of room to grow)  Be careful out there! And know that this opportunity is only scratching the surface😉|True|False|False|wallstreetbets|t5_2th52|8924512|public|confidence|self|Why playing the Cannabis LONG game in the US is a great play|0.0|[]|1.0|https://www.reddit.com/r/wallstreetbets/comments/lhoklf/why_playing_the_cannabis_long_game_in_the_us_is_a/|some_ads|7||||||||||2021-02-11|CURLF
[{'award_sub_type': 'GLOBAL', 'award_type': 'global', 'awardings_required_to_grant_benefits': None, 'coin_price': 200, 'coin_reward': 0, 'count': 1, 'days_of_drip_extension': 0, 'days_of_premium': 0, 'description': 'To the MOON.', 'end_date': None, 'giver_coin_reward': None, 'icon_format': None, 'icon_height': 2048, 'icon_url': 'https://i.redd.it/award_images/t5_22cerq/s5edqq9abef41_StonksRising.png', 'icon_width': 2048, 'id': 'award_d125d124-5c03-490d-af3d-d07c462003da', 'is_enabled': True, 'is_new': False, 'name': 'Stonks Rising', 'penny_donate': None, 'penny_price': None, 'resized_icons': [{'height': 16, 'url': 'https://preview.redd.it/award_images/t5_22cerq/s5edqq9abef41_StonksRising.png?width=16&amp;height=16&amp;auto=webp&amp;s=3bdbd7660aa0164072a243b6df9100da769e8278', 'width': 16}, {'height': 32, 'url': 'https://preview.redd.it/award_images/t5_22cerq/s5edqq9abef41_StonksRising.png?width=32&amp;height=32&amp;auto=webp&amp;s=30aa8ad7b30c73defb1b1b49dc055f42c8c39fcc', 'width': 32}, {'height': 48, 'url': 'https://preview.redd.it/award_images/t5_22cerq/s5edqq9abef41_StonksRising.png?width=48&amp;height=48&amp;auto=webp&amp;s=a5109b271dbe4f27927ee8bac7f23d1962a44936', 'width': 48}, {'height': 64, 'url': 'https://preview.redd.it/award_images/t5_22cerq/s5edqq9abef41_StonksRising.png?width=64&amp;height=64&amp;auto=webp&amp;s=6d6ca632d8c63e6d4e41ff8dbe4600528a4445b2', 'width': 64}, {'height': 128, 'url': 'https://preview.redd.it/award_images/t5_22cerq/s5edqq9abef41_StonksRising.png?width=128&amp;height=128&amp;auto=webp&amp;s=1f2ed12b4e132e68d553c702d6639a3dc065821c', 'width': 128}], 'resized_static_icons': [{'height': 16, 'url': 'https://preview.redd.it/award_images/t5_22cerq/s5edqq9abef41_StonksRising.png?width=16&amp;height=16&amp;auto=webp&amp;s=3bdbd7660aa0164072a243b6df9100da769e8278', 'width': 16}, {'height': 32, 'url': 'https://preview.redd.it/award_images/t5_22cerq/s5edqq9abef41_StonksRising.png?width=32&amp;height=32&amp;auto=webp&amp;s=30aa8ad7b30c73defb1b1b49dc055f42c8c39fcc', 'width': 32}, {'height': 48, 'url': 'https://preview.redd.it/award_images/t5_22cerq/s5edqq9abef41_StonksRising.png?width=48&amp;height=48&amp;auto=webp&amp;s=a5109b271dbe4f27927ee8bac7f23d1962a44936', 'width': 48}, {'height': 64, 'url': 'https://preview.redd.it/award_images/t5_22cerq/s5edqq9abef41_StonksRising.png?width=64&amp;height=64&amp;auto=webp&amp;s=6d6ca632d8c63e6d4e41ff8dbe4600528a4445b2', 'width': 64}, {'height': 128, 'url': 'https://preview.redd.it/award_images/t5_22cerq/s5edqq9abef41_StonksRising.png?width=128&amp;height=128&amp;auto=webp&amp;s=1f2ed12b4e132e68d553c702d6639a3dc065821c', 'width': 128}], 'start_date': None, 'static_icon_height': 2048, 'static_icon_url': 'https://i.redd.it/award_images/t5_22cerq/s5edqq9abef41_StonksRising.png', 'static_icon_width': 2048, 'subreddit_coin_reward': 0, 'subreddit_id': None, 'tiers_by_required_awardings': None}]|True|TraderJones89||[]||text|t2_49mo6pps|False|True|[]|False|False|2021-02-03 19:36:59|self.wallstreetbets|https://www.reddit.com/r/wallstreetbets/comments/lbw38z/the_case_for_us_cannabis_stocks_after_they_start/|{}|lbw38z|True|False|False|False|True|True|False|#365b8c|dd|[{'e': 'text', 't': 'DD'}]|5692ce02-b860-11e5-b542-0edc7016bbd3|DD|light|richtext|False|False|False|188|0|False|some_ads|/r/wallstreetbets/comments/lbw38z/the_case_for_us_cannabis_stocks_after_they_start/|False|7|1612607299|152|This is huge for this sector imo as this is a massive acquisition by Big Pharma. Although this acquisition is overseas, I think its a sign of what's to come in the US. Here's why I think US cannabis &amp; CBD stocks could have a huge year:  [https://www.marketwatch.com/story/cannabis-stocks-rally-anew-as-7-billion-gw-pharma-deal-spurs-interest-in-weed-and-its-medical-benefits-11612376529](https://www.marketwatch.com/story/cannabis-stocks-rally-anew-as-7-billion-gw-pharma-deal-spurs-interest-in-weed-and-its-medical-benefits-11612376529)  * **Big Pharma** dropping $7.2B on GW Pharma (They were first to get FDA approval of their CBD drug for seizures) means that big money is shifting into cannabis &amp; CBD plays 🚀 * Democrats have the House, Senate and Presidency as many believe its the US's turn for **legalization** like what we saw in Canada (think of the Green rush of 2017-2018) 🚀🚀 * Rumours on **FDA** further clarifying their rules around CBD and cannabis products in legal states (this would send these stocks flying imo if regulations are loosened or further clarified) 🚀🚀🚀 * Opens up **exporting** to the world for many of these companies if federally cannabis is finally removed as schedule 1 drug 🚀🚀🚀🚀  I made some really good money off of Canadian cannabis companies and I think it will be Nothing in comparison to when the worlds largest economy federally states its open for business  **My Picks** **💎🙌** **:**  * For Cannabis Focused - $TRUL/$TRULF, $GTII/$GTBIF, $CURA.$CURLF * For CBD &amp; Wellness - $CWEB/$CWBHF, $CBD.U/$CBDHF  &amp;#x200B;  https://preview.redd.it/ot2qw19ofbf61.png?width=573&amp;format=png&amp;auto=webp&amp;s=a6d5c0bfa360af0641e1184eee5e34b72a987a3d  **💎🙌** **Throw what companies you're following in the US that could be good investments as US cannabis stocks continue to grow** **💎🙌**|True|False|False|wallstreetbets|t5_2th52|8622609|public|confidence|https://b.thumbs.redditmedia.com/MDhKXm0-4YN4koTjhZfdAJmbvLq65g2qPZHKbxG5m9o.jpg|The Case for US Cannabis Stocks After They Start Soaring from $7.2B USD Big Pharma Acquisition of GW Pharma 🚀🚀🚀|1.0|[]|0.83|https://www.reddit.com/r/wallstreetbets/comments/lbw38z/the_case_for_us_cannabis_stocks_after_they_start/|some_ads|7|self|{'enabled': False, 'images': [{'id': '2kkM15GYkxeRCjyrmD4IxeB3aFaqRMpLD5piYicwn8Q', 'resolutions': [{'height': 54, 'url': 'https://external-preview.redd.it/oercfhzSFUgLFMp71XUR9mtinxOa5AS-xEgLgl0AcXU.jpg?width=108&amp;crop=smart&amp;auto=webp&amp;s=881bfc4c10cb8616d542f581a2bed11fd2c85e52', 'width': 108}, {'height': 108, 'url': 'https://external-preview.redd.it/oercfhzSFUgLFMp71XUR9mtinxOa5AS-xEgLgl0AcXU.jpg?width=216&amp;crop=smart&amp;auto=webp&amp;s=bdcc4d630a2a44d0681707684d05172aaef96e51', 'width': 216}, {'height': 160, 'url': 'https://external-preview.redd.it/oercfhzSFUgLFMp71XUR9mtinxOa5AS-xEgLgl0AcXU.jpg?width=320&amp;crop=smart&amp;auto=webp&amp;s=49dcff41b6bf912e2f279e15b01b059e7a5085c4', 'width': 320}, {'height': 320, 'url': 'https://external-preview.redd.it/oercfhzSFUgLFMp71XUR9mtinxOa5AS-xEgLgl0AcXU.jpg?width=640&amp;crop=smart&amp;auto=webp&amp;s=d3fc0a4a43b0b003a2fa4a78841f49eef9e60ef4', 'width': 640}, {'height': 480, 'url': 'https://external-preview.redd.it/oercfhzSFUgLFMp71XUR9mtinxOa5AS-xEgLgl0AcXU.jpg?width=960&amp;crop=smart&amp;auto=webp&amp;s=dd30966ee91f37878ce2b9ac8e5a8b13b7104097', 'width': 960}, {'height': 540, 'url': 'https://external-preview.redd.it/oercfhzSFUgLFMp71XUR9mtinxOa5AS-xEgLgl0AcXU.jpg?width=1080&amp;crop=smart&amp;auto=webp&amp;s=ef810e349c280a9aa12677e42596133ac4d9a71f', 'width': 1080}], 'source': {'height': 640, 'url': 'https://external-preview.redd.it/oercfhzSFUgLFMp71XUR9mtinxOa5AS-xEgLgl0AcXU.jpg?auto=webp&amp;s=8d98bf169dcbd5f2525db9706e91dc8813b7c6ec', 'width': 1280}, 'variants': {}}]}||||1612381221.0|{'ot2qw19ofbf61': {'e': 'Image', 'id': 'ot2qw19ofbf61', 'm': 'image/png', 'p': [{'u': 'https://preview.redd.it/ot2qw19ofbf61.png?width=108&amp;crop=smart&amp;auto=webp&amp;s=58ab263aa8b5f46043af3fec9aced1bdbfd62bd4', 'x': 108, 'y': 71}, {'u': 'https://preview.redd.it/ot2qw19ofbf61.png?width=216&amp;crop=smart&amp;auto=webp&amp;s=66741ad5712d30a8cf07c0afa31ae0188558da3d', 'x': 216, 'y': 142}, {'u': 'https://preview.redd.it/ot2qw19ofbf61.png?width=320&amp;crop=smart&amp;auto=webp&amp;s=918c6c91a2aa18d8cfec6fd5d52c6ebf877f7a4f', 'x': 320, 'y': 211}], 's': {'u': 'https://preview.redd.it/ot2qw19ofbf61.png?width=573&amp;format=png&amp;auto=webp&amp;s=a6d5c0bfa360af0641e1184eee5e34b72a987a3d', 'x': 573, 'y': 378}, 'status': 'valid'}}|70.0|140.0|2021-02-03|CURLF
