all_awardings|allow_live_comments|author|author_flair_css_class|author_flair_richtext|author_flair_text|author_flair_type|author_fullname|author_patreon_flair|author_premium|awarders|can_mod_post|contest_mode|created_utc|domain|full_link|gildings|id|is_crosspostable|is_meta|is_original_content|is_reddit_media_domain|is_robot_indexable|is_self|is_video|link_flair_background_color|link_flair_css_class|link_flair_richtext|link_flair_template_id|link_flair_text|link_flair_text_color|link_flair_type|locked|media_only|no_follow|num_comments|num_crossposts|over_18|parent_whitelist_status|permalink|pinned|pwls|retrieved_on|score|selftext|send_replies|spoiler|stickied|subreddit|subreddit_id|subreddit_subscribers|subreddit_type|suggested_sort|thumbnail|title|total_awards_received|treatment_tags|upvote_ratio|url|whitelist_status|wls|post_hint|preview|author_flair_background_color|author_flair_template_id|author_flair_text_color|edited|media_metadata|thumbnail_height|thumbnail_width|date|ticker
[]|False|Rick_Sanchez1214||[]||text|t2_y2fg7o8|False|False|[]|False|False|2021-01-04 14:22:01|self.wallstreetbets|https://www.reddit.com/r/wallstreetbets/comments/kq9n9v/talkin_bout_weed_retards_curlf/|{}|kq9n9v|True|False|False|False|True|True|False|#800080|question|[{'e': 'text', 't': 'Discussion'}]|96f6c79e-b853-11e5-a4cb-0ebdf030e05d|Discussion|light|richtext|False|False|True|6|0|False|some_ads|/r/wallstreetbets/comments/kq9n9v/talkin_bout_weed_retards_curlf/|False|7|1609770134|1|"To my fellow Autists &amp; Retards-  Been following this sub for just a few short weeks and I must say I'm impressed. You degenerates regularly give me a good laugh, though every now and again I do strike gold and learn something here. However, given my job, I can't trade options at all and I can't sell short. Basically, the only things I'm allowed to do are buy and hold equities. An additional restriction is that when I buy an equity, if I'm in the green, I must hold it for a minimum of 60 days prior to exiting (though I can sell for a loss at any time). So with that, I want to share one of my picks in 2020 that I likely won't be exiting any time soon, and that's Curaleaf - CURLF.  Yeah, yeah yeah, I know what you're thinking- this guy must be high. But I digress.  I believe that Curaleaf is in the best position, nationally, to take advantage of the continued shift towards Marijuana policy at the state level and even more importantly, the national level (SAFE Banking Act and/orMORE Act - if Congress doesn't completely shit itself). Right now they are operating in 23 states, with 96 dispensaries, 26 cultivation or grow sites, and have over 30 processing sites.  I see public opinion continue to shift in favor of Marijuana and I see a shitload of states crying out poor us, with fucked budgets - well, what better way to make some money than to legalize Marijuana at some level and then tax the shit out of it? Look at Colorado. They did so well with Marijuana that they said fuck it, let's get everyone on the Mushroom trip.  For anyone that hasn't heard of them, Curaleaf is the largest vertically integrated Marijuana company in the United States (by measure of revenue after their acquisition of GrassRoots in July 2020). For my fellow uneducated types, vertically integrated means that they own the entire process from seed to sale - the cultivation or growing sites, to the processing sites, to the actual dispensaries where the product is sold - and they are headquartered in Wakefield, Mass - not in some obscure place in Canada. What even is Canada, but America's hat? Socialists. The legal Marijuana business across the US generated about 13.6 billion in 2019 and MorningStar Financial believes that it will continue to grow by a 25% average per year in the recreational market and 15% within the medical market.   Their growth has been nothing short of astounding - primarily driven via acquisitions. Each quarter they are successfully building on their strategy of launching / opening additional retail locations in key untapped markets, expanding in their current markets, all while pushing their own Select brand, with higher margins. Here's a good article from their billionaire backer on Forbes on where he sees the company going in the longer term, quote to be the ""FritoLay of Cannabis"".    [https://www.forbes.com/sites/willyakowicz/2020/11/27/inside-curaleaf-billionaire-boris-jordans-hunger-to-become-the-frito-lay-of-cannabis/?sh=6e7c8be72196](https://www.forbes.com/sites/willyakowicz/2020/11/27/inside-curaleaf-billionaire-boris-jordans-hunger-to-become-the-frito-lay-of-cannabis/?sh=6e7c8be72196)   I made a $5,000 position in them at $3.35/share back in March of 2020.  Obligatory  **🚀🚀🚀🚀🚀🚀🚀🚀🚀🚀🚀🚀🚀🚀🚀🚀🚀**"|True|False|False|wallstreetbets|t5_2th52|1767046|public|confidence|self|Talkin' Bout Weed Retards - CURLF|0.0|[]|1.0|https://www.reddit.com/r/wallstreetbets/comments/kq9n9v/talkin_bout_weed_retards_curlf/|some_ads|7|self|{'enabled': False, 'images': [{'id': 'hk3agk-ct2OREQmQT9ZtH5e-vQfDxgGwKOLxkOv_ZjA', 'resolutions': [{'height': 60, 'url': 'https://external-preview.redd.it/h4A0c7odfGt0opVUWbM7IJ2yThCAWPjeKo3XBHz2nOM.jpg?width=108&amp;crop=smart&amp;auto=webp&amp;s=ff32dbe3ffc8653b48b9c5d3f99060c93dfe36c7', 'width': 108}, {'height': 121, 'url': 'https://external-preview.redd.it/h4A0c7odfGt0opVUWbM7IJ2yThCAWPjeKo3XBHz2nOM.jpg?width=216&amp;crop=smart&amp;auto=webp&amp;s=16e929c2e37efaed2a91be893c7b4fec3efea2ec', 'width': 216}, {'height': 180, 'url': 'https://external-preview.redd.it/h4A0c7odfGt0opVUWbM7IJ2yThCAWPjeKo3XBHz2nOM.jpg?width=320&amp;crop=smart&amp;auto=webp&amp;s=6eccbca3b941fb89d2017c91cb5e953652d24cd3', 'width': 320}, {'height': 360, 'url': 'https://external-preview.redd.it/h4A0c7odfGt0opVUWbM7IJ2yThCAWPjeKo3XBHz2nOM.jpg?width=640&amp;crop=smart&amp;auto=webp&amp;s=c8fe4955dad64058174a84b3f9506d14fde081bf', 'width': 640}, {'height': 540, 'url': 'https://external-preview.redd.it/h4A0c7odfGt0opVUWbM7IJ2yThCAWPjeKo3XBHz2nOM.jpg?width=960&amp;crop=smart&amp;auto=webp&amp;s=0f710990edaab3837ca7661b6994ad210f940cf7', 'width': 960}, {'height': 607, 'url': 'https://external-preview.redd.it/h4A0c7odfGt0opVUWbM7IJ2yThCAWPjeKo3XBHz2nOM.jpg?width=1080&amp;crop=smart&amp;auto=webp&amp;s=c11039785654a9922fc0a789eb2969af693161cb', 'width': 1080}], 'source': {'height': 675, 'url': 'https://external-preview.redd.it/h4A0c7odfGt0opVUWbM7IJ2yThCAWPjeKo3XBHz2nOM.jpg?auto=webp&amp;s=87b936893db4196161230f2b285a67bc923029ef', 'width': 1200}, 'variants': {}}]}||||||||2021-01-04|CURLF
[]|False|retapeoj||[]||text|t2_jmr4a|False|False|[]|False|False|2020-12-04 16:56:39|self.wallstreetbets|https://www.reddit.com/r/wallstreetbets/comments/k6opbh/marijuana_opportunity_reinvestment_and/|{}|k6opbh|True|False|False|False|True|True|False|#7a5901|shitpost|[{'e': 'text', 't': 'Shitpost'}]|d609e434-b97f-11ea-a39e-0ea715edff61|Shitpost|light|richtext|False|False|True|1|0|False|no_ads|/r/wallstreetbets/comments/k6opbh/marijuana_opportunity_reinvestment_and/|False|0|1607101009|1|Get on the weed train: [$trssf](https://twitter.com/search?q=%24trssf&amp;src=cashtag_click) [$curlf](https://twitter.com/search?q=%24curlf&amp;src=cashtag_click) [$msos](https://twitter.com/search?q=%24msos&amp;src=cashtag_click) [$plnhf](https://twitter.com/search?q=%24plnhf&amp;src=cashtag_click)|True|False|False|wallstreetbets|t5_2th52|1654005|public|confidence|self|Marijuana Opportunity Reinvestment and Expungement MORE Act|0.0|[]|1.0|https://www.reddit.com/r/wallstreetbets/comments/k6opbh/marijuana_opportunity_reinvestment_and/|no_ads|0||||||||||2020-12-04|CURLF
[]|False|Burnt_toast_2018||[]||text|t2_qmhoovl|False|False|[]|False|False|2020-11-25 16:37:50|self.wallstreetbets|https://www.reddit.com/r/wallstreetbets/comments/k0vh77/weed_is_back_on_the_menu_boys_msos_dd_options_now/|{}|k0vh77|True|False|False|False|True|True|False|#365b8c|dd|[{'e': 'text', 't': 'DD'}]|5692ce02-b860-11e5-b542-0edc7016bbd3|DD|light|richtext|False|False|True|26|0|False|no_ads|/r/wallstreetbets/comments/k0vh77/weed_is_back_on_the_menu_boys_msos_dd_options_now/|False|0|1606322281|1|Alright listen up retards, obviously there is money to be made off of the weed tickers that are listed on Robinhood here and there; but they are mostly canadian LP's whose primary presence is in, you guessed it, Canada. Some of them have recently made partnerships/purchase to create inroads into the expanding US market, but that's not what were gonna talk about here.  As you know, 5 more fuckin states just legalized marijuana in some form or another, and it's the EXISTING US-based licensed firms that are going to be most effectively poised to take over market share and expand into these new states.   The US loves having companies jump through a bunch of legal hoops to get licensed to operate, and in the weed sector many companies have what is called a Multi-State Operating license or MSO. You will know some of these companies already; but you aren't able to buy options or shares for them because they are only listed in the US OTC because of existing regulations. Robinhood sure as fuck doesn't support them, and since that's the only broker you use/know about, you are missing out on BIG tendies.  How do we get around these nasty regulations that are getting in the way of your 420 dreams?  **Introducing the MSOS Pure-US Cannabis ETF**  Listed on 9/1/2020 and having **options** listed as of a few days ago, this ETF will give you direct exposure to the major players already operating in the US. **You MIGHT be aware of a few of their top holdings if you haven't been living in your mom's basement**.  * Green Thumb Industries * Curaleaf Holdings * Trulieve Cannabis * Cresco Labs * Growgeneration Corp * Innovative Industrial  **But what about the household names like APHA, and that one amazingly rock solid company HEXO that Robinhood has access to?**  They operate in Canada, num nuts! You think they just going to hop international borders and be a powerhouse in benefitting from the US wave of legalization? Yeah right, **America First pussies!**  * Total combined legal sales of medical and adult-use cannabis in the U.S. are projected to reach $35 billion by 2025. * Total U.S. illicit cannabis market reached an estimated $66 billion in 2019. * Five additional states could pass legalization measures in November 2020, adding a further $3.3 billion in annual legal sales before 2025. - **This happened. And guess what, this happening has increased pressure on other states as well as the Federal Government to finally get with the fuckin' times and treat MJ like the cash crop that it is. Everybody is going to want a slice of that sweet sweet tax pie.** * Jurisdictions with the highest density of cannabis consumers are Oregon, D.C., Colorado and Vermont. * 67% of Americans support full federal legalization, an increase from 41% in 2010. * 230 Million Americans live in states with legalized medical or adult-use cannabis, representing 70% of the U.S. population.  **This is America, we love our alcohol, sex, drugs and rock and roll.**  You can bet your sweet titties that 2021 is going to be a big year for growth in the market and for the already established licensed multi-state operators in the US.  No good DD is complete without one, and since I know you fucks like pictures **look at this fuckin GRAPH.**  &amp;#x200B;  [Numbers are going UP obviously, very similar to the trajectory of fucking STONKS. \(They go UP\)](https://preview.redd.it/qmxbovsqwe161.png?width=900&amp;format=png&amp;auto=webp&amp;s=62dc8e893aaac17dc7c081578d737ff3a3fa81ec)  **So why should I care about this ETF MSOS?**  Because accessing OTC/alternatively listed stocks isn't available with every broker. This ETF holds a basket of all the main players and is listed on the US exchanges. It was recently listed at 30$ and after a pre-election uncertainty dip as risen back to initial offering price. Currently sitting pretty at 30.44.  **And before a couple days ago, options weren't available. AND NOW THEY ARE.**  So get your dicks out for Harambe, light up a bleezy and BUY some motherfucking CALL OPTIONS. This is NOT an overnight play; I know for most of you this is going to instantly be a turn off. But for the rest of you autists who I somehow miraculously still have your attention; here is some fucking positions.  **MSOS 3/19/21 - 31c**  **MSOS 3/19/21 - 35c**  **MSOS 6/18/21 - 35c**  Yes, OI is low.. the options chain just came out like fuckin yesterday dude. Everybody always complaining about missing great stonks before they pick up steam and hit the mainstream. **This is the time to get in; at the jump.**  Thanks for listening and if you weren't listening the TLDR is below, which I'll combine with an ELI5 for the extra retarded.  **TLDR/ELI5:**  weed legal in US many more now, bidet make ez more weed legal, weed stonk go up in US next year bigly. MSOS has US based weed people ONLY, so they go up bigly more then canada weed people  MSOS 3/19/21 - 31c  MSOS 6/18/21 - 35c|True|False|True|wallstreetbets|t5_2th52|1613277|public|confidence|https://a.thumbs.redditmedia.com/Mt2AU1yENHY422ZmfD2pxAuVRK-d25Yjckph7Ef_1E0.jpg|Weed is back on the menu boys, MSOS DD - Options Now Available|0.0|[]|1.0|https://www.reddit.com/r/wallstreetbets/comments/k0vh77/weed_is_back_on_the_menu_boys_msos_dd_options_now/|no_ads|0|||||||{'qmxbovsqwe161': {'e': 'Image', 'id': 'qmxbovsqwe161', 'm': 'image/png', 'p': [{'u': 'https://preview.redd.it/qmxbovsqwe161.png?width=108&amp;crop=smart&amp;auto=webp&amp;s=3c367b9632b218426daa5913a5b7663da117f9d2', 'x': 108, 'y': 67}, {'u': 'https://preview.redd.it/qmxbovsqwe161.png?width=216&amp;crop=smart&amp;auto=webp&amp;s=e61cda6b18cfb1a0116ace0d3382c473de915780', 'x': 216, 'y': 135}, {'u': 'https://preview.redd.it/qmxbovsqwe161.png?width=320&amp;crop=smart&amp;auto=webp&amp;s=8bac815a1565eba3edff681c486cf209a9f51dd6', 'x': 320, 'y': 200}, {'u': 'https://preview.redd.it/qmxbovsqwe161.png?width=640&amp;crop=smart&amp;auto=webp&amp;s=155416138e5ae462309331a190e205d902dc5d8b', 'x': 640, 'y': 400}], 's': {'u': 'https://preview.redd.it/qmxbovsqwe161.png?width=900&amp;format=png&amp;auto=webp&amp;s=62dc8e893aaac17dc7c081578d737ff3a3fa81ec', 'x': 900, 'y': 563}, 'status': 'valid'}}|87.0|140.0|2020-11-25|CURLF
[]|False|bobf47980gmailcom||[]||text|t2_3umlf2ud|False|False|[]|False|False|2020-08-21 16:21:01|self.wallstreetbets|https://www.reddit.com/r/wallstreetbets/comments/idztvk/why_im_yoloing_yolo/|{}|idztvk|True|False|False|False|True|True|False|#365b8c|dd|[{'e': 'text', 't': 'DD'}]|5692ce02-b860-11e5-b542-0edc7016bbd3|DD|light|richtext|False|False|True|4|0|False|no_ads|/r/wallstreetbets/comments/idztvk/why_im_yoloing_yolo/|False|0|1598026871|1|Now I know a lot of you got burned on Canadian cannabis in 2018, but it appears as if the industry is poised to breakout again and this time with the US MSO’s. What a lot of people don’t realize is the big-time investment opportunities in the cannabis space are not with the Canadian LPs but the US MSO’s. The Untied States market has the potential to completely drawf the Canadian market.  In fact, the California cannabis market is larger then the Canadian market on its own.  The 4 major US MSOs (CURLF, GTBIF, TCNNF, CRLBF) all just posted breakout quarters and are demonstrating encouraging growth trends. The Canadian LPs have gotten a lot more recognition since they have the ability to trade on the major exchanges whereas their US counterparts have to trade OTC. Now I know what most of you are thinking... no major exchange listing = no options and no robinhood.  However, there is a NASDAQ listed ETF which provides you exposure to US MSOs through swap agreements: YOLO      Upcoming Catalysts for the US cannabis sector:  NJ and AZ legalization on the ballot in November- legalization in NJ is viewed relatively favorably among voters and many people don’t realize how big of a deal that can be. Legalization in NJ will most likely cause a domino effect of legalization in NY, PA, CT so they don’t miss out on tax revenue – this has been discussed by many analysts covering the space.  SAFE banking act- this has been discussed in the news as of late as the democrats would like to add it to the up coming stimulus deal. It remains to be seen if the current Republican led congress would approve this. However, there will be a lot of pressure in the coming months for this to be approved, especially if the democrats take control in November. SAFE banking will allow greater flows of money for US MSO’s and would possibly allow them to trade on the major exchanges- this would be a HUGE deal as it would allow buying from the large mutual funds, more hedge fund exposure, robin hood investors, and CNBC coverage.  Democratic sweep in November- it remains to be seen what this would entail but vice-presidential nominee Kamala Harris has bee vocal about legalization in the past.   For these reasons I am expecting a run-up in US cannabis equities toward the election  YOLO Nov 14 C|True|False|False|wallstreetbets|t5_2th52|1420581|public|confidence|self|Why I’m Yolo’ing YOLO|0.0|[]|1.0|https://www.reddit.com/r/wallstreetbets/comments/idztvk/why_im_yoloing_yolo/|no_ads|0||||||||||2020-08-21|CURLF
[]|False|JStewie21||[]||text|t2_5l4y9sk2|False|False|[]|False|False|2020-08-13 11:20:53|self.wallstreetbets|https://www.reddit.com/r/wallstreetbets/comments/i8y3ut/playing_a_bidenharris_win_cannabis/|{}|i8y3ut|True|False|False|False|True|True|False|#800080|question|[{'e': 'text', 't': 'Discussion'}]|96f6c79e-b853-11e5-a4cb-0ebdf030e05d|Discussion|light|richtext|False|False|True|31|0|False|no_ads|/r/wallstreetbets/comments/i8y3ut/playing_a_bidenharris_win_cannabis/|False|0|1597317665|1|Unfortunately it is looking more and more like a Biden/Harris win in November. I expect the first thing for this administration to do is legalize Cannabis on a Federal level, open up interstate commerce and create thousands of jobs. I believe the play here is cannabis companies in general and possibly Curaleaf (CURLF) which is now the biggest cannabis company in the world. I still need to do DD but this sector seems to be the Biden/Harris win best bet. Let me know your thoughts.|True|False|False|wallstreetbets|t5_2th52|1405263|public|confidence|self|Playing a Biden/Harris Win - Cannabis|0.0|[]|1.0|https://www.reddit.com/r/wallstreetbets/comments/i8y3ut/playing_a_bidenharris_win_cannabis/|no_ads|0||||||||||2020-08-13|CURLF
[]|False|Buildsoc||[]||text|t2_e0cfn|False|False|[]|False|False|2020-07-06 19:40:20|self.wallstreetbets|https://www.reddit.com/r/wallstreetbets/comments/hmevhs/tlry_catching_a_bid_as_nice_base_seems_to_have/|{}|hmevhs|True|False|False|False|True|True|False|#6189c0|stocks|[{'e': 'text', 't': 'Stocks'}]|234fbd78-ad54-11e5-b4c5-0e73c33c5a0b|Stocks|light|richtext|False|False|True|38|0|False|no_ads|/r/wallstreetbets/comments/hmevhs/tlry_catching_a_bid_as_nice_base_seems_to_have/|False|0|1594067968|1|Anyone else trading Tilray? Canopy Growth and Cronos also seemed to have started new uptrends today.  I’ve been waiting a long long time for them to move up, my guess is that as Biden’s odds improve, they will continue to run.  This looks to be only the beginning, but as a certified bag holder, I would really like to hear others perspective, especially if you were once in these stocks but have decided to move on.  I do know that it seems to be once they are hated, and everyone has moved on,...that’s when they finally begin to rally. Now that all of the bad news is mostly out, seems like this could be a break in the pessimism, and new optimism for more favorable legislation moving forward, into the election cycle.  If nothing else, let’s hope the Safe  Banking act gets approved, which should help the MSO’s like TCNNF, GTBIF, CRLBF and CURLF.|True|False|False|wallstreetbets|t5_2th52|1319605|public|confidence|self|TLRY catching a bid as nice base seems to have formed around $7|0.0|[]|0.67|https://www.reddit.com/r/wallstreetbets/comments/hmevhs/tlry_catching_a_bid_as_nice_base_seems_to_have/|no_ads|0||||||||||2020-07-06|CURLF
[]|False|chompboy99||[]||text|t2_48jyl9v3|False|False|[]|False|False|2020-05-18 14:43:12|self.wallstreetbets|https://www.reddit.com/r/wallstreetbets/comments/gm2plj/any_pot_stocks_that_are_long_holds_when/|{}|gm2plj|True|False|False|False|True|True|False|#800080|question|[{'e': 'text', 't': 'Discussion'}]|96f6c79e-b853-11e5-a4cb-0ebdf030e05d|Discussion|light|richtext|False|False|True|6|0|False|some_ads|/r/wallstreetbets/comments/gm2plj/any_pot_stocks_that_are_long_holds_when/|False|7|1589812998|1|Been looking at $CURLF and $HEXO. Let me know your thoughts.|True|False|False|wallstreetbets|t5_2th52|1202354|public|confidence|self|Any pot stocks that are long holds when recreational cannabis becomes legal in more US states?|0.0|[]|1.0|https://www.reddit.com/r/wallstreetbets/comments/gm2plj/any_pot_stocks_that_are_long_holds_when/|some_ads|7||||||||||2020-05-18|CURLF
[]|False|stream5482||[]||text|t2_4zq40l6u|False|False|[]|False|False|2020-05-08 03:00:12|self.wallstreetbets|https://www.reddit.com/r/wallstreetbets/comments/gfl3yr/weed_a_case_for_the_bull/|{}|gfl3yr|True|False|False|False|True|True|False|#365b8c|dd|[{'e': 'text', 't': 'DD'}]|5692ce02-b860-11e5-b542-0edc7016bbd3|DD|light|richtext|False|False|True|9|1|False|some_ads|/r/wallstreetbets/comments/gfl3yr/weed_a_case_for_the_bull/|False|7|1588906818|1|I posted this as  DD on our Discord group on April 24 @ 6:18am.  DM me if you want an invite.    I’m positing It here now with no editing.   **You heard it here first. Scroll to bottom for positions.**   Disclosure: I’m in [credit card processing](https://www.reddit.com/r/wallstreetbets/comments/g6merb/credit_card_processing_indicator_for_consumers/). Here’s my last post about credit card processing.   To make money on a trade, you have to be ahead of everyone else. Someone said to me “The big boys made their trade before disclosure. To trail a position is already late. “   Woke up today to look at transactions data for march and April (internal data). Noticed couple industries are spiking. Guns sales are up, Alcohol sales are up and…………………………………CBD / cannabis are up. Started doing some research.   1.)  Nelson Peltz -- Hedge fund billionaire   a. Dumped $500 million worth of PG shares. See Picture 1 below.   b. [He appointed the new CEO at ACB.](https://finance.yahoo.com/news/aurora-cannabis-acb-ceo-stepping-190353645.html)See link 1 below.  c.  [Ties with Trump See Link 2](https://www.cnn.com/2020/02/15/politics/trump-fundraiser-nelson-peltz/index.html)   Conclusion: Trump will legalize cannabis to spur the economy and Peltz knows this or is whispering in his ear. He’s positioning himself.   2.) Studies are showing Medical cannabis could help fight CoVID-19. See link 3 below.  3.)  Sponsoring bank -- On credit card processing side, you can’t process a cannabis transaction on credit card as at fed level, it’s still illegals. But sponsoring bank is opening for the CBD space (edibles + gummies) to position for cannabis.   4.) Increase in sales. Credit card processing for CBD has been spiking last 2 months. See link 4  &amp;#x200B;  Link 3: [https://beta.ctvnews.ca/local/calgary/2020/4/21/1\_4906249.html](https://beta.ctvnews.ca/local/calgary/2020/4/21/1_4906249.html)  Link 4: [https://www.weedstreet420.com/press-release/aphria-inc-announces-net-cannabis-revenue-increases-65-from-prior-quarter-and-fourth-consecutive-quarter-of-positive-adjusted-ebitda-2020/](https://www.weedstreet420.com/press-release/aphria-inc-announces-net-cannabis-revenue-increases-65-from-prior-quarter-and-fourth-consecutive-quarter-of-positive-adjusted-ebitda-2020/)  &amp;#x200B;  ACB (aurora Cannabis), CGC (canopy Growth), TLRY ( Tilray) Apha ( Aphria) Curlf ( Lead Ventures). CALLs 3-6 months out All signs pointing to it will print.   Updates  ACB is splitting. Go with TLRY C  May 22  for 05/11( earning)  if you want.   IF Call doesn’t print, ban me  for 6 months.|True|False|False|wallstreetbets|t5_2th52|1179872|public|confidence|self|Weed: a case for the Bull|0.0|[]|1.0|https://www.reddit.com/r/wallstreetbets/comments/gfl3yr/weed_a_case_for_the_bull/|some_ads|7|self|{'enabled': False, 'images': [{'id': '93y5hePmWjGo6Y93Pljd5-LAjGZ3J6E_60B3oYplo7o', 'resolutions': [{'height': 34, 'url': 'https://external-preview.redd.it/ARCYKso3UOdwVHeGmhx78H79RZQQXhl3cDCEwFVUyF8.jpg?width=108&amp;crop=smart&amp;auto=webp&amp;s=335c04fc83cd4c3dbaa10fe29be557e7993b6159', 'width': 108}, {'height': 68, 'url': 'https://external-preview.redd.it/ARCYKso3UOdwVHeGmhx78H79RZQQXhl3cDCEwFVUyF8.jpg?width=216&amp;crop=smart&amp;auto=webp&amp;s=68ec89783500b4ae2ac07da06556b60a6729ab67', 'width': 216}, {'height': 102, 'url': 'https://external-preview.redd.it/ARCYKso3UOdwVHeGmhx78H79RZQQXhl3cDCEwFVUyF8.jpg?width=320&amp;crop=smart&amp;auto=webp&amp;s=17f9a6bf16da82f8cd5af767778fb282289bb8a9', 'width': 320}, {'height': 204, 'url': 'https://external-preview.redd.it/ARCYKso3UOdwVHeGmhx78H79RZQQXhl3cDCEwFVUyF8.jpg?width=640&amp;crop=smart&amp;auto=webp&amp;s=7bedc5cfe441ed26bc1a528c3a0e2053067de48a', 'width': 640}, {'height': 306, 'url': 'https://external-preview.redd.it/ARCYKso3UOdwVHeGmhx78H79RZQQXhl3cDCEwFVUyF8.jpg?width=960&amp;crop=smart&amp;auto=webp&amp;s=5e1fd03fe2f8ff151d9b84d2e49e5eb38c508de7', 'width': 960}, {'height': 344, 'url': 'https://external-preview.redd.it/ARCYKso3UOdwVHeGmhx78H79RZQQXhl3cDCEwFVUyF8.jpg?width=1080&amp;crop=smart&amp;auto=webp&amp;s=53e6a18d0bf0c09a9b1075a5778ae961f9b001ce', 'width': 1080}], 'source': {'height': 385, 'url': 'https://external-preview.redd.it/ARCYKso3UOdwVHeGmhx78H79RZQQXhl3cDCEwFVUyF8.jpg?auto=webp&amp;s=df847d8ffb94a6710a7fa4f8734c63629ab87b48', 'width': 1207}, 'variants': {}}]}||||||||2020-05-08|CURLF
