all_awardings|allow_live_comments|author|author_flair_css_class|author_flair_richtext|author_flair_text|author_flair_type|author_fullname|author_patreon_flair|author_premium|awarders|can_mod_post|contest_mode|created_utc|domain|full_link|gildings|id|is_crosspostable|is_meta|is_original_content|is_reddit_media_domain|is_robot_indexable|is_self|is_video|link_flair_background_color|link_flair_css_class|link_flair_richtext|link_flair_template_id|link_flair_text|link_flair_text_color|link_flair_type|locked|media_only|no_follow|num_comments|num_crossposts|over_18|parent_whitelist_status|permalink|pinned|pwls|retrieved_on|score|selftext|send_replies|spoiler|stickied|subreddit|subreddit_id|subreddit_subscribers|subreddit_type|suggested_sort|thumbnail|title|total_awards_received|treatment_tags|upvote_ratio|url|whitelist_status|wls|post_hint|preview|author_flair_background_color|author_flair_template_id|author_flair_text_color|edited|media_metadata|thumbnail_height|thumbnail_width|date|ticker
[]|False|dougweaver||[]||text|t2_9ksdqwyf|False|True|[]|False|False|2021-02-02 21:23:58|self.wallstreetbets|https://www.reddit.com/r/wallstreetbets/comments/lb6u08/upcoming_penny_stocks/|{}|lb6u08|True|False|False|False|True|True|False|#365b8c|dd|[{'e': 'text', 't': 'DD'}]|5692ce02-b860-11e5-b542-0edc7016bbd3|DD|light|richtext|False|False|True|0|0|False|some_ads|/r/wallstreetbets/comments/lb6u08/upcoming_penny_stocks/|False|7|1612548015|1|Sometimes emotions can get in the way I understand and we don't always make the moves that we wish we madebut it is very important to stay level-headed in this game if you're going to make a difference.. can't make a difference if you're broke...the world is changing in small ways as we look about us we just need to do our best also. There is nothing better than good due diligence and sound financial judgment to make trading decisions. With that in mind of course there are many opportunities where there is hype involved with newer companies and spacs that are led by very smart investors..with all that said I like to do my own diligence and that's how I come up with gems like AWSL. ACBCQ and CURLF.. every one of these is a company that I expect to make 100% to 5,000% on....|True|False|False|wallstreetbets|t5_2th52|8589896|public|confidence|self|UPCOMING PENNY STOCKS|0.0|[]|1.0|https://www.reddit.com/r/wallstreetbets/comments/lb6u08/upcoming_penny_stocks/|some_ads|7||||||||||2021-02-02|CURLF
[]|False|bardiboo||[]||text|t2_6oxum|False|False|[]|False|False|2021-01-15 02:25:43|self.wallstreetbets|https://www.reddit.com/r/wallstreetbets/comments/kxkvt1/yolo_call_options_on_yoloetf_building_new_account/|{}|kxkvt1|True|False|True|False|True|True|False|#0392cf|yolo|[{'e': 'text', 't': 'YOLO'}]|da18a43a-83c5-11e8-9b6c-0e287561ddb8|YOLO|light|richtext|False|False|True|2|0|False|some_ads|/r/wallstreetbets/comments/kxkvt1/yolo_call_options_on_yoloetf_building_new_account/|False|7|1610677553|1| Howdy stoners. I’m building a new account using pot stocks for the most part as a challenge. My goal is to reach 100k in the next few months. I started with around 10k in early January and I’m already up \~9k. You can obviously see the success of Canadian pot stocks in the market right now and it seems like they are far outperforming US pot stocks. There’s a good reason for this! Exposure. Congrats to those of you trading TLRY and Aphria (the merger is going to be sick) but those gains won’t outperform US pot stocks in the long run, especially when decriminalization occurs. Let me explain: advisor shares has two excellent ETFs that hold both US Multi State Operators (MSOS ETF) and global marijuana operators (YOLO ETF). I believe marijuana legislation is coming hard and swift in this year (next few months btw) so I’ve opened a Robinhood for just potstock options. As you can see I’m already up quite a bit and I believe the space will run very hard. I’m expecting double digit % days closer to legalization. These gains happened right after the dems won senate and most people don’t even know about these US MSOs. The big draw back for US potstocks so far has been the inability to bank and listing on NYSE for the individual names (CURLF, TCNNF, GTBIF) meaning you can only buy these on OTC markets (TDameritrade) and you can only use limit orders since market orders aren’t available OTC. Upon federal decriminalization (not even legalization) these organization will be allowed to trade on the NYSE allowing big money to get in. Luckily you can buy MSOS and YOLO which hold these companies and it’s available on Robinhood if you refuse to trade OTC. Wish me luck on my quest to 100k! (This is just a small account, I have many more trades I’m willing to share and I will update often)|True|False|False|wallstreetbets|t5_2th52|1842511|public|confidence|self|YOLO Call Options on YOLO(ETF) - Building New Account Challenge|0.0|[]|1.0|https://www.reddit.com/r/wallstreetbets/comments/kxkvt1/yolo_call_options_on_yoloetf_building_new_account/|some_ads|7||||||||||2021-01-15|CURLF
[]|False|alexl_4||[{'e': 'text', 't': '\x1b210112:1:1'}]|210112:1:1|richtext|t2_3yszx8pb|False|False|[]|False|False|2021-01-15 01:44:32|self.wallstreetbets|https://www.reddit.com/r/wallstreetbets/comments/kxk5hb/curaleaf_dd_curlf/|{}|kxk5hb|True|False|False|False|True|True|False|#365b8c|dd|[{'e': 'text', 't': 'DD'}]|5692ce02-b860-11e5-b542-0edc7016bbd3|DD|light|richtext|False|False|False|10|0|False|some_ads|/r/wallstreetbets/comments/kxk5hb/curaleaf_dd_curlf/|False|7|1610675175|0|American Cannabis - Will the Democratic Senate win make millionaires?  In 2018, Canopy Growth made more millionaires than any other stock. Legislative change, uplisting to major exchanges (NYSE), and huge institutional investment created the perfect storm and it was a bunch of unsophisticated investors (read: **retards**) that got rich off of it.      Today, a similar story is evolving in US Cannabis in real-time, with a total addressable market that absolutely DOMINATES Canada's, and the emergence of unique tailwinds (e.g. COVID, social justice) to drive acceleration of and acceptance of Cannabis far beyond what Canada achieved.        **The core of the investment thesis is dead simple.** Cannabis is federally illegal. This has **prevented large institutions** from investing in American Cannabis companies and provided a once in a generation opportunity for retail to make real money.  The democratic sweep of the house, senate, presidency will lead to cannabis reform. Even if the absence of federal legalization, the conditions that led to meteoric rise of Canadian cannabis are being replicated south of the border. Read the Q&amp;A for more.      **Why will cannabis legislation change?**   There is unprecedented momentum for cannabis reform at all levels of government.  * [Senate Majority Leader said Marijuana legalization will be prioritized in a Democratic Senate](https://www.marijuanamoment.net/chuck-schumer-says-marijuana-legalization-will-be-prioritized-if-democrats-retake-senate/) * [Vice President Kamala Harris co-sponsors the MORE act to Federally and Tax Marijuana](https://www.rollingstone.com/culture/culture-news/kamala-harris-marijuana-bill-legalize-tax-weed-pot-862192/) * [In historic vote, House passes Marijuana banking bill with bipartisan support](https://mjbizdaily.com/historic-day-us-house-passes-cannabis-banking-bill-with-strong-bipartisan-support/) * [Language for the critical SAFE banking has previously been included in stimulus bills and will likely make it to execution with senate majority ](https://www.insurancejournal.com/news/west/2020/05/14/568608.htm) (this bill gives US cannabis operators access to banks to GREATLY lower their cost of capital, and is critical to having them uplist onto major exchanges -&gt; institutional investment) * [Removal of anti-cannabis Attorney General, and additional of Cannabis neutral AG Garland](https://www.cannabisbusinesstimes.com/article/attorney-general-william-barr-resigns/), and [addition of Pro-Cannabis Secretary of Health and Human Services](https://www.marijuanamoment.net/bidens-health-secretary-pick-could-help-reclassify-marijuana/) * The demographics are undeniable. Young people and people of colour support cannabis reform, and they turned out for the democrats in the general election and Georgia runoff.   **Why will this happen now?**  * [States are losing out on DESPERATELY needed tax revenue](https://normlfl.org/much-tax-revenue-legal-cannabis-generate/)(e.g. [Colorado](https://www.cnbc.com/2019/06/12/colorado-passes-1-billion-in-marijuana-state-revenue.html). [Illinois](https://chicago.suntimes.com/cannabis/2020/12/15/22174987/marijuana-cannabis-taxes-illinois-dispensaries-alcohol-booze-budget)) * [Cannabis legalization and expungement is a pillar of racial justice](https://www.aclu.org/blog/criminal-law-reform/drug-law-reform/marijuana-legalization-racial-justice-issue), and has never been hotter with nation wide protests this year * [Public support for Legal Cannabis is higher than it's ever been](https://news.gallup.com/poll/323582/support-legal-marijuana-inches-new-high.aspx) (\~90% for medical, \~70% for adult recreational use) * [The majority of states already have some form of legal cannabis](https://www.businessinsider.com/legal-marijuana-states-2018-1),  medical in 34 states, adult recreational in 11, but large institutions still can't invest, and AMERICAN cannabis companies can list on large exchanges  * [There was a pro-cannabis sweep during the election, with 5 out of 5 states approving Cannabis measures](https://finance.yahoo.com/news/2020-elections-marijuana-on-the-ballot-in-these-5-states-173753954.html) * [New York has already announced a proposal to legalize](https://www.governor.ny.gov/news/governor-cuomo-announces-proposal-legalize-and-create-equitable-adult-use-cannabis-program-part)(New York is the jewel of the East, and many think with legalization in New York and New Jersey, the rest of the nation will follow) * [Use of cannabis has absolutely surged during the pandemic, accelerating adoption](https://www.forbes.com/sites/irisdorbian/2020/09/18/cannabis-consumption-surges-during-pandemic-as-sleep-issues-and-anxieties-mount-says-new-poll/?sh=3957110843d5) \-- in anxious and uncertain times, alcohol and cannabis flourish; sin stocks do well in recessions  * Cannabis is taking market share from alcohol: [US alcohol consumption decreases as cannabis use increases](https://www.healtheuropa.eu/alcohol-consumption-falling-cannabis-use-increases/94421/)  **Who should I invest in?**  * Hint: **it's not Aurora, Tilray or Canopy** (they don't sell ANY cannabis in the US) -- they will have a hard time making effective entry if and when they EVENTUALLY get access as many states have limited license programs that will require very expensive M&amp;A  CURALEAF   * [Curaleaf is the biggest](https://mjbizdaily.com/curaleaf-rises-to-the-top-of-us-marijuana-industry-with-footprint-covering-about-two-dozen-states/) (CEO is a billionaire, biggest footprint, largest revenues) -- OTC ($CURLF), CSE ($CURA)|True|False|False|wallstreetbets|t5_2th52|1841781|public|confidence|self|Curaleaf DD $CURLF|0.0|[]|0.5|https://www.reddit.com/r/wallstreetbets/comments/kxk5hb/curaleaf_dd_curlf/|some_ads|7|self|{'enabled': False, 'images': [{'id': 'S0R4kulJ25mcwk07RGLIYbnQGW5jmdKjW60-aBeUnYo', 'resolutions': [{'height': 64, 'url': 'https://external-preview.redd.it/Tg3RT7Rk8Muq1fvPLYsFgQZ37See7GxcfJ9rFmDapyA.jpg?width=108&amp;crop=smart&amp;auto=webp&amp;s=d357bee2db44f8f1acc1956def41f256ebc3e533', 'width': 108}, {'height': 129, 'url': 'https://external-preview.redd.it/Tg3RT7Rk8Muq1fvPLYsFgQZ37See7GxcfJ9rFmDapyA.jpg?width=216&amp;crop=smart&amp;auto=webp&amp;s=ee4588ae86bf06baebfdd8ae669c553b0126bbc7', 'width': 216}, {'height': 192, 'url': 'https://external-preview.redd.it/Tg3RT7Rk8Muq1fvPLYsFgQZ37See7GxcfJ9rFmDapyA.jpg?width=320&amp;crop=smart&amp;auto=webp&amp;s=10e9b9e98e8ff63e53d392778651c3739b3a369c', 'width': 320}, {'height': 384, 'url': 'https://external-preview.redd.it/Tg3RT7Rk8Muq1fvPLYsFgQZ37See7GxcfJ9rFmDapyA.jpg?width=640&amp;crop=smart&amp;auto=webp&amp;s=a9219b3d69792d011aa0c7f332756f4970e594ea', 'width': 640}, {'height': 576, 'url': 'https://external-preview.redd.it/Tg3RT7Rk8Muq1fvPLYsFgQZ37See7GxcfJ9rFmDapyA.jpg?width=960&amp;crop=smart&amp;auto=webp&amp;s=df7b2f2c8117fcfea68b2bc6afdfbbfb7dec09c3', 'width': 960}], 'source': {'height': 600, 'url': 'https://external-preview.redd.it/Tg3RT7Rk8Muq1fvPLYsFgQZ37See7GxcfJ9rFmDapyA.jpg?auto=webp&amp;s=d5732195b08f12496d8ecaeb9ab3517091c31b7a', 'width': 1000}, 'variants': {}}]}|||dark|||||2021-01-15|CURLF
[]|False|100NOT99-||[]||text|t2_4w1quvpy|False|True|[]|False|False|2021-01-10 23:44:11|self.wallstreetbets|https://www.reddit.com/r/wallstreetbets/comments/kuq6q7/american_cannabis_the_perfect_storm/|{}|kuq6q7|True|False|False|False|True|True|False|#800080|question|[{'e': 'text', 't': 'Discussion'}]|96f6c79e-b853-11e5-a4cb-0ebdf030e05d|Discussion|light|richtext|False|False|False|269|0|False|some_ads|/r/wallstreetbets/comments/kuq6q7/american_cannabis_the_perfect_storm/|False|7|1610323676|10|In 2018, Canopy Growth made more millionaires than any other stock. Legislative change, uplisting to major exchanges (NYSE), and huge institutional investment created the perfect storm and it was a bunch of unsophisticated investors (read: **degenerates**) that got rich off of it.  Today, a similar story is evolving in US Cannabis in real-time, with a total addressable market that absolutely DOMINATES Canada's, and the emergence of unique tailwinds (e.g. COVID, social justice) to drive acceleration of and acceptance of Cannabis far beyond what Canada achieved.  **The core of the investment thesis is dead simple.** Cannabis is federally illegal. This has **prevented large institutions** from investing in American Cannabis companies and provided a once in a generation opportunity for retail to make real money. The democratic sweep of the house, senate, presidency will lead to cannabis reform. Even if the absence of federal legalization, the conditions that led to meteoric rise of Canadian cannabis are being replicated south of the border. Read the Q&amp;A for more.  **Why will cannabis legislation change?**  There is unprecedented momentum for cannabis reform at all levels of government.  * [Senate Majority Leader said Marijuana legalization will be prioritized in a Democratic Senate](https://www.marijuanamoment.net/chuck-schumer-says-marijuana-legalization-will-be-prioritized-if-democrats-retake-senate/) * [Vice President Kamala Harris co-sponsors the MORE act to Federally and Tax Marijuana](https://www.rollingstone.com/culture/culture-news/kamala-harris-marijuana-bill-legalize-tax-weed-pot-862192/) * [In historic vote, House passes Marijuana banking bill with bipartisan support](https://mjbizdaily.com/historic-day-us-house-passes-cannabis-banking-bill-with-strong-bipartisan-support/) * [Language for the critical SAFE banking has previously been included in stimulus bills and will likely make it to execution with senate majority ](https://www.insurancejournal.com/news/west/2020/05/14/568608.htm)(this bill gives US cannabis operators access to banks to GREATLY lower their cost of capital, and is critical to having them uplist onto major exchanges -&gt; institutional investment) * [Removal of anti-cannabis Attorney General, and additional of Cannabis neutral AG Garland](https://www.cannabisbusinesstimes.com/article/attorney-general-william-barr-resigns/), and [addition of Pro-Cannabis Secretary of Health and Human Services](https://www.marijuanamoment.net/bidens-health-secretary-pick-could-help-reclassify-marijuana/) * The demographics are undeniable. Young people and people of colour support cannabis reform, and they turned out for the democrats in the general election and Georgia runoff.  **Why will this happen now?**  * [States are losing out on DESPERATELY needed tax revenue](https://normlfl.org/much-tax-revenue-legal-cannabis-generate/)(e.g. [Colorado](https://www.cnbc.com/2019/06/12/colorado-passes-1-billion-in-marijuana-state-revenue.html). [Illinois](https://chicago.suntimes.com/cannabis/2020/12/15/22174987/marijuana-cannabis-taxes-illinois-dispensaries-alcohol-booze-budget)) * [Cannabis legalization and expungement is a pillar of racial justice](https://www.aclu.org/blog/criminal-law-reform/drug-law-reform/marijuana-legalization-racial-justice-issue), and has never been hotter with nation wide protests this year * [Public support for Legal Cannabis is higher than it's ever been](https://news.gallup.com/poll/323582/support-legal-marijuana-inches-new-high.aspx) (\~90% for medical, \~70% for adult recreational use) * [The majority of states already have some form of legal cannabis](https://www.businessinsider.com/legal-marijuana-states-2018-1), medical in 34 states, adult recreational in 11, but large institutions still can't invest, and AMERICAN cannabis companies can list on large exchanges * [There was a pro-cannabis sweep during the election, with 5 out of 5 states approving Cannabis measures](https://finance.yahoo.com/news/2020-elections-marijuana-on-the-ballot-in-these-5-states-173753954.html) * [New York has already announced a proposal to legalize](https://www.governor.ny.gov/news/governor-cuomo-announces-proposal-legalize-and-create-equitable-adult-use-cannabis-program-part)(New York is the jewel of the East, and many think with legalization in New York and New Jersey, the rest of the nation will follow) * [Use of cannabis has absolutely surged during the pandemic, accelerating adoption](https://www.forbes.com/sites/irisdorbian/2020/09/18/cannabis-consumption-surges-during-pandemic-as-sleep-issues-and-anxieties-mount-says-new-poll/?sh=3957110843d5) \-- in anxious and uncertain times, alcohol and cannabis flourish; sin stocks do well in recessions * Cannabis is taking market share from alcohol: [US alcohol consumption decreases as cannabis use increases](https://www.healtheuropa.eu/alcohol-consumption-falling-cannabis-use-increases/94421/)  **Who should I invest in?**  * Hint: **it's not Aurora, Tilray or Canopy** (they don't sell ANY cannabis in the US) -- they will have a hard time making effective entry if and when they EVENTUALLY get access as many states have limited license programs that will require very expensive M&amp;A * Unlikely Canada in its growth phase, the US actually has stellar companies who already have established businesses, with excellent revenue growth * [Curaleaf is the biggest](https://mjbizdaily.com/curaleaf-rises-to-the-top-of-us-marijuana-industry-with-footprint-covering-about-two-dozen-states/) (CEO is a billionaire, biggest footprint, largest revenues) -- OTC ($CURLF), CSE ($CURA) * [Trulieve has the best overall financials](https://thedeepdive.ca/trulieve-five-analysts-raise-price-targets-following-stellar-earnings/) (most profitable, juggernaut in Florida, amazing reputation among investors) -- OTC ($TCNNF), CSE ($TRUL) * [Green Thumb Industries](https://www.newcannabisventures.com/gti-rises-in-the-cannabis-industry-with-focus-on-brand-building-and-prudent-capital-allocation/) is a branding and execution monster (great positioning in newly legalized states, loved among analysts, great track record of execution) -- OTC ($GTBIF), CSE ($GTII)  **But these companies aren't on the NYSE and NASDAQ**  * Yes, and that's exactly the point. Retail has a chance to get in before large institutions get the opportunity in a few weeks, months. Once the uplist happens, your already playing catch up. Sound too good to be true? Google it, take 5 minutes and do the DD. Here's where you can start: [CB1 Capital](https://www.cb1cap.com/blog/2020/8/17/barbarians-at-the-gate)  **This guy sounds like linked shit so he probably knows what he's talking about -- just give me a ticker.**  * Consider $MSOS on the NYSE. It's an ETF with holdings in all the top AMERICAN cannabis companies and have optionality. They've grown to about \~300-400 million in assets under management. They will be a billion within a few months. Ban me if they aren't.|True|False|False|wallstreetbets|t5_2th52|1799559|public|confidence|self|American Cannabis: The Perfect Storm|0.0|[]|0.81|https://www.reddit.com/r/wallstreetbets/comments/kuq6q7/american_cannabis_the_perfect_storm/|some_ads|7|self|{'enabled': False, 'images': [{'id': 'S0R4kulJ25mcwk07RGLIYbnQGW5jmdKjW60-aBeUnYo', 'resolutions': [{'height': 64, 'url': 'https://external-preview.redd.it/Tg3RT7Rk8Muq1fvPLYsFgQZ37See7GxcfJ9rFmDapyA.jpg?width=108&amp;crop=smart&amp;auto=webp&amp;s=d357bee2db44f8f1acc1956def41f256ebc3e533', 'width': 108}, {'height': 129, 'url': 'https://external-preview.redd.it/Tg3RT7Rk8Muq1fvPLYsFgQZ37See7GxcfJ9rFmDapyA.jpg?width=216&amp;crop=smart&amp;auto=webp&amp;s=ee4588ae86bf06baebfdd8ae669c553b0126bbc7', 'width': 216}, {'height': 192, 'url': 'https://external-preview.redd.it/Tg3RT7Rk8Muq1fvPLYsFgQZ37See7GxcfJ9rFmDapyA.jpg?width=320&amp;crop=smart&amp;auto=webp&amp;s=10e9b9e98e8ff63e53d392778651c3739b3a369c', 'width': 320}, {'height': 384, 'url': 'https://external-preview.redd.it/Tg3RT7Rk8Muq1fvPLYsFgQZ37See7GxcfJ9rFmDapyA.jpg?width=640&amp;crop=smart&amp;auto=webp&amp;s=a9219b3d69792d011aa0c7f332756f4970e594ea', 'width': 640}, {'height': 576, 'url': 'https://external-preview.redd.it/Tg3RT7Rk8Muq1fvPLYsFgQZ37See7GxcfJ9rFmDapyA.jpg?width=960&amp;crop=smart&amp;auto=webp&amp;s=df7b2f2c8117fcfea68b2bc6afdfbbfb7dec09c3', 'width': 960}], 'source': {'height': 600, 'url': 'https://external-preview.redd.it/Tg3RT7Rk8Muq1fvPLYsFgQZ37See7GxcfJ9rFmDapyA.jpg?auto=webp&amp;s=d5732195b08f12496d8ecaeb9ab3517091c31b7a', 'width': 1000}, 'variants': {}}]}||||||||2021-01-10|CURLF
[]|False|Rick_Sanchez1214||[]||text|t2_y2fg7o8|False|False|[]|False|False|2021-01-05 20:29:39|self.wallstreetbets|https://www.reddit.com/r/wallstreetbets/comments/kr7091/my_dear_retards_where_to_park_my_money/|{}|kr7091|True|False|False|False|True|True|False|#800080|question|[{'e': 'text', 't': 'Discussion'}]|96f6c79e-b853-11e5-a4cb-0ebdf030e05d|Discussion|light|richtext|False|False|True|10|0|False|some_ads|/r/wallstreetbets/comments/kr7091/my_dear_retards_where_to_park_my_money/|False|7|1609878589|1|To answer your first question, Yes - I work in Subway Corporate, where I cannot trade options, I cannot sell short, and any equities I purchase I must hold for a minimum of 60 days if I'm going to sell them for a gain.  Last March I plunked down $5K into CURLF at $3.35, as of this writing, it's worth about $20K. Looking for something else to plunk that money down in to.  With warm regards, a fellow autist.|True|False|False|wallstreetbets|t5_2th52|1772643|public|confidence|self|My Dear Retards - Where To Park My Money?|0.0|[]|1.0|https://www.reddit.com/r/wallstreetbets/comments/kr7091/my_dear_retards_where_to_park_my_money/|some_ads|7||||||||||2021-01-05|CURLF
[]|False|AlexKarp2024||[]||text|t2_943eo53o|False|False|[]|False|False|2021-01-04 19:13:11|self.wallstreetbets|https://www.reddit.com/r/wallstreetbets/comments/kqfiyx/greenthumb_and_curaleaf_tilray_aphria_cgc/|{}|kqfiyx|True|False|False|False|True|True|False|#365b8c|dd|[{'e': 'text', 't': 'DD'}]|5692ce02-b860-11e5-b542-0edc7016bbd3|DD|light|richtext|False|False|True|72|0|False|some_ads|/r/wallstreetbets/comments/kqfiyx/greenthumb_and_curaleaf_tilray_aphria_cgc/|False|7|1609787603|1|   We all know weed stocks are basically risk-free, unlimited tendies. Its the trifecta of Tendie Town. (1) Proven demand since fucking 1800, (2) an unprecedented, once-in-a-lifetime catalyst on the horizon in US legalization, and (3) the rare occasion when retail can get in before institutions because institutions are too scared to touch it right now.  But somehow you idiots can be so right, yet so wrong a the same time. But have no fear, I created this account just to save you, because, well idk why but I thought you guys didnt deserve the misery of being wrong yet again.  APHA, ACB, and CGC are NOT the way. These stocks peaked years ago when Canada legalized weed. US legalization means US weed stocks 🚀 🚀 🚀 aka GTIFB and CURLF  The primary reasons the US is legalizing weed is for monetary and economic reasons (taxes and jobs for the people on the short bus). The US is not going to go through the trouble of legalizing weed, just import Canadian weed and allow them to capitalize on the economics of it. US will prop up their own production, and tariff any Canadian imports to hell. I would be surprised if a single dime bag of Canadian weed ever gets imported to the US, why would it? Weed is easy to grow and the US is more than capable of it meeting the demand.  If you need more convincing, Curaleaf did 200+ million in revenue LAST QUARTER and Greenthumb did \~160+ million and both companies are profitable already.  The problem is that you cannot buy US weed operators (GTIFB and CURLF) on Robinhood because they trade OTC on lesser known Canadian exchanges. Cant buy them on Merrill Edge either so cant blame Robinhood for everything. But, Fidelity does, so go make a Fidelity and YOLO into the real US weed winners and thank me in two years.  IF you need even more convincing, the first domino to fall in legalization will be allowing US operators to list on major exchanges like NYSE but by then itll be too late for the retail investor.  TLDR: Take advantage of being a immoral retail investor and buy GTIFB &amp; CURLF through Fidelity|True|False|False|wallstreetbets|t5_2th52|1768040|public|confidence|self|GreenThumb and Curaleaf &gt;&gt;&gt;&gt; Tilray, Aphria, CGC|0.0|[]|1.0|https://www.reddit.com/r/wallstreetbets/comments/kqfiyx/greenthumb_and_curaleaf_tilray_aphria_cgc/|some_ads|7||||||||||2021-01-04|CURLF
