all_awardings|allow_live_comments|author|author_flair_css_class|author_flair_richtext|author_flair_text|author_flair_type|author_fullname|author_patreon_flair|author_premium|awarders|can_mod_post|contest_mode|created_utc|domain|full_link|gildings|id|is_crosspostable|is_meta|is_original_content|is_reddit_media_domain|is_robot_indexable|is_self|is_video|link_flair_background_color|link_flair_css_class|link_flair_richtext|link_flair_template_id|link_flair_text|link_flair_text_color|link_flair_type|locked|media_metadata|media_only|no_follow|num_comments|num_crossposts|over_18|parent_whitelist_status|permalink|pinned|pwls|retrieved_on|score|selftext|send_replies|spoiler|stickied|subreddit|subreddit_id|subreddit_subscribers|subreddit_type|suggested_sort|thumbnail|thumbnail_height|thumbnail_width|title|total_awards_received|treatment_tags|upvote_ratio|url|whitelist_status|wls|post_hint|preview|author_flair_background_color|author_flair_text_color|gilded|date|ticker
[]|False|SecretSquirrelTech||[]||text|t2_49de9cy7|False|False|[]|False|False|2021-01-28 17:00:02|self.wallstreetbets|https://www.reddit.com/r/wallstreetbets/comments/l72aui/robinhood_confirms_they_are_preventing_sales_of/|{}|l72aui|True|False|False|False|True|True|False|#ffb000|news|[{'e': 'text', 't': 'News'}]|519c3d26-4acc-11eb-8ce2-0ec530aa616d|News|light|richtext|False||False|True|5|0|False|some_ads|/r/wallstreetbets/comments/l72aui/robinhood_confirms_they_are_preventing_sales_of/|False|7|1611853346|1|"[https://blog.robinhood.com/news/2021/1/28/keeping-customers-informed-through-market-volatility](https://blog.robinhood.com/news/2021/1/28/keeping-customers-informed-through-market-volatility)  &amp;#x200B;  ""We are restricting transactions for certain securities to position closing only, including $AAL, $AMC, $BB, $BBBY, $CTRM, $EXPR, $GME, $KOSS, $NAKD, $NOK, $SNDL, $TR, and $TRVG. """|True|False|False|wallstreetbets|t5_2th52|4738455|public|confidence|self|||"RobinHood confirms they are preventing sales of ""certain securities"" including GME, AMC, BB and NOK. This is not due to a technical issue."|0|[]|1.0|https://www.reddit.com/r/wallstreetbets/comments/l72aui/robinhood_confirms_they_are_preventing_sales_of/|some_ads|7|self|{'enabled': False, 'images': [{'id': 'KsI7ZV0ljEo-faRt37BOv19ZjFMFh3OAxfyktHWcwx0', 'resolutions': [{'height': 60, 'url': 'https://external-preview.redd.it/H-mH1RJWhPVKNxOaO4DAiMn80l2wGBWJPItJh9Ggvcg.jpg?width=108&amp;crop=smart&amp;auto=webp&amp;s=2c9b90ef2a56ede064f0ae8e2204491b7876d387', 'width': 108}, {'height': 121, 'url': 'https://external-preview.redd.it/H-mH1RJWhPVKNxOaO4DAiMn80l2wGBWJPItJh9Ggvcg.jpg?width=216&amp;crop=smart&amp;auto=webp&amp;s=3c41af5f5f3a1982ca662b2c7a205641e872eb44', 'width': 216}, {'height': 180, 'url': 'https://external-preview.redd.it/H-mH1RJWhPVKNxOaO4DAiMn80l2wGBWJPItJh9Ggvcg.jpg?width=320&amp;crop=smart&amp;auto=webp&amp;s=3edaa59e70f48867af4c4500433357a320ed98d8', 'width': 320}, {'height': 360, 'url': 'https://external-preview.redd.it/H-mH1RJWhPVKNxOaO4DAiMn80l2wGBWJPItJh9Ggvcg.jpg?width=640&amp;crop=smart&amp;auto=webp&amp;s=68ad148929a2d0a5ddd42c930588a69684d39e54', 'width': 640}, {'height': 540, 'url': 'https://external-preview.redd.it/H-mH1RJWhPVKNxOaO4DAiMn80l2wGBWJPItJh9Ggvcg.jpg?width=960&amp;crop=smart&amp;auto=webp&amp;s=e6dbbc81316299588644300bedac46759b7585ef', 'width': 960}, {'height': 607, 'url': 'https://external-preview.redd.it/H-mH1RJWhPVKNxOaO4DAiMn80l2wGBWJPItJh9Ggvcg.jpg?width=1080&amp;crop=smart&amp;auto=webp&amp;s=dfb27e448cdd55d310d84db7abe254c4dd21bd5d', 'width': 1080}], 'source': {'height': 844, 'url': 'https://external-preview.redd.it/H-mH1RJWhPVKNxOaO4DAiMn80l2wGBWJPItJh9Ggvcg.jpg?auto=webp&amp;s=0dd6e1165b9525af2cc7444e50844055c73dde4f', 'width': 1500}, 'variants': {}}]}||||2021-01-28|CTRM
[]|False|hasan1982||[]||text|t2_fmtg9|False|False|[]|False|False|2021-01-28 16:58:55|self.wallstreetbets|https://www.reddit.com/r/wallstreetbets/comments/l729on/we_can_not_buy_any_of_these_stocks_from_rh_aal/|{}|l729on|True|False|False|False|True|True|False|#ffb000|news|[{'e': 'text', 't': 'News'}]|519c3d26-4acc-11eb-8ce2-0ec530aa616d|News|light|richtext|False||False|True|11|0|False|some_ads|/r/wallstreetbets/comments/l729on/we_can_not_buy_any_of_these_stocks_from_rh_aal/|False|7|1611853285|1|"This is what RH saying   ""We continuously monitor the markets and make changes where necessary. In light of recent volatility, we are restricting transactions for certain securities to position closing only, including $AAL, $AMC, $BB, $BBBY, $CTRM, $EXPR, $GME, $KOSS, $NAKD, $NOK, $SNDL, $TR, and $TRVG. We also raised margin requirements for certain securities.""  [https://blog.robinhood.com/news/2021/1/28/keeping-customers-informed-through-market-volatility](https://blog.robinhood.com/news/2021/1/28/keeping-customers-informed-through-market-volatility)\-----  &amp;#x200B;  I think this app needs to be abundant and any app that doing the same, this market should be open and we are free to buy and sell any stock with no limitation."|False|False|False|wallstreetbets|t5_2th52|4737270|public|confidence|self|||We can not buy any of these stocks from RH $AAL, $AMC, $BB, $BBBY, $CTRM, $EXPR, $GME, $KOSS, $NAKD, $NOK, $SNDL, $TR, and $TRVG.|0|[]|1.0|https://www.reddit.com/r/wallstreetbets/comments/l729on/we_can_not_buy_any_of_these_stocks_from_rh_aal/|some_ads|7|self|{'enabled': False, 'images': [{'id': 'KsI7ZV0ljEo-faRt37BOv19ZjFMFh3OAxfyktHWcwx0', 'resolutions': [{'height': 60, 'url': 'https://external-preview.redd.it/H-mH1RJWhPVKNxOaO4DAiMn80l2wGBWJPItJh9Ggvcg.jpg?width=108&amp;crop=smart&amp;auto=webp&amp;s=2c9b90ef2a56ede064f0ae8e2204491b7876d387', 'width': 108}, {'height': 121, 'url': 'https://external-preview.redd.it/H-mH1RJWhPVKNxOaO4DAiMn80l2wGBWJPItJh9Ggvcg.jpg?width=216&amp;crop=smart&amp;auto=webp&amp;s=3c41af5f5f3a1982ca662b2c7a205641e872eb44', 'width': 216}, {'height': 180, 'url': 'https://external-preview.redd.it/H-mH1RJWhPVKNxOaO4DAiMn80l2wGBWJPItJh9Ggvcg.jpg?width=320&amp;crop=smart&amp;auto=webp&amp;s=3edaa59e70f48867af4c4500433357a320ed98d8', 'width': 320}, {'height': 360, 'url': 'https://external-preview.redd.it/H-mH1RJWhPVKNxOaO4DAiMn80l2wGBWJPItJh9Ggvcg.jpg?width=640&amp;crop=smart&amp;auto=webp&amp;s=68ad148929a2d0a5ddd42c930588a69684d39e54', 'width': 640}, {'height': 540, 'url': 'https://external-preview.redd.it/H-mH1RJWhPVKNxOaO4DAiMn80l2wGBWJPItJh9Ggvcg.jpg?width=960&amp;crop=smart&amp;auto=webp&amp;s=e6dbbc81316299588644300bedac46759b7585ef', 'width': 960}, {'height': 607, 'url': 'https://external-preview.redd.it/H-mH1RJWhPVKNxOaO4DAiMn80l2wGBWJPItJh9Ggvcg.jpg?width=1080&amp;crop=smart&amp;auto=webp&amp;s=dfb27e448cdd55d310d84db7abe254c4dd21bd5d', 'width': 1080}], 'source': {'height': 844, 'url': 'https://external-preview.redd.it/H-mH1RJWhPVKNxOaO4DAiMn80l2wGBWJPItJh9Ggvcg.jpg?auto=webp&amp;s=0dd6e1165b9525af2cc7444e50844055c73dde4f', 'width': 1500}, 'variants': {}}]}||||2021-01-28|CTRM
[]|False|LRob0416||[]||text|t2_43x6kot1|False|False|[]|False|False|2021-01-28 16:51:11|self.wallstreetbets|https://www.reddit.com/r/wallstreetbets/comments/l721k0/robinhood_and_democratizing_trading/|{}|l721k0|True|False|False|False|True|True|False|#800080|question|[{'e': 'text', 't': 'Discussion'}]|96f6c79e-b853-11e5-a4cb-0ebdf030e05d|Discussion|light|richtext|False||False|True|1|0|False|some_ads|/r/wallstreetbets/comments/l721k0/robinhood_and_democratizing_trading/|False|7|1611852758|1|“At Robinhood, we believe the financial system should be built to work for everyone. That’s why we create products that let you start investing at your own pace, on your own terms.”  “Join us and build the financial system for everyone.”  “Our mission at Robinhood is to democratize finance for all. We’re proud to have created a platform that has helped everyday people, from all backgrounds, shape their financial futures and invest for the long term.”  These quotes are pulled straight from Robinhood’s website. Clearly, they are blatant lies as Robinhood does not care for the “everyday person,” they do not want the “financial system to work for everyone.” We are the every day people. We are the ones who are building a new financial system that is truly for everyone. The only thing Robinhood is worried about are the hedge funds they sell their order flow too and regulators who have most likely put Robinhood under a microscope.  These quotes should be taken off the Robinhood website. We’ve decided to set our “own terms”, that we will not let short selling hedge funds profit off destroying companies. They can continue to collude amongst themselves, let them continue to push their agendas about $GME, $AMC, etc. They’ll see that the “financial future” involves them getting the short squeezed for all their tendies. Their market manipulation won’t stop us from going to another brokerage and buying whatever companies we want.  You’re telling me that on Robinhood I can trade 1.5x LEVERAGE VOLATILITY ETFS but I can’t buy $AAL, $AMC, $BB, $BBY, $CTRM, $EXPR, $GME, $KOSS, $NAKD, $NOK, $SNDL, $TR, and $TRVG BECAUSE OF VOLATILITY????   I know much of what I’m saying has already been said and is being said on this subreddit and literally by every other person on this earth with a brain. The only thing I want is for Robinhood to change their website. Take this bullshit off of it; these pretentious, do-good, pat on the back quotes about their brokerage are an absolute joke. So I’m going to keep buying AAL, $AMC, $BB, $BBY, $CTRM, $EXPR, $GME, $KOSS, $NAKD, $NOK, $SNDL, $TR, and $TRVG on another brokerage until Robinhood changes their website.  TLDR; fuck robinhood.|True|False|False|wallstreetbets|t5_2th52|4725900|public|confidence|self|||Robinhood and Democratizing Trading|0|[]|1.0|https://www.reddit.com/r/wallstreetbets/comments/l721k0/robinhood_and_democratizing_trading/|some_ads|7||||||2021-01-28|CTRM
[]|False|bgj556||[]||text|t2_nr1r0|False|False|[]|False|False|2021-01-28 16:46:32|self.wallstreetbets|https://www.reddit.com/r/wallstreetbets/comments/l71wvd/robinhood_message_to_gme_and_other_stocks_being/|{}|l71wvd|True|False|False|False|True|True|False|#ffb000|news|[{'e': 'text', 't': 'News'}]|519c3d26-4acc-11eb-8ce2-0ec530aa616d|News|light|richtext|False||False|True|1|0|False|some_ads|/r/wallstreetbets/comments/l71wvd/robinhood_message_to_gme_and_other_stocks_being/|False|7|1611852402|1|Here’s what Robinhood just put out. Saying [keeping customers informed.](https://imgur.com/gallery/pK73AVy) they blame volatility. No shit Sherlock everyone and their dog knew this why do pull a bitch move and take it off your platform (can’t even find CTRM). Are you on Citadels dick so much you hurt your users. RH are conforming to the citadels of the world, like a bunch of prosties getting a $5 for a hand job.|True|False|False|wallstreetbets|t5_2th52|4719059|public|confidence|self|||Robinhood message to GME and other stocks being restricted|0|[]|1.0|https://www.reddit.com/r/wallstreetbets/comments/l71wvd/robinhood_message_to_gme_and_other_stocks_being/|some_ads|7|self|{'enabled': False, 'images': [{'id': '3zjJHTRQLOj4DtFcahAsMmPyviV0ybXcMQsDLv3Nh_A', 'resolutions': [{'height': 216, 'url': 'https://external-preview.redd.it/MbqN633a-KXTGKRLSQ8EdZIx-scxxDcZXf2kQ5xcBYE.jpg?width=108&amp;crop=smart&amp;auto=webp&amp;s=6da5b8a5fa6e939c55e5f164c027f16f7110756c', 'width': 108}, {'height': 432, 'url': 'https://external-preview.redd.it/MbqN633a-KXTGKRLSQ8EdZIx-scxxDcZXf2kQ5xcBYE.jpg?width=216&amp;crop=smart&amp;auto=webp&amp;s=c9e5057a6936f2f5696d2be137b497514e4902cf', 'width': 216}, {'height': 640, 'url': 'https://external-preview.redd.it/MbqN633a-KXTGKRLSQ8EdZIx-scxxDcZXf2kQ5xcBYE.jpg?width=320&amp;crop=smart&amp;auto=webp&amp;s=bc6a1f766bded5edf40335e4970a7491005fa0fe', 'width': 320}, {'height': 1280, 'url': 'https://external-preview.redd.it/MbqN633a-KXTGKRLSQ8EdZIx-scxxDcZXf2kQ5xcBYE.jpg?width=640&amp;crop=smart&amp;auto=webp&amp;s=97ce382369d09e917e199eab811af5b257741f58', 'width': 640}, {'height': 1920, 'url': 'https://external-preview.redd.it/MbqN633a-KXTGKRLSQ8EdZIx-scxxDcZXf2kQ5xcBYE.jpg?width=960&amp;crop=smart&amp;auto=webp&amp;s=df20fa47cad26ca692652944808e6dac08e9fa9c', 'width': 960}], 'source': {'height': 2048, 'url': 'https://external-preview.redd.it/MbqN633a-KXTGKRLSQ8EdZIx-scxxDcZXf2kQ5xcBYE.jpg?auto=webp&amp;s=c1a9a78747ea3eeb77d38467c9b52ccccfe6dfa6', 'width': 960}, 'variants': {}}]}||||2021-01-28|CTRM
[]|False|Tjohn184||[]||text|t2_11gs3v|False|False|[]|False|False|2021-01-28 16:46:24|self.wallstreetbets|https://www.reddit.com/r/wallstreetbets/comments/l71wrb/fuck_you_robinhood/|{}|l71wrb|True|False|False|False|True|True|False|#ffb000|news|[{'e': 'text', 't': 'News'}]|519c3d26-4acc-11eb-8ce2-0ec530aa616d|News|light|richtext|False||False|True|6|0|False|some_ads|/r/wallstreetbets/comments/l71wrb/fuck_you_robinhood/|False|7|1611852395|1|Now it's $AAL, $AMC, $BB, $BBY, $CTRM, $EXPR, $GME, $KOSS, $NAKD, $NOK, $SNDL, $TR, and $TRVG.|True|False|False|wallstreetbets|t5_2th52|4718924|public|confidence|self|||FUCK YOU Robinhood|0|[]|1.0|https://www.reddit.com/r/wallstreetbets/comments/l71wrb/fuck_you_robinhood/|some_ads|7||||||2021-01-28|CTRM
[]|False|Kroto86||[]||text|t2_atn0t|False|False|[]|False|False|2021-01-28 16:44:33|self.wallstreetbets|https://www.reddit.com/r/wallstreetbets/comments/l71uso/fuck_you_rh/|{}|l71uso|True|False|False|False|True|True|False|#ffb000|news|[{'e': 'text', 't': 'News'}]|519c3d26-4acc-11eb-8ce2-0ec530aa616d|News|light|richtext|False||False|False|3|0|False|some_ads|/r/wallstreetbets/comments/l71uso/fuck_you_rh/|False|7|1611852284|1|   Our mission at Robinhood is to democratize finance for all. We’re proud to have created a platform that has helped everyday people, from all backgrounds, shape their financial futures and invest for the long term.   We continuously monitor the markets and make changes where necessary. In light of recent volatility, we are restricting transactions for certain securities to position closing only, including $AAL, $AMC, $BB, $BBBY, $CTRM, $EXPR, $GME, $KOSS, $NAKD, $NOK, $SNDL, $TR, and $TRVG. We also raised margin requirements for certain securities.  Amid significant market volatility, it’s important as ever that we help customers stay informed. That’s why we’re committed to providing people with educational resources. We recently[ revamped and expanded](https://blog.robinhood.com/news/2021/1/15/robinhood-learnthe-building-blocks-of-your-financial-journey) Robinhood[ Learn](https://learn.robinhood.com/) to help people take advantage of the hundreds of financial resources we offer and educate themselves, including how to[ make sense of a volatile market](https://learn.robinhood.com/articles/the-stock-market-has-been-super-volatile-how-can-i-make-sense-of-it/). In 2020, more than 3.2 million people read our articles through Robinhood Learn.  We’re committed to helping our customers navigate this uncertainty. We fundamentally believe that everyone should have access to financial markets. We’re humbled to have helped many people invest in the markets for the first time. And we’re determined to provide new and experienced investors with the tools and resources to help them invest responsibly for their long-term financial futures.|True|False|False|wallstreetbets|t5_2th52|4716953|public|confidence|self|||FUCK YOU RH|0|[]|1.0|https://www.reddit.com/r/wallstreetbets/comments/l71uso/fuck_you_rh/|some_ads|7|self|{'enabled': False, 'images': [{'id': 'VsPt9Sh-HWiDDAWx3FtST9aiWZg_3M5ejig7Tap6kVA', 'resolutions': [{'height': 60, 'url': 'https://external-preview.redd.it/iqSoepSXi5WE3IPl7UoRTdOGJuWD9eIEfkwRZmGP8oA.jpg?width=108&amp;crop=smart&amp;auto=webp&amp;s=cf34533b58b3b7dd840935f24587bf20ef9d184a', 'width': 108}, {'height': 121, 'url': 'https://external-preview.redd.it/iqSoepSXi5WE3IPl7UoRTdOGJuWD9eIEfkwRZmGP8oA.jpg?width=216&amp;crop=smart&amp;auto=webp&amp;s=b93b3e8da5ede3745d33e81a65e0451bb6a83b43', 'width': 216}, {'height': 180, 'url': 'https://external-preview.redd.it/iqSoepSXi5WE3IPl7UoRTdOGJuWD9eIEfkwRZmGP8oA.jpg?width=320&amp;crop=smart&amp;auto=webp&amp;s=7b6e87726396ed158bd2039baa0ea8f7c639f17e', 'width': 320}, {'height': 360, 'url': 'https://external-preview.redd.it/iqSoepSXi5WE3IPl7UoRTdOGJuWD9eIEfkwRZmGP8oA.jpg?width=640&amp;crop=smart&amp;auto=webp&amp;s=b7a262d405eb2156d3fbe83b0568bb3e677c53aa', 'width': 640}, {'height': 540, 'url': 'https://external-preview.redd.it/iqSoepSXi5WE3IPl7UoRTdOGJuWD9eIEfkwRZmGP8oA.jpg?width=960&amp;crop=smart&amp;auto=webp&amp;s=e73d5ff162b500db1118c9d805dcdefcb6231849', 'width': 960}, {'height': 607, 'url': 'https://external-preview.redd.it/iqSoepSXi5WE3IPl7UoRTdOGJuWD9eIEfkwRZmGP8oA.jpg?width=1080&amp;crop=smart&amp;auto=webp&amp;s=611d3d52e8f85f3b64ab0e8badd975f574e95ee6', 'width': 1080}], 'source': {'height': 844, 'url': 'https://external-preview.redd.it/iqSoepSXi5WE3IPl7UoRTdOGJuWD9eIEfkwRZmGP8oA.jpg?auto=webp&amp;s=8c747479c0bff1e7b35da016f74c53f7874eb14f', 'width': 1500}, 'variants': {}}]}||||2021-01-28|CTRM
[]|False|Terrible_Capital_604||[]||text|t2_7a7tbayh|False|False|[]|False|False|2021-01-28 16:42:29|self.wallstreetbets|https://www.reddit.com/r/wallstreetbets/comments/l71sn0/robinhoods_message_on_volatility/|{}|l71sn0|True|False|False|False|True|True|False|#ffb000|news|[{'e': 'text', 't': 'News'}]|519c3d26-4acc-11eb-8ce2-0ec530aa616d|News|light|richtext|False||False|False|6|0|False|some_ads|/r/wallstreetbets/comments/l71sn0/robinhoods_message_on_volatility/|False|7|1611852162|1|In case it hasn’t been posted and for all to see what their excuse is...  “Our mission at Robinhood is to democratize finance for all. We’re proud to have created a platform that has helped everyday people, from all backgrounds, shape their financial futures and invest for the long term.   We continuously monitor the markets and make changes where necessary. In light of recent volatility, we are restricting transactions for certain securities to position closing only, including $AAL, $AMC, $BB, $BBY, $CTRM, $EXPR, $GME, $KOSS, $NAKD, $NOK, $SNDL, $TR, and $TRVG. We also raised margin requirements for certain securities.  Amid significant market volatility, it’s important as ever that we help customers stay informed. That’s why we’re committed to providing people with educational resources. We recently revamped and expanded Robinhood Learn to help people take advantage of the hundreds of financial resources we offer and educate themselves, including how to make sense of a volatile market. In 2020, more than 3.2 million people read our articles through Robinhood Learn.  We’re committed to helping our customers navigate this uncertainty. We fundamentally believe that everyone should have access to financial markets. We’re humbled to have helped many people invest in the markets for the first time. And we’re determined to provide new and experienced investors with the tools and resources to help them invest responsibly for their long-term financial futures. “|True|False|False|wallstreetbets|t5_2th52|4715078|public|confidence|self|||RobinHoods Message on Volatility|0|[]|1.0|https://www.reddit.com/r/wallstreetbets/comments/l71sn0/robinhoods_message_on_volatility/|some_ads|7||||||2021-01-28|CTRM
[]|False|FellOffMyLapras||[]||text|t2_zu47f|False|False|[]|False|False|2021-01-28 16:31:34|self.wallstreetbets|https://www.reddit.com/r/wallstreetbets/comments/l71gq3/sens_should_be_the_next_move_39_short_interest/|{}|l71gq3|True|False|False|False|True|True|False|#800080|question|[{'e': 'text', 't': 'Discussion'}]|96f6c79e-b853-11e5-a4cb-0ebdf030e05d|Discussion|light|richtext|False||False|True|52|0|False|some_ads|/r/wallstreetbets/comments/l71gq3/sens_should_be_the_next_move_39_short_interest/|False|7|1611851505|1|https://www.google.com/amp/s/www.marketwatch.com/amp/story/check-out-the-most-heavily-shorted-stocks-this-yeargamestop-tops-the-list-11611777492  They blocked off GME, AMC, BB, and NOK. I think SENS will make a better squeeze than the ones being pumped in NAKD, CTRM, and SNDL. Lets raise money for diabetes while squeezing them out of this position as well!!   What do you guys think? Should we get this one going?|True|False|False|wallstreetbets|t5_2th52|4703905|public|confidence|self|||SENS should be the next move. 39% short interest and currently 2.4 a share.|0|[]|1.0|https://www.reddit.com/r/wallstreetbets/comments/l71gq3/sens_should_be_the_next_move_39_short_interest/|some_ads|7|self|{'enabled': False, 'images': [{'id': 'Dl-qO2MQiLPyMz4mfwk9TJ9N9A_LuKRhB7DgTUSArS0', 'resolutions': [{'height': 54, 'url': 'https://external-preview.redd.it/NN0cFceDCfnpxJ99SN6CXYh1H61351pDN-ugqOfmld8.jpg?width=108&amp;crop=smart&amp;auto=webp&amp;s=dd00e84231aa66efa20197468d198461e704bf3c', 'width': 108}, {'height': 108, 'url': 'https://external-preview.redd.it/NN0cFceDCfnpxJ99SN6CXYh1H61351pDN-ugqOfmld8.jpg?width=216&amp;crop=smart&amp;auto=webp&amp;s=e7ab4177a540108035370a2cd9d5a34326a4b597', 'width': 216}, {'height': 160, 'url': 'https://external-preview.redd.it/NN0cFceDCfnpxJ99SN6CXYh1H61351pDN-ugqOfmld8.jpg?width=320&amp;crop=smart&amp;auto=webp&amp;s=3ec359ff4449c6b2f2ed13e6c1bdbe80ebb8821d', 'width': 320}, {'height': 320, 'url': 'https://external-preview.redd.it/NN0cFceDCfnpxJ99SN6CXYh1H61351pDN-ugqOfmld8.jpg?width=640&amp;crop=smart&amp;auto=webp&amp;s=b43b1ff23c4c84680037a89df0e73da607fcf2c7', 'width': 640}, {'height': 480, 'url': 'https://external-preview.redd.it/NN0cFceDCfnpxJ99SN6CXYh1H61351pDN-ugqOfmld8.jpg?width=960&amp;crop=smart&amp;auto=webp&amp;s=046f71f931881c2bd55e71ae7eb0558efc2af8f6', 'width': 960}, {'height': 540, 'url': 'https://external-preview.redd.it/NN0cFceDCfnpxJ99SN6CXYh1H61351pDN-ugqOfmld8.jpg?width=1080&amp;crop=smart&amp;auto=webp&amp;s=0270798924c6fa07a5b0c8d29d0d3a543ac2dcd6', 'width': 1080}], 'source': {'height': 640, 'url': 'https://external-preview.redd.it/NN0cFceDCfnpxJ99SN6CXYh1H61351pDN-ugqOfmld8.jpg?auto=webp&amp;s=b8a2a2fb0a7e8fb8900c2f0a6b739d238a821ed7', 'width': 1280}, 'variants': {}}]}||||2021-01-28|CTRM
[]|False|Heavy-Meta||[]||text|t2_7jtn47r4|False|True|[]|False|False|2021-01-28 16:24:50|self.wallstreetbets|https://www.reddit.com/r/wallstreetbets/comments/l719is/statement_from_rh_on_cutting_off_trading/|{}|l719is|True|False|False|False|True|True|False|#ffb000|news|[{'e': 'text', 't': 'News'}]|519c3d26-4acc-11eb-8ce2-0ec530aa616d|News|light|richtext|False||False|False|14|0|False|some_ads|/r/wallstreetbets/comments/l719is/statement_from_rh_on_cutting_off_trading/|False|7|1611851124|1|[“Keeping Customers Informed Through Market Volatility”](https://blog.robinhood.com/news/2021/1/28/keeping-customers-informed-through-market-volatility)  “Our mission at Robinhood is to democratize finance for all. We’re proud to have created a platform that has helped everyday people, from all backgrounds, shape their financial futures and invest for the long term.   We continuously monitor the markets and make changes where necessary. In light of recent volatility, we are restricting transactions for certain securities to position closing only, including $AAL, $AMC, $BB, $BBY, $CTRM, $EXPR, $GME, $KOSS, $NAKD, $NOK, $SNDL, $TR, and $TRVG. We also raised margin requirements for certain securities.”  Real fucking rich. They really started this off with “democratize finance for all.”  They’re in deep with the fat cats of Wall Street. RobinHood is now a painfully ironic name since they apparently want to steal from the poor and give to the rich.   Closing my account as soon as I’m ready to move on from my positions.|True|False|False|wallstreetbets|t5_2th52|4697469|public|confidence|self|||Statement from RH on cutting off trading|0|[]|1.0|https://www.reddit.com/r/wallstreetbets/comments/l719is/statement_from_rh_on_cutting_off_trading/|some_ads|7|self|{'enabled': False, 'images': [{'id': 'KsI7ZV0ljEo-faRt37BOv19ZjFMFh3OAxfyktHWcwx0', 'resolutions': [{'height': 60, 'url': 'https://external-preview.redd.it/H-mH1RJWhPVKNxOaO4DAiMn80l2wGBWJPItJh9Ggvcg.jpg?width=108&amp;crop=smart&amp;auto=webp&amp;s=2c9b90ef2a56ede064f0ae8e2204491b7876d387', 'width': 108}, {'height': 121, 'url': 'https://external-preview.redd.it/H-mH1RJWhPVKNxOaO4DAiMn80l2wGBWJPItJh9Ggvcg.jpg?width=216&amp;crop=smart&amp;auto=webp&amp;s=3c41af5f5f3a1982ca662b2c7a205641e872eb44', 'width': 216}, {'height': 180, 'url': 'https://external-preview.redd.it/H-mH1RJWhPVKNxOaO4DAiMn80l2wGBWJPItJh9Ggvcg.jpg?width=320&amp;crop=smart&amp;auto=webp&amp;s=3edaa59e70f48867af4c4500433357a320ed98d8', 'width': 320}, {'height': 360, 'url': 'https://external-preview.redd.it/H-mH1RJWhPVKNxOaO4DAiMn80l2wGBWJPItJh9Ggvcg.jpg?width=640&amp;crop=smart&amp;auto=webp&amp;s=68ad148929a2d0a5ddd42c930588a69684d39e54', 'width': 640}, {'height': 540, 'url': 'https://external-preview.redd.it/H-mH1RJWhPVKNxOaO4DAiMn80l2wGBWJPItJh9Ggvcg.jpg?width=960&amp;crop=smart&amp;auto=webp&amp;s=e6dbbc81316299588644300bedac46759b7585ef', 'width': 960}, {'height': 607, 'url': 'https://external-preview.redd.it/H-mH1RJWhPVKNxOaO4DAiMn80l2wGBWJPItJh9Ggvcg.jpg?width=1080&amp;crop=smart&amp;auto=webp&amp;s=dfb27e448cdd55d310d84db7abe254c4dd21bd5d', 'width': 1080}], 'source': {'height': 844, 'url': 'https://external-preview.redd.it/H-mH1RJWhPVKNxOaO4DAiMn80l2wGBWJPItJh9Ggvcg.jpg?auto=webp&amp;s=0dd6e1165b9525af2cc7444e50844055c73dde4f', 'width': 1500}, 'variants': {}}]}||||2021-01-28|CTRM
