all_awardings|allow_live_comments|author|author_flair_css_class|author_flair_richtext|author_flair_text|author_flair_type|author_fullname|author_patreon_flair|author_premium|awarders|can_mod_post|contest_mode|created_utc|domain|full_link|gildings|id|is_crosspostable|is_meta|is_original_content|is_reddit_media_domain|is_robot_indexable|is_self|is_video|link_flair_background_color|link_flair_css_class|link_flair_richtext|link_flair_template_id|link_flair_text|link_flair_text_color|link_flair_type|locked|media_metadata|media_only|no_follow|num_comments|num_crossposts|over_18|parent_whitelist_status|permalink|pinned|pwls|retrieved_on|score|selftext|send_replies|spoiler|stickied|subreddit|subreddit_id|subreddit_subscribers|subreddit_type|suggested_sort|thumbnail|thumbnail_height|thumbnail_width|title|total_awards_received|treatment_tags|upvote_ratio|url|whitelist_status|wls|post_hint|preview|author_flair_background_color|author_flair_text_color|gilded|date|ticker
[]|False|Sleeper4G63||[]||text|t2_pq0fp|False|False|[]|False|False|2021-01-28 14:28:22|self.wallstreetbets|https://www.reddit.com/r/wallstreetbets/comments/l6xyrt/robinhood_blocking_trading_on_multiple_tickers/|{}|l6xyrt|True|False|False|False|True|True|False|#800080|question|[{'e': 'text', 't': 'Discussion'}]|96f6c79e-b853-11e5-a4cb-0ebdf030e05d|Discussion|light|richtext|False||False|True|0|0|False|some_ads|/r/wallstreetbets/comments/l6xyrt/robinhood_blocking_trading_on_multiple_tickers/|False|7|1611844113|1|Now $CTRM is locked out from buying, WTF is going on?!|True|False|False|wallstreetbets|t5_2th52|4571758|public|confidence|self|||@Robinhood Blocking Trading on Multiple Tickers|0|[]|1.0|https://www.reddit.com/r/wallstreetbets/comments/l6xyrt/robinhood_blocking_trading_on_multiple_tickers/|some_ads|7||||||2021-01-28|CTRM
[]|False|frauzter||[]||text|t2_5y7tdz0d|False|False|[]|False|False|2021-01-28 14:27:54|self.wallstreetbets|https://www.reddit.com/r/wallstreetbets/comments/l6xyb7/ctrm/|{}|l6xyb7|True|False|False|False|True|True|False|#ffb000|news|[{'e': 'text', 't': 'News'}]|519c3d26-4acc-11eb-8ce2-0ec530aa616d|News|light|richtext|False||False|True|1|0|False|some_ads|/r/wallstreetbets/comments/l6xyb7/ctrm/|False|7|1611844084|1|Ctrm?|True|False|False|wallstreetbets|t5_2th52|4571060|public|confidence|self|||Ctrm|0|[]|1.0|https://www.reddit.com/r/wallstreetbets/comments/l6xyb7/ctrm/|some_ads|7||||||2021-01-28|CTRM
[]|False|frauzter||[]||text|t2_5y7tdz0d|False|False|[]|False|False|2021-01-28 14:26:19|self.wallstreetbets|https://www.reddit.com/r/wallstreetbets/comments/l6xwv0/ctrm/|{}|l6xwv0|True|False|False|False|True|True|False|#ffb000|news|[{'e': 'text', 't': 'News'}]|519c3d26-4acc-11eb-8ce2-0ec530aa616d|News|light|richtext|False||False|False|0|0|False|some_ads|/r/wallstreetbets/comments/l6xwv0/ctrm/|False|7|1611843990|1|Ctrm?|True|False|False|wallstreetbets|t5_2th52|4568726|public|confidence|self|||Ctrm|0|[]|1.0|https://www.reddit.com/r/wallstreetbets/comments/l6xwv0/ctrm/|some_ads|7||||||2021-01-28|CTRM
[]|False|b2obq||[]||text|t2_a10ysmky|False|False|[]|False|False|2021-01-28 14:24:57|self.wallstreetbets|https://www.reddit.com/r/wallstreetbets/comments/l6xvmo/hey_guys/|{}|l6xvmo|True|False|False|False|True|True|False|#349e48|profit|[{'e': 'text', 't': 'Gain'}]|6bd9394c-0a95-11e9-82db-0eb3a11267a0|Gain|light|richtext|False||False|True|3|0|False|some_ads|/r/wallstreetbets/comments/l6xvmo/hey_guys/|False|7|1611843907|1|Hello i would like to see your support for CTRM i am a young immigrant in canada and i have invested my money in helping my family in africa long live the misery i know that your are the hope the good cause thnks|True|False|False|wallstreetbets|t5_2th52|4566686|public|confidence|self|||Hey guys|0|[]|1.0|https://www.reddit.com/r/wallstreetbets/comments/l6xvmo/hey_guys/|some_ads|7||||||2021-01-28|CTRM
[]|False|gugu933||[]||text|t2_n1bjx|False|False|[]|False|False|2021-01-28 14:19:38|self.wallstreetbets|https://www.reddit.com/r/wallstreetbets/comments/l6xqz5/silverlake_just_sold_600m_convertable_stock_lets/|{}|l6xqz5|True|False|False|False|True|True|False|#0392cf|yolo|[{'e': 'text', 't': 'YOLO'}]|da18a43a-83c5-11e8-9b6c-0e287561ddb8|YOLO|light|richtext|False||False|True|0|0|False|some_ads|/r/wallstreetbets/comments/l6xqz5/silverlake_just_sold_600m_convertable_stock_lets/|False|7|1611843589|1|SO yeah basically the headline. LETS GO CTRM|True|False|False|wallstreetbets|t5_2th52|4558777|public|confidence|self|||SILVERLAKE JUST SOLD 600M convertable STOCK LETS CTRM!|0|[]|1.0|https://www.reddit.com/r/wallstreetbets/comments/l6xqz5/silverlake_just_sold_600m_convertable_stock_lets/|some_ads|7||||||2021-01-28|CTRM
[]|False|Zeigan2||[]||text|t2_9pqp6z4s|False|False|[]|False|False|2021-01-28 14:18:32|self.wallstreetbets|https://www.reddit.com/r/wallstreetbets/comments/l6xq12/tesla/|{}|l6xq12|True|False|False|False|True|True|False|#0392cf|yolo|[{'e': 'text', 't': 'YOLO'}]|da18a43a-83c5-11e8-9b6c-0e287561ddb8|YOLO|light|richtext|False||False|True|4|0|False|some_ads|/r/wallstreetbets/comments/l6xq12/tesla/|False|7|1611843523|1|Since they blocked us from buying more shares of GameStop amc and ctrm let’s go all on for Tesla’s|True|False|False|wallstreetbets|t5_2th52|4557077|public|confidence|self|||Tesla🎉🎉|0|[]|1.0|https://www.reddit.com/r/wallstreetbets/comments/l6xq12/tesla/|some_ads|7||||||2021-01-28|CTRM
[]|False|ATXNative07||[]||text|t2_3rktkg5f|False|False|[]|False|False|2021-01-28 14:06:54|self.wallstreetbets|https://www.reddit.com/r/wallstreetbets/comments/l6xg1s/ctrm/|{}|l6xg1s|True|False|False|False|True|True|False|#0392cf|yolo|[{'e': 'text', 't': 'YOLO'}]|da18a43a-83c5-11e8-9b6c-0e287561ddb8|YOLO|light|richtext|False||False|True|0|0|False|some_ads|/r/wallstreetbets/comments/l6xg1s/ctrm/|False|7|1611842826|1|CTRM Skyrocketed afterhours and plummeted pre market. HEDGES are all over it. TIME TO PUMP ONE OF THEIR TARGET STOCKS|True|False|False|wallstreetbets|t5_2th52|4540360|public|confidence|self|||CTRM|0|[]|1.0|https://www.reddit.com/r/wallstreetbets/comments/l6xg1s/ctrm/|some_ads|7||||||2021-01-28|CTRM
[]|False|Successful-Region277||[]||text|t2_83czzw4e|False|False|[]|False|False|2021-01-28 14:00:05|self.wallstreetbets|https://www.reddit.com/r/wallstreetbets/comments/l6xa0f/robinhood/|{}|l6xa0f|True|False|False|False|True|True|False|#800080|question|[{'e': 'text', 't': 'Discussion'}]|96f6c79e-b853-11e5-a4cb-0ebdf030e05d|Discussion|light|richtext|False||False|False|6|0|False|some_ads|/r/wallstreetbets/comments/l6xa0f/robinhood/|False|7|1611842417|1|Wtf robinhood says nok, bb, nakd, gme, ctrm, and amc (at least) aren’t supported and can’t be bought? What other apps are y’all using|True|False|False|wallstreetbets|t5_2th52|4530763|public|confidence|self|||Robinhood|0|[]|1.0|https://www.reddit.com/r/wallstreetbets/comments/l6xa0f/robinhood/|some_ads|7||||||2021-01-28|CTRM
[]|False|driverwav||[]||text|t2_6dir3j78|False|False|[]|False|False|2021-01-28 13:50:20|self.wallstreetbets|https://www.reddit.com/r/wallstreetbets/comments/l6x212/gamestop_is_off_rh_whats_next_ctrm/|{}|l6x212|True|False|False|False|True|True|False|#ffb000|news|[{'e': 'text', 't': 'News'}]|519c3d26-4acc-11eb-8ce2-0ec530aa616d|News|light|richtext|False||False|True|3|0|False|some_ads|/r/wallstreetbets/comments/l6x212/gamestop_is_off_rh_whats_next_ctrm/|False|7|1611841830|1|RH isn’t the best platform anyways. How’s everyone feeling about CTRM?|True|False|False|wallstreetbets|t5_2th52|4516830|public|confidence|self|||GameStop is off RH, what’s next? CTRM 🚀|0|[]|1.0|https://www.reddit.com/r/wallstreetbets/comments/l6x212/gamestop_is_off_rh_whats_next_ctrm/|some_ads|7||||||2021-01-28|CTRM
[]|False|vicyedra||[]||text|t2_aa8pc9x|False|False|[]|False|False|2021-01-28 13:49:23|self.wallstreetbets|https://www.reddit.com/r/wallstreetbets/comments/l6x19p/robinhood_restricting_ability_to_buy_amc_gme_to/|{}|l6x19p|True|False|False|False|True|True|False|#0392cf|yolo|[{'e': 'text', 't': 'YOLO'}]|da18a43a-83c5-11e8-9b6c-0e287561ddb8|YOLO|light|richtext|False||False|False|20|0|False|some_ads|/r/wallstreetbets/comments/l6x19p/robinhood_restricting_ability_to_buy_amc_gme_to/|False|7|1611841775|1|Robinhood restricting ability to buy AMC, GME to name a few. Thankfully this is my small account. Webull still allows buying these stocks. Holding for sure.   CTRM is still available on Webull, has begun the squeeze yesterday up over 60%, consider this while you hold GME If on Robinhood.   DO NOT SELL, this is their way of causing mass panic so their contracts expiring today win. Hold and they’ll be on the hook for these shares 🚀🚀🚀🚀|True|False|False|wallstreetbets|t5_2th52|4515477|public|confidence|self|||Robinhood restricting ability to buy AMC, GME to name a few. Switch brokers to teach them a lesson, more 🚀 stocks|0|[]|1.0|https://www.reddit.com/r/wallstreetbets/comments/l6x19p/robinhood_restricting_ability_to_buy_amc_gme_to/|some_ads|7||||||2021-01-28|CTRM
[]|False|Used-Prior-3929||[]||text|t2_7z4vy9ou|False|False|[]|False|False|2021-01-28 13:45:13|self.wallstreetbets|https://www.reddit.com/r/wallstreetbets/comments/l6wxx9/if_any_of_you_have_money_left_after_todays/|{}|l6wxx9|True|False|False|False|True|True|False|#349e48|profit|[{'e': 'text', 't': 'Gain'}]|6bd9394c-0a95-11e9-82db-0eb3a11267a0|Gain|light|richtext|False||False|True|9|0|False|some_ads|/r/wallstreetbets/comments/l6wxx9/if_any_of_you_have_money_left_after_todays/|False|7|1611841525|1|Rank   Symbol   Count   % Change   Price  1      AMC      303    +301.20     19.90        2      NOK      178     +38.48     6.550        3      NAKD     50     +252.31     1.380        4      ATVK     31      -14.89     0.1360       5      GNUS     26      +81.07     3.060        6      ALPP     13      -13.00     3.880        7      KOSS     12     +480.00     58.00        8      SNDL     12       +7.14     0.6000       9      HCMC     10      +33.33     0.001100     10     SHMP     9       +20.47     0.4820       11     PTTN     8       -39.73     0.008800     12     EXPFF    8        -7.61     0.1360       13     ATOS     7       -14.94     2.220        14     SIGN     6      +127.97     0.2781       15     UAPC     6       -27.16     0.01475      16     ZOM      5        -7.67     0.9046       17     CTRM     5       +36.28     0.5315       18     DARE     5       -10.81     2.310        19     ACRX     4        -5.00     2.280        20     CHEK     4       -10.56     1.610        21     TV       4        -8.49     8.080        22     OZSC     4       -26.84     0.1390       23     NAK      3       +10.42     0.5300       24     DPLS     3       -37.84     0.009200     25     JAGX     3       -14.72     2.780        26     WTRH     3        -1.65     3.580        27     TIPS     3       +14.29     0.004000     28     RLFTF    3        -6.25     0.4200       29     CBBT     3       -17.71     0.1645       30     DMNXF    3       +13.82     0.04200      31     NGL      3        +2.93     2.810        32     RVVTF    3        -8.88     0.4571       33     RIG      3       +34.17     3.730        34     TSCRF    3        -5.80     2.110        35     GTXO     3       -33.33     0.06000      36     AITX     3       -10.48     0.1394       37     EXPR     3      +214.14     9.550        38     XELA     3       -12.75     2.190        39     OPTI     3       -23.97     0.1900       40     VS       3        +2.35     7.610|True|False|False|wallstreetbets|t5_2th52|4509629|public|confidence|self|||If any of you have money left after today's catastrophe, try $SHMP. It's a real 🚀 with actual news and credentials.|0|[]|1.0|https://www.reddit.com/r/wallstreetbets/comments/l6wxx9/if_any_of_you_have_money_left_after_todays/|some_ads|7||||||2021-01-28|CTRM
[]|False|popdog-||[]||text|t2_a0oyv078|False|False|[]|False|False|2021-01-28 13:44:44|self.wallstreetbets|https://www.reddit.com/r/wallstreetbets/comments/l6wxjc/robinhood_stopped_supporting_gme_amc_nok_nakd_and/|{}|l6wxjc|True|False|False|False|True|True|False|#ffb000|news|[{'e': 'text', 't': 'News'}]|519c3d26-4acc-11eb-8ce2-0ec530aa616d|News|light|richtext|False||False|True|11|0|False|some_ads|/r/wallstreetbets/comments/l6wxjc/robinhood_stopped_supporting_gme_amc_nok_nakd_and/|False|7|1611841495|1|"Hey boyzz!! Idk if anyone noticed this yet but Robinhood all of the sudden today stopped supporting buying GME, AMC, NOK, NAKD, and CTRM.  NOT only do they provide us with shitty service because it's ""free"" they will also stab us in the back like this. The last time I checked, stocks were a free market where people can buy whatever the hell they want. I will be taking my money elsewhere.  If a market faker was behind the move in these stocks, RH would've never stopped supporting these stocks."|True|False|False|wallstreetbets|t5_2th52|4508885|public|confidence|self|||Robinhood stopped supporting GME, AMC, NOK, NAKD, and CTRM !!!|0|[]|1.0|https://www.reddit.com/r/wallstreetbets/comments/l6wxjc/robinhood_stopped_supporting_gme_amc_nok_nakd_and/|some_ads|7||||||2021-01-28|CTRM
[]|False|PrototypeDeathStar||[]||text|t2_13xdek|False|False|[]|False|False|2021-01-28 13:42:05|self.wallstreetbets|https://www.reddit.com/r/wallstreetbets/comments/l6wvcg/robinhood_is_performing_market_manipulation_with/|{}|l6wvcg|True|False|False|False|True|True|False|||[]|||dark|text|False||False|True|18|0|False|some_ads|/r/wallstreetbets/comments/l6wvcg/robinhood_is_performing_market_manipulation_with/|False|7|1611841336|1|GME, AMC, BB, NOK, and CTRM are all now marked as sell only. All 'normal' stocks can be bought and sold no issue. This is after Robinhood pushed warnings out yesterday to scare shareholders into selling. This is the illegal market manipulation the news should be reporting on.|True|False|False|wallstreetbets|t5_2th52|4504964|public|confidence|self|||Robinhood is performing market manipulation with the hedge funds.|0|[]|1.0|https://www.reddit.com/r/wallstreetbets/comments/l6wvcg/robinhood_is_performing_market_manipulation_with/|some_ads|7||||||2021-01-28|CTRM
[]|False|eucablyat||[]||text|t2_1903gl3h|False|False|[]|False|False|2021-01-28 13:41:35|self.wallstreetbets|https://www.reddit.com/r/wallstreetbets/comments/l6wuya/robinhood_down/|{}|l6wuya|True|False|False|False|True|True|False|#800080|question|[{'e': 'text', 't': 'Discussion'}]|96f6c79e-b853-11e5-a4cb-0ebdf030e05d|Discussion|light|richtext|False||False|True|5|0|False|some_ads|/r/wallstreetbets/comments/l6wuya/robinhood_down/|False|7|1611841306|1|as always i miss out   on shit like this because im  taking a  break from the internet. Serious  Fomo rn. Im  layingg in bed choosing  which stock to load up on while  their relatively low afterhours. But low and behold  i  cant choose any because AMC CTRM and GME all  wont trade  on robinhood? I  cant  even  type anything into the search bar  like they found  out im trying to hop on the train. smh|True|False|False|wallstreetbets|t5_2th52|4504232|public|confidence|self|||ROBINHOOD DOWN?|0|[]|1.0|https://www.reddit.com/r/wallstreetbets/comments/l6wuya/robinhood_down/|some_ads|7||||||2021-01-28|CTRM
[]|False|5gGoblin||[{'e': 'text', 't': '\x1b210109:1:1'}]|210109:1:1|richtext|t2_4ni8gqpb|False|False|[]|False|False|2021-01-28 13:40:13|self.wallstreetbets|https://www.reddit.com/r/wallstreetbets/comments/l6wtug/all_stonks_blocked_on_robinhood/|{}|l6wtug|True|False|False|False|True|True|False|#800080|question|[{'e': 'text', 't': 'Discussion'}]|96f6c79e-b853-11e5-a4cb-0ebdf030e05d|Discussion|light|richtext|False||False|True|3|0|False|some_ads|/r/wallstreetbets/comments/l6wtug/all_stonks_blocked_on_robinhood/|False|7|1611841224|1|We’ve went too far! AMC, BB, GME, NOK even stuff like NAKD, CTRM have all been LOCKED on Robinhood..  WE GOT THEM SHOOK BOIS!!!!|True|False|False|wallstreetbets|t5_2th52|4502259|public|confidence|self|||All stonks blocked on Robinhood!|0|[]|1.0|https://www.reddit.com/r/wallstreetbets/comments/l6wtug/all_stonks_blocked_on_robinhood/|some_ads|7||||dark||2021-01-28|CTRM
[]|False|BekfastBoofie||[]||text|t2_8bsucakz|False|False|[]|False|False|2021-01-28 13:35:01|self.wallstreetbets|https://www.reddit.com/r/wallstreetbets/comments/l6wphs/rh_has_sided_with_the_hedge_funds_here_is_what_we/|{}|l6wphs|True|False|False|False|True|True|False|#800080|question|[{'e': 'text', 't': 'Discussion'}]|96f6c79e-b853-11e5-a4cb-0ebdf030e05d|Discussion|light|richtext|False||False|True|2|0|False|some_ads|/r/wallstreetbets/comments/l6wphs/rh_has_sided_with_the_hedge_funds_here_is_what_we/|False|7|1611840912|1|FELLOW RETARDS,  The time has come to abandon RH trading platform. They have clearly sided against the average person in favor of the rich hedge funds who have been manipulating the market for years.  So far the following stocks are no longer available for purchase on RH:  GME BB NOK CTRM AMC NAKD BBBY  Here is what WE CAN DO.  1. DON’T SELL. HOLD THE FUCKIN LINE TIL THIS GETS SORTED OUT.  2. IF YOU HAVE RH GOLD, CANCEL IT IMMEDIATELY, LETS SHOW THEM THAT WE ARE MORE VALUABLE.  3. BEGIN SWITCHING PLATFORMS, I RECOMMEND WEBULL AS THERE ARE NO LIMITATIONS CURRENTLY.  4. BUY MORE OF THE ABOVE SHARES.|True|False|False|wallstreetbets|t5_2th52|4495246|public|confidence|self|||RH has sided with the Hedge Funds, here is what we know and can do.|0|[]|1.0|https://www.reddit.com/r/wallstreetbets/comments/l6wphs/rh_has_sided_with_the_hedge_funds_here_is_what_we/|some_ads|7||||||2021-01-28|CTRM
[]|False|Virtual-Question6627||[]||text|t2_a0i921ew|False|False|[]|False|False|2021-01-28 13:31:01|self.wallstreetbets|https://www.reddit.com/r/wallstreetbets/comments/l6wm9d/ctrm/|{}|l6wm9d|True|False|False|False|True|True|False|#800080|question|[{'e': 'text', 't': 'Discussion'}]|96f6c79e-b853-11e5-a4cb-0ebdf030e05d|Discussion|light|richtext|False||False|True|1|0|False|some_ads|/r/wallstreetbets/comments/l6wm9d/ctrm/|False|7|1611840672|1|Why is CTRM band on robinhood?|True|False|False|wallstreetbets|t5_2th52|4490134|public|confidence|self|||CTRM|0|[]|1.0|https://www.reddit.com/r/wallstreetbets/comments/l6wm9d/ctrm/|some_ads|7||||||2021-01-28|CTRM
[]|False|popdog-||[]||text|t2_a0oyv078|False|False|[]|False|False|2021-01-28 13:28:50|self.wallstreetbets|https://www.reddit.com/r/wallstreetbets/comments/l6wki9/boycott_robinhood/|{}|l6wki9|True|False|False|False|True|True|False|#ffb000|news|[{'e': 'text', 't': 'News'}]|519c3d26-4acc-11eb-8ce2-0ec530aa616d|News|light|richtext|False||False|True|0|0|False|some_ads|/r/wallstreetbets/comments/l6wki9/boycott_robinhood/|False|7|1611840541|1|"Hey boyzz! Idk if anyone noticed this yet but Robinhood all of the sudden today stopped supporting the buying GME, AMC, NOK, NAK, and CTRM. NOT only do they provide us with shitty service because it's ""free"" they will also stab us in the back like this. The last time I checked, stocks were a free market where people can buy whatever the hell they want. I will be taking my money elsewhere and I hope you do too."|True|False|False|wallstreetbets|t5_2th52|4487394|public|confidence|self|||Boycott Robinhood|0|[]|1.0|https://www.reddit.com/r/wallstreetbets/comments/l6wki9/boycott_robinhood/|some_ads|7||||||2021-01-28|CTRM
[]|False|sparekh0007||[]||text|t2_9yvu2vu5|False|True|[]|False|False|2021-01-28 13:25:34|self.wallstreetbets|https://www.reddit.com/r/wallstreetbets/comments/l6whzy/rh_starting_there_dirty_tricks/|{}|l6whzy|True|False|False|False|True|True|False|#800080|question|[{'e': 'text', 't': 'Discussion'}]|96f6c79e-b853-11e5-a4cb-0ebdf030e05d|Discussion|light|richtext|False||False|True|8|0|False|some_ads|/r/wallstreetbets/comments/l6whzy/rh_starting_there_dirty_tricks/|False|7|1611840345|1|RH starting there shit now. They won’t let people to buy share like GME,bb,nok,ctrm.|True|False|False|wallstreetbets|t5_2th52|4483310|public|confidence|self|||RH starting there dirty tricks|0|[]|1.0|https://www.reddit.com/r/wallstreetbets/comments/l6whzy/rh_starting_there_dirty_tricks/|some_ads|7||||||2021-01-28|CTRM
[]|False|AlonzoSwegalicious||[]||text|t2_hnzuf|False|False|[]|False|False|2021-01-28 13:23:20|self.wallstreetbets|https://www.reddit.com/r/wallstreetbets/comments/l6wgcp/is_anyone_paying_attention_to_ctrm_through_all_of/|{}|l6wgcp|True|False|False|False|True|True|False|||[]|||dark|text|False||False|True|14|0|False|some_ads|/r/wallstreetbets/comments/l6wgcp/is_anyone_paying_attention_to_ctrm_through_all_of/|False|7|1611840211|1|Disclaimer: Not my words. This is the original post by /u/Junior767676   CTRM - A Hidden Gem  Disclaimer- Also do your own DD before investing and do not solely depend on one DD  Current Price - $0.36  My Price Target - $1.5  Company Revenue Growth - 35.47%  About CTRM - Castor Maritime Inc. is an international provider of shipping transportation services through its ownership of dry bulk vessels. The Company’s vessels are employed primarily on short to medium-term charters and transport a range of dry bulk cargoes, including such commodities as coal, grain and other materials along worldwide shipping routes.  Their recent moves  The company has completed a direct offering of its shares that was announced late last week. This has it selling 137 million shares of CTRM stock to investors at a price of 19 cents per share.  The direct offering also includes warrants that are exercisable at 19 cents each. These warrants can be exercised immediately and expire five years after their issue date.  Castor Maritime notes that the offering has the company gaining about $26 million in gross proceeds.  The company’s focus is on international shipping with its own dry bulk vessels.  It targets medium-term charters and focuses on several dry goods, such as coal or grains.  CTRM’s bulk fleet is made up of six vessels and the company is looking to expand with the acquisition of more ships.  Castor Maritime is still a fairly new company having only been founded in 2017.  The company is led by Petros Panagiotidis, who is the founder, chairman, CEO, and CFO of CTRM.  CTRM is experiencing heavy trading today with more than 261 million shares changing hands. To put that in perspective, the company’s daily average trading volume is 34.79 million shares. CTRM stock was up 21.7% as of Tuesday morning  Youtube Links about CTRM  https://youtu.be/GR0etGPP5lI https://youtu.be/yhbj9GACsNI https://youtu.be/7Tnv-4l_ejg https://youtu.be/js-sWOSbL5I|True|False|False|wallstreetbets|t5_2th52|4480471|public|confidence|self|||Is anyone paying attention to CTRM through all of this?|0|[]|1.0|https://www.reddit.com/r/wallstreetbets/comments/l6wgcp/is_anyone_paying_attention_to_ctrm_through_all_of/|some_ads|7|self|{'enabled': False, 'images': [{'id': 'OmJ7D7tt-9ptxAXN7xotnyaf0b5wtnrX5yNd8M2cZHk', 'resolutions': [{'height': 81, 'url': 'https://external-preview.redd.it/5N9XXfUcSAaZxTBcPabihesDE9FYRRT8SVa9zkE2pDs.jpg?width=108&amp;crop=smart&amp;auto=webp&amp;s=d7753e752eb7425e9fe3d428253a190615dd6a9e', 'width': 108}, {'height': 162, 'url': 'https://external-preview.redd.it/5N9XXfUcSAaZxTBcPabihesDE9FYRRT8SVa9zkE2pDs.jpg?width=216&amp;crop=smart&amp;auto=webp&amp;s=ce8f690975750186258365207bf14c949594c7b0', 'width': 216}, {'height': 240, 'url': 'https://external-preview.redd.it/5N9XXfUcSAaZxTBcPabihesDE9FYRRT8SVa9zkE2pDs.jpg?width=320&amp;crop=smart&amp;auto=webp&amp;s=cf1fa12d149a7f6989b68cb4aebc12c07278d338', 'width': 320}], 'source': {'height': 360, 'url': 'https://external-preview.redd.it/5N9XXfUcSAaZxTBcPabihesDE9FYRRT8SVa9zkE2pDs.jpg?auto=webp&amp;s=623df120c3923056a7f8ba02f3fc46c2fdd066d3', 'width': 480}, 'variants': {}}]}||||2021-01-28|CTRM
[]|False|banker8888||[]||text|t2_a17mvnxk|False|False|[]|False|False|2021-01-28 13:18:25|self.wallstreetbets|https://www.reddit.com/r/wallstreetbets/comments/l6wcjy/koss_ctrm_nakd_should_be_next_gme/|{}|l6wcjy|True|False|False|False|True|True|False|#349e48|profit|[{'e': 'text', 't': 'Gain'}]|6bd9394c-0a95-11e9-82db-0eb3a11267a0|Gain|light|richtext|False||False|True|5|0|False|some_ads|/r/wallstreetbets/comments/l6wcjy/koss_ctrm_nakd_should_be_next_gme/|False|7|1611839916|1|KOSS ,  CTRM, NAKD should be next GME.....|True|False|False|wallstreetbets|t5_2th52|4473999|public|confidence|self|||KOSS , CTRM, NAKD should be next GME.....|0|[]|1.0|https://www.reddit.com/r/wallstreetbets/comments/l6wcjy/koss_ctrm_nakd_should_be_next_gme/|some_ads|7||||||2021-01-28|CTRM
[]|False|DrHagenKreutz||[]||text|t2_91ey3osq|False|False|[]|False|False|2021-01-28 13:17:35|self.wallstreetbets|https://www.reddit.com/r/wallstreetbets/comments/l6wbyh/next_rocket_is_going_to_break_soundbarrier/|{}|l6wbyh|True|False|False|False|True|True|False|#349e48|profit|[{'e': 'text', 't': 'Gain'}]|6bd9394c-0a95-11e9-82db-0eb3a11267a0|Gain|light|richtext|False||False|True|3|0|False|some_ads|/r/wallstreetbets/comments/l6wbyh/next_rocket_is_going_to_break_soundbarrier/|False|7|1611839866|1|Come on lets go on with CTRM. Time for the next punch.|True|False|False|wallstreetbets|t5_2th52|4472885|public|confidence|self|||Next Rocket is going to break soundbarrier|0|[]|1.0|https://www.reddit.com/r/wallstreetbets/comments/l6wbyh/next_rocket_is_going_to_break_soundbarrier/|some_ads|7||||||2021-01-28|CTRM
[]|False|Big-monies||[]||text|t2_a0znt1ug|False|False|[]|False|False|2021-01-28 13:17:17|self.wallstreetbets|https://www.reddit.com/r/wallstreetbets/comments/l6wbpx/ctrm/|{}|l6wbpx|True|False|False|False|True|True|False|#800080|question|[{'e': 'text', 't': 'Discussion'}]|96f6c79e-b853-11e5-a4cb-0ebdf030e05d|Discussion|light|richtext|False||False|True|5|0|False|some_ads|/r/wallstreetbets/comments/l6wbpx/ctrm/|False|7|1611839849|1|I haven’t seen anyone mention CTRM. Good volume and price atm. Thoughts?|True|False|False|wallstreetbets|t5_2th52|4472519|public|confidence|self|||CTRM|0|[]|1.0|https://www.reddit.com/r/wallstreetbets/comments/l6wbpx/ctrm/|some_ads|7||||||2021-01-28|CTRM
