all_awardings|allow_live_comments|author|author_flair_css_class|author_flair_richtext|author_flair_text|author_flair_type|author_fullname|author_patreon_flair|author_premium|awarders|can_mod_post|contest_mode|created_utc|domain|full_link|gildings|id|is_crosspostable|is_meta|is_original_content|is_reddit_media_domain|is_robot_indexable|is_self|is_video|link_flair_background_color|link_flair_css_class|link_flair_richtext|link_flair_template_id|link_flair_text|link_flair_text_color|link_flair_type|locked|media_metadata|media_only|no_follow|num_comments|num_crossposts|over_18|parent_whitelist_status|permalink|pinned|pwls|retrieved_on|score|selftext|send_replies|spoiler|stickied|subreddit|subreddit_id|subreddit_subscribers|subreddit_type|suggested_sort|thumbnail|thumbnail_height|thumbnail_width|title|total_awards_received|treatment_tags|upvote_ratio|url|whitelist_status|wls|post_hint|preview|author_flair_background_color|author_flair_text_color|gilded|date|ticker
[]|False|madsforrell||[]||text|t2_166v81|False|False|[]|False|False|2021-03-31 21:44:05|self.wallstreetbets|https://www.reddit.com/r/wallstreetbets/comments/mhgiu2/ctrm_short_volume_of_13522829_shares_out_of/|{}|mhgiu2|True|False|False|False|True|True|False|#365b8c|dd|[{'e': 'text', 't': 'DD'}]|5692ce02-b860-11e5-b542-0edc7016bbd3|DD|light|richtext|False|{'9kq2rdjgofq61': {'e': 'Image', 'id': '9kq2rdjgofq61', 'm': 'image/png', 'p': [{'u': 'https://preview.redd.it/9kq2rdjgofq61.png?width=108&amp;crop=smart&amp;auto=webp&amp;s=25991984fd31a00d150d51bd9e91c29db9c12264', 'x': 108, 'y': 64}, {'u': 'https://preview.redd.it/9kq2rdjgofq61.png?width=216&amp;crop=smart&amp;auto=webp&amp;s=3d9ee899542d26a949b53989b5c32c4411edcfd8', 'x': 216, 'y': 128}, {'u': 'https://preview.redd.it/9kq2rdjgofq61.png?width=320&amp;crop=smart&amp;auto=webp&amp;s=f5a557210a7bcda7fee73f052bbe6fd18b07c969', 'x': 320, 'y': 189}, {'u': 'https://preview.redd.it/9kq2rdjgofq61.png?width=640&amp;crop=smart&amp;auto=webp&amp;s=22bac1d603691766b7fbd80236b5e3db054ee762', 'x': 640, 'y': 379}], 's': {'u': 'https://preview.redd.it/9kq2rdjgofq61.png?width=841&amp;format=png&amp;auto=webp&amp;s=9d6f23fb576342932d74c937186b31bb14e261f2', 'x': 841, 'y': 499}, 'status': 'valid'}, 'dcv3knykofq61': {'e': 'Image', 'id': 'dcv3knykofq61', 'm': 'image/png', 'p': [{'u': 'https://preview.redd.it/dcv3knykofq61.png?width=108&amp;crop=smart&amp;auto=webp&amp;s=60bdf2104fa3a35559e98b476f7369ee340973d8', 'x': 108, 'y': 57}, {'u': 'https://preview.redd.it/dcv3knykofq61.png?width=216&amp;crop=smart&amp;auto=webp&amp;s=03da743b44beb902cb8e0822796a29607b4125d0', 'x': 216, 'y': 114}, {'u': 'https://preview.redd.it/dcv3knykofq61.png?width=320&amp;crop=smart&amp;auto=webp&amp;s=3d7dc5ec09e20302b81de483efdd67db38e15ee3', 'x': 320, 'y': 169}, {'u': 'https://preview.redd.it/dcv3knykofq61.png?width=640&amp;crop=smart&amp;auto=webp&amp;s=be0c91cae90f51dd8900b1c17fa7caa3727ad1e9', 'x': 640, 'y': 338}], 's': {'u': 'https://preview.redd.it/dcv3knykofq61.png?width=672&amp;format=png&amp;auto=webp&amp;s=e78ed0616a2f58be983e5a27a527cfd735c461d1', 'x': 672, 'y': 355}, 'status': 'valid'}}|False|True|1|0|False|some_ads|/r/wallstreetbets/comments/mhgiu2/ctrm_short_volume_of_13522829_shares_out_of/|False|7|1617227056|1|"My next bet was going to be GME but when it's till up to close $200 gone wrong but there is other players in the market,   $CTRM (current price 0.76)  https://preview.redd.it/9kq2rdjgofq61.png?width=841&amp;format=png&amp;auto=webp&amp;s=9d6f23fb576342932d74c937186b31bb14e261f2  And recently we have seen a small spike in the short amount may be leading up to short squeeze incoming.   https://preview.redd.it/dcv3knykofq61.png?width=672&amp;format=png&amp;auto=webp&amp;s=e78ed0616a2f58be983e5a27a527cfd735c461d1  I'm not a financial advisor ""I just like the stock"""|True|False|False|wallstreetbets|t5_2th52|9701892|public|confidence|https://b.thumbs.redditmedia.com/7_0exyuSXGRLQXFvK_R9Rt5S6wgBScuQPDWZGTvy7Bg.jpg|83.0|140.0|$CTRM Short volume of 13,522,829 shares out of 36,957,000 May be a short squeeze incoming!!!|0|[]|1.0|https://www.reddit.com/r/wallstreetbets/comments/mhgiu2/ctrm_short_volume_of_13522829_shares_out_of/|some_ads|7||||||2021-03-31|CTRM
[]|False|smahtchahts||[]||text|t2_3q19s816|False|False|[]|False|False|2021-03-30 12:48:08|self.wallstreetbets|https://www.reddit.com/r/wallstreetbets/comments/mgf8rf/ctrm_earnings/|{}|mgf8rf|True|False|False|False|True|True|False|#ffb000|news|[{'e': 'text', 't': 'News'}]|519c3d26-4acc-11eb-8ce2-0ec530aa616d|News|light|richtext|False||False|True|1|0|False|some_ads|/r/wallstreetbets/comments/mgf8rf/ctrm_earnings/|False|7|1617108499|1|Castor Maritime Inc. (NASDAQ: CTRM), (“Castor” or the “Company”), a diversified global shipping company, today announced its results for the three months and year ended December 31, 2020.     Highlights of the Fourth Quarter Ended December 31, 2020:     Revenues, net: $4.4 million for the three months ended December 31, 2020, as compared to $2.8 million for the three months ended December 31, 2019, or a 57% period to period increase;   Net loss/income: Net loss of $0.8 million for the three months ended December 31, 2020, as compared to net income of $0.5 million for the three months ended December 31, 2019;   Loss/Earnings per common share: $0.01 loss per share for the three months ended December 31, 2020, as compared to earnings per share of $0.20 for the three months ended December 31, 2019;   EBITDA(1): $0.3 million for the three months ended December 31, 2020, as compared to $1.1 million for the three months ended December 31, 2019, or a 73% period to period decrease;   Average fleet time charter equivalent (“TCE”)(1) rate of $10,257 per day for the three months ended December 31, 2020, as compared to $10,789 for the three months ended December 31, 2019, or a 5% period to period decrease;   Cash and restricted cash of $9.4 million as of December 31, 2020, as compared to $5.1 million as of December 31, 2019, or a 84% period to period increase|True|False|False|wallstreetbets|t5_2th52|9691945|public|confidence|self|||CTRM Earnings|0|[]|1.0|https://www.reddit.com/r/wallstreetbets/comments/mgf8rf/ctrm_earnings/|some_ads|7||||||2021-03-30|CTRM
[]|False|ChronaldRegean||[]||text|t2_9y0nxu5s|False|False|[]|False|False|2021-03-27 21:26:29|self.wallstreetbets|https://www.reddit.com/r/wallstreetbets/comments/men3ej/the_big_boys_are_trying_to_punish_retail_traders/|{}|men3ej|True|False|False|False|True|True|False|#800080|question|[{'e': 'text', 't': 'Discussion'}]|96f6c79e-b853-11e5-a4cb-0ebdf030e05d|Discussion|light|richtext|False||False|True|20|0|False|some_ads|/r/wallstreetbets/comments/men3ej/the_big_boys_are_trying_to_punish_retail_traders/|False|7|1616880400|1|Is been a while since I’ve seen the Dow divorced from the NASDAQ like it has been much of the last 5-6 weeks. Hedge hogs know many retail traders can’t hold for longer than a month because Unfortunately they need the money. This also causes a problem because as soon as a retail trader  gets down -10 or 15% ; and if it starts to go down a little more they have to sell  because they need that money. A professional trader would just wait it out but so many retail traders can’t wait it out. They are pissed about GameStop  and social media warriors boning up on their stock market knowledge. The big boys HATE us, retail traders and they are trying to show who is boss lately. They are making a fucking killing shorting the market and shorting all the tech stocks down and then eventually switching to a long position. They know that the most of the retail traders live in the NASDAQ because of cannabis and EV and technology and infrastructure. With all The huge runs in penny stocks like ZOM, CTRM, NAKD, SNDL, we should Have known that they were gonna shut shit down on retail traders and use the momentum against us. So ...The people that have to sell because they need their money are shit out of luck but for the rest of us , we can just wait this out Cause it’s gonna be fine and we will be rewarded when this passes. The cork soaking big buys hold all the shares, It’s like playing against a stacked deck-They still have a ridiculous advantage over us on access to data, available information, and they’re even buying sentiment information from stock twits and others to track retail sentiment, That’s why a lot of rooms have started marking opposite sentiment on their posts to fuck up the program for the big boys trying to buy data information on retail traders. It’s hard to realize that the price action recently for most stocks is not related at all to the actual company. It’s just Wall Street manipulation going up and down using the tickers to make money- that’s what you get to do when you own all the shares. But for the same reason we won the revolutionary war, we will win this battle as well because retail traders are ruthless and we are like rabid dogs and we will never give up, never stop learning, and never stop attacking the Fucktards on wall street who are making money right now hand over fist in a unfair tilted system...we Won the war because the British weren’t committed and they had nothing to fight for while we were fighting for what’s ours and our freedom-now we fight for our financial freedom. Let’s keep ours heads up, stay classy, support each other as we are not each other’s enemies, and never let up on these junky Wall Street douche tards  who are constantly running their suckholes on tv and online...|True|False|False|wallstreetbets|t5_2th52|9674182|public|confidence|self|||The big boys are trying to punish retail traders by attacking the NASDAQ|0|[]|1.0|https://www.reddit.com/r/wallstreetbets/comments/men3ej/the_big_boys_are_trying_to_punish_retail_traders/|some_ads|7||||||2021-03-27|CTRM
[]|False|Sebo28golf||[]||text|t2_a1p9p0uj|False|False|[]|False|False|2021-03-16 04:09:29|self.wallstreetbets|https://www.reddit.com/r/wallstreetbets/comments/m60nqe/ctrm_to_the_moon/|{}|m60nqe|True|False|False|False|True|True|False|#365b8c|dd|[{'e': 'text', 't': 'DD'}]|5692ce02-b860-11e5-b542-0edc7016bbd3|DD|light|richtext|False||False|True|2|0|False|some_ads|/r/wallstreetbets/comments/m60nqe/ctrm_to_the_moon/|False|7|1615867780|1|Anyone heard of CTRM? it looks good to take a trip to the 🌙|True|False|False|wallstreetbets|t5_2th52|9559631|public|confidence|self|||CTRM TO THE MOON|0|[]|1.0|https://www.reddit.com/r/wallstreetbets/comments/m60nqe/ctrm_to_the_moon/|some_ads|7||||||2021-03-16|CTRM
[]|False|No-Ladder-2664||[]||text|t2_7hkwr504|False|False|[]|False|False|2021-03-15 18:39:22|self.wallstreetbets|https://www.reddit.com/r/wallstreetbets/comments/m5rlfv/ctrm_is_next/|{}|m5rlfv|True|False|True|False|True|True|False|#800080|question|[{'e': 'text', 't': 'Discussion'}]|96f6c79e-b853-11e5-a4cb-0ebdf030e05d|Discussion|light|richtext|False||False|True|0|0|False|some_ads|/r/wallstreetbets/comments/m5rlfv/ctrm_is_next/|False|7|1615833573|1|Hope you are doing well with AMC  CTRM is next !  It is also a real company - cargo shipping benefitting world economies coming out of Covid.  Lets go CTRM !|True|False|False|wallstreetbets|t5_2th52|9552011|public|confidence|self|||CTRM is NEXT !|0|[]|1.0|https://www.reddit.com/r/wallstreetbets/comments/m5rlfv/ctrm_is_next/|some_ads|7||||||2021-03-15|CTRM
[]|False|rockethasreddit||[]||text|t2_a365q0f0|False|False|[]|False|False|2021-03-14 14:42:46|self.wallstreetbets|https://www.reddit.com/r/wallstreetbets/comments/m4wa8p/ctrm/|{}|m4wa8p|True|False|False|False|True|True|False|#800080|question|[{'e': 'text', 't': 'Discussion'}]|96f6c79e-b853-11e5-a4cb-0ebdf030e05d|Discussion|light|richtext|False||False|True|2|0|False|some_ads|/r/wallstreetbets/comments/m4wa8p/ctrm/|False|7|1615732977|1|$CTRM let’s go $20+ Monday|True|False|False|wallstreetbets|t5_2th52|9536786|public|confidence|self|||$CTRM|0|[]|1.0|https://www.reddit.com/r/wallstreetbets/comments/m4wa8p/ctrm/|some_ads|7||||||2021-03-14|CTRM
[]|False|dgghostkilla||[]||text|t2_oktrq|False|False|[]|False|False|2021-03-14 14:15:30|self.wallstreetbets|https://www.reddit.com/r/wallstreetbets/comments/m4vt6c/ctrm_monday/|{}|m4vt6c|True|False|False|False|True|True|False|#800080|question|[{'e': 'text', 't': 'Discussion'}]|96f6c79e-b853-11e5-a4cb-0ebdf030e05d|Discussion|light|richtext|False||False|True|9|0|False|some_ads|/r/wallstreetbets/comments/m4vt6c/ctrm_monday/|False|7|1615731341|1|What is everyone thinking about CTRM for tomm!   I think tomm this stock is gonna have big gains 😀|True|False|False|wallstreetbets|t5_2th52|9536663|public|confidence|self|||CTRM Monday !|0|[]|1.0|https://www.reddit.com/r/wallstreetbets/comments/m4vt6c/ctrm_monday/|some_ads|7||||||2021-03-14|CTRM
[]|False|BingoBoNgobIngOO||[]||text|t2_1pgr3iq3|False|False|[]|False|False|2021-03-14 08:08:13|self.wallstreetbets|https://www.reddit.com/r/wallstreetbets/comments/m4r30g/ctrm_attack/|{}|m4r30g|True|False|False|False|True|True|False|#800080|question|[{'e': 'text', 't': 'Discussion'}]|96f6c79e-b853-11e5-a4cb-0ebdf030e05d|Discussion|light|richtext|False||False|True|3|0|False|some_ads|/r/wallstreetbets/comments/m4r30g/ctrm_attack/|False|7|1615709303|1|People please wake up and hop in ctrm this week!! To be honest it’s not a meme stonk but the hedgies have been targeting this for shorting and barcoding. There is technically a large amount of shorted positions and if more people hop on board this will fly to at least $10. Even without a wsb backing it will go to $5. This is not financial advice I just think this stock is severely undervalued, I love this stock and hate to see good companies get driven into the ground by shorts.|True|False|False|wallstreetbets|t5_2th52|9535930|public|confidence|self|||$CTRM Attack|0|[]|1.0|https://www.reddit.com/r/wallstreetbets/comments/m4r30g/ctrm_attack/|some_ads|7||||||2021-03-14|CTRM
[]|False|zack7688||[]||text|t2_35ojr233|False|False|[]|False|False|2021-03-14 04:02:53|self.wallstreetbets|https://www.reddit.com/r/wallstreetbets/comments/m4nfhv/this_is_not_financial_advice_and_whatever_the_fuck/|{}|m4nfhv|True|False|False|False|True|True|False|#800080|question|[{'e': 'text', 't': 'Discussion'}]|96f6c79e-b853-11e5-a4cb-0ebdf030e05d|Discussion|light|richtext|False||False|True|6|0|False|some_ads|/r/wallstreetbets/comments/m4nfhv/this_is_not_financial_advice_and_whatever_the_fuck/|False|7|1615694585|1|Why is everybody focusing only on GME when we can make ANY and I mean ANY fucking stock that we pick go to the moon, we already did it with GME and the meme  currency that for some fucking reason I can't put it's name on this post, why are we stoping there when we can just pick up any penny stock, set up a date and start buying it like mutherfuckers to make it's price skyrocket? ZOM, CTRM, CYRN, ETC, ETC, ETC, pick up fucking one and let's get rich, get out and go for the next one the following week, come on fucking retards, STOP waiting only on one stock. THE WHOLE FUCKING MARKET IS OURS|True|False|False|wallstreetbets|t5_2th52|9535414|public|confidence|self|||This is not financial advice and whatever the fuck|0|[]|1.0|https://www.reddit.com/r/wallstreetbets/comments/m4nfhv/this_is_not_financial_advice_and_whatever_the_fuck/|some_ads|7||||||2021-03-14|CTRM
[]|False|Wonderful-Top9387||[]||text|t2_64jhm2zt|False|False|[]|False|False|2021-03-12 18:09:44|self.wallstreetbets|https://www.reddit.com/r/wallstreetbets/comments/m3ne0u/whats_the_feeling_on_ctrm/|{}|m3ne0u|True|False|False|False|True|True|False|#800080|question|[{'e': 'text', 't': 'Discussion'}]|96f6c79e-b853-11e5-a4cb-0ebdf030e05d|Discussion|light|richtext|False||False|True|1|0|False|some_ads|/r/wallstreetbets/comments/m3ne0u/whats_the_feeling_on_ctrm/|False|7|1615572595|1|just looking to check what this channels things of CTRM and whats your position in the next few months?|True|False|False|wallstreetbets|t5_2th52|9520359|public|confidence|self|||whats the feeling on CTRM?|0|[]|1.0|https://www.reddit.com/r/wallstreetbets/comments/m3ne0u/whats_the_feeling_on_ctrm/|some_ads|7||||||2021-03-12|CTRM
[]|False|Dturska12||[]||text|t2_340hg8ht|False|False|[]|False|False|2021-03-11 20:02:56|self.wallstreetbets|https://www.reddit.com/r/wallstreetbets/comments/m2zd8u/ctrm/|{}|m2zd8u|True|False|False|False|True|True|False|#800080|question|[{'e': 'text', 't': 'Discussion'}]|96f6c79e-b853-11e5-a4cb-0ebdf030e05d|Discussion|light|richtext|False||False|True|0|0|False|some_ads|/r/wallstreetbets/comments/m2zd8u/ctrm/|False|7|1615492987|1|Anyone buying into Castor Maritime? Seem like this one night actually do some, but haven't seen much discussion on here about it though. What are your thoughts?|True|False|False|wallstreetbets|t5_2th52|9508953|public|confidence|self|||CTRM|0|[]|1.0|https://www.reddit.com/r/wallstreetbets/comments/m2zd8u/ctrm/|some_ads|7||||||2021-03-11|CTRM
[]|False|alwaysbroke444||[]||text|t2_a5r3xk7o|False|False|[]|False|False|2021-03-11 18:49:20|self.wallstreetbets|https://www.reddit.com/r/wallstreetbets/comments/m2xmo0/youre_the_reason_for_ctrm/|{}|m2xmo0|True|False|False|False|True|True|False|#800080|question|[{'e': 'text', 't': 'Discussion'}]|96f6c79e-b853-11e5-a4cb-0ebdf030e05d|Discussion|light|richtext|False||False|True|0|0|False|some_ads|/r/wallstreetbets/comments/m2xmo0/youre_the_reason_for_ctrm/|False|7|1615488570|1|First time post even though I love reading you sick bastards! I guess i should thank you for the rise in CTRM. Although I really like the stock and the direction Petros is heading with the company. Every outlet says its you who have driven the price up. This isnt a dd or any advice (hell im lucky my dumbass can spell advisor let alone ever be one!!!). I wanted to say thanks and make a bet. If CTRM hits 150 a share by June 9th 2021 (hell it might without you who knows)  Ill post 3 wsb style tats and the highest vote will be forever on me! And as always keep doing half ass stuff and buy high sell low! Im not your advisor. If you listen to me youll lose like me!|True|False|False|wallstreetbets|t5_2th52|9508074|public|confidence|self|||You're the reason for CTRM|0|[]|1.0|https://www.reddit.com/r/wallstreetbets/comments/m2xmo0/youre_the_reason_for_ctrm/|some_ads|7||||||2021-03-11|CTRM
[]|False|Just_Buy_6305||[]||text|t2_a2dfadxi|False|False|[]|False|False|2021-03-10 22:39:29|self.wallstreetbets|https://www.reddit.com/r/wallstreetbets/comments/m2b0w5/hold_or_what/|{}|m2b0w5|True|False|False|False|True|True|False|#800080|question|[{'e': 'text', 't': 'Discussion'}]|96f6c79e-b853-11e5-a4cb-0ebdf030e05d|Discussion|light|richtext|False||False|False|1|0|False|some_ads|/r/wallstreetbets/comments/m2b0w5/hold_or_what/|False|7|1615415980|2|Just wondering how people feel about CTRM? IS THIS A HOLD OR DUMP?|True|False|False|wallstreetbets|t5_2th52|9496045|public|confidence|self|||Hold or what?|0|[]|1.0|https://www.reddit.com/r/wallstreetbets/comments/m2b0w5/hold_or_what/|some_ads|7||||||2021-03-10|CTRM
[]|False|Emotional-Cup-1648||[]||text|t2_a1o0m2jk|False|False|[]|False|False|2021-03-10 19:38:13|self.wallstreetbets|https://www.reddit.com/r/wallstreetbets/comments/m26dwr/what_penny_stocks_should_i_buy/|{}|m26dwr|True|False|False|False|True|True|False|#800080|question|[{'e': 'text', 't': 'Discussion'}]|96f6c79e-b853-11e5-a4cb-0ebdf030e05d|Discussion|light|richtext|False||False|False|7|0|False|some_ads|/r/wallstreetbets/comments/m26dwr/what_penny_stocks_should_i_buy/|False|7|1615405106|1|I need some help buying penny stocks, I bought 300 shares of CTRM at .95, idk if that’s a good idea or not but please help Ik with other suggestions.|True|False|False|wallstreetbets|t5_2th52|9493445|public|confidence|self|||What penny stocks should I buy?|0|[]|1.0|https://www.reddit.com/r/wallstreetbets/comments/m26dwr/what_penny_stocks_should_i_buy/|some_ads|7||||||2021-03-10|CTRM
[]|False|CompetitionRoyal44||[]||text|t2_93tpbctj|False|False|[]|False|False|2021-03-10 00:56:56|self.wallstreetbets|https://www.reddit.com/r/wallstreetbets/comments/m1l9yh/ctrm_the_boom_is_comming/|{}|m1l9yh|True|False|False|False|True|True|False|#800080|question|[{'e': 'text', 't': 'Discussion'}]|96f6c79e-b853-11e5-a4cb-0ebdf030e05d|Discussion|light|richtext|False||False|True|0|0|False|some_ads|/r/wallstreetbets/comments/m1l9yh/ctrm_the_boom_is_comming/|False|7|1615337827|1|CTRM, is a company that's doubled in size last 6 months, plus NASDQ compliance announcement, and earnings comming soon. Short squeeze highly likely! Take advantage of the low price and let take this ship outta harbor! 17% gains today!|True|False|False|wallstreetbets|t5_2th52|9479829|public|confidence|self|||CTRM the boom is comming|0|[]|1.0|https://www.reddit.com/r/wallstreetbets/comments/m1l9yh/ctrm_the_boom_is_comming/|some_ads|7||||||2021-03-10|CTRM
[]|False|CompetitionRoyal44||[]||text|t2_93tpbctj|False|False|[]|False|False|2021-03-10 00:51:07|self.wallstreetbets|https://www.reddit.com/r/wallstreetbets/comments/m1l5p5/big_movment_comming_ctrm/|{}|m1l5p5|True|False|False|False|True|True|False|#349e48|profit|[{'e': 'text', 't': 'Gain'}]|6bd9394c-0a95-11e9-82db-0eb3a11267a0|Gain|light|richtext|False||False|True|1|0|False|some_ads|/r/wallstreetbets/comments/m1l5p5/big_movment_comming_ctrm/|False|7|1615337479|1|Big movment comming for CTRM. Company has more then doubled in size last 6 months, NASDQ compliance announcement comming soon along with earnings! 17% increase in price today, and a good potential for a short squeeze! Get on the boat before it's too late, the ship is sailing with or with out you.|True|False|False|wallstreetbets|t5_2th52|9479788|public|confidence|self|||Big Movment Comming CTRM|0|[]|0.99|https://www.reddit.com/r/wallstreetbets/comments/m1l5p5/big_movment_comming_ctrm/|some_ads|7||||||2021-03-10|CTRM
[]|False|goirish0521||[]||text|t2_3myrju8h|False|False|[]|False|False|2021-03-09 04:56:38|self.wallstreetbets|https://www.reddit.com/r/wallstreetbets/comments/m0z6t4/ctrm_could_this_stock_be_the_next_gme_or_amc/|{}|m0z6t4|True|False|False|False|True|True|False|#800080|question|[{'e': 'text', 't': 'Discussion'}]|96f6c79e-b853-11e5-a4cb-0ebdf030e05d|Discussion|light|richtext|False||False|False|0|0|False|some_ads|/r/wallstreetbets/comments/m0z6t4/ctrm_could_this_stock_be_the_next_gme_or_amc/|False|7|1615265809|1|Hi Everyone. I have noticed CTRM has been one of the highest volume traded stocks for over the past month. It seems to have such a large following that I wanted to see if anyone had thoughts about CTRM possibly being the next GME or AMC?  Thanks!|True|False|False|wallstreetbets|t5_2th52|9468244|public|confidence|self|||CTRM - Could this stock be the next GME or AMC?|0|[]|1.0|https://www.reddit.com/r/wallstreetbets/comments/m0z6t4/ctrm_could_this_stock_be_the_next_gme_or_amc/|some_ads|7||||||2021-03-09|CTRM
[]|False|wall_Street_shark||[]||text|t2_a8r4j8cx|False|False|[]|False|False|2021-03-08 15:22:29|self.wallstreetbets|https://www.reddit.com/r/wallstreetbets/comments/m0hy88/ctrm_to_10/|{}|m0hy88|True|False|False|False|True|True|False|#349e48|profit|[{'e': 'text', 't': 'Gain'}]|6bd9394c-0a95-11e9-82db-0eb3a11267a0|Gain|light|richtext|False||False|True|1|0|False|some_ads|/r/wallstreetbets/comments/m0hy88/ctrm_to_10/|False|7|1615216960|1|CTRM to 10$ 🚀|True|False|False|wallstreetbets|t5_2th52|9459710|public|confidence|self|||CTRM to 10$|0|[]|0.99|https://www.reddit.com/r/wallstreetbets/comments/m0hy88/ctrm_to_10/|some_ads|7||||||2021-03-08|CTRM
[]|False|Zealousideal_Trip754||[]||text|t2_5md4gz3w|False|False|[]|False|False|2021-03-03 01:11:41|self.wallstreetbets|https://www.reddit.com/r/wallstreetbets/comments/lwhjtu/how_we_lookin_at_ctrm_looks_interesting/|{}|lwhjtu|True|False|False|False|True|True|False|#800080|question|[{'e': 'text', 't': 'Discussion'}]|96f6c79e-b853-11e5-a4cb-0ebdf030e05d|Discussion|light|richtext|False||False|True|0|0|False|some_ads|/r/wallstreetbets/comments/lwhjtu/how_we_lookin_at_ctrm_looks_interesting/|False|7|1614733912|1|Just wanted to get some opinions. Currently have 20k to put into something and CTRM looks to be the Richard I want to sit on. Bag holding AMC with profits from GME. If y’all are in, I’m in.|True|False|False|wallstreetbets|t5_2th52|9387453|public|confidence|self|||How we lookin at CTRM. Looks interesting.|0|[]|1.0|https://www.reddit.com/r/wallstreetbets/comments/lwhjtu/how_we_lookin_at_ctrm_looks_interesting/|some_ads|7||||||2021-03-03|CTRM
[]|False|lisjanoh97||[]||text|t2_a1v39dq7|False|False|[]|False|False|2021-03-02 20:57:29|self.wallstreetbets|https://www.reddit.com/r/wallstreetbets/comments/lwcbv8/ctrm_needs_us/|{}|lwcbv8|True|False|False|False|True|True|False|#349e48|profit|[{'e': 'text', 't': 'Gain'}]|6bd9394c-0a95-11e9-82db-0eb3a11267a0|Gain|light|richtext|False||False|True|7|0|False|some_ads|/r/wallstreetbets/comments/lwcbv8/ctrm_needs_us/|False|7|1614718660|1|Its time to burn all the shorts , they are playing with fire and this is our chance , let’s get together and fuck them up one more time , ctrm army here we go !!|True|False|False|wallstreetbets|t5_2th52|9381513|public|confidence|self|||CTRM needs us !!|0|[]|1.0|https://www.reddit.com/r/wallstreetbets/comments/lwcbv8/ctrm_needs_us/|some_ads|7||||||2021-03-02|CTRM
[]|False|Fabulous_Cheek_7076||[]||text|t2_a11iqn11|False|False|[]|False|False|2021-03-02 18:53:09|self.wallstreetbets|https://www.reddit.com/r/wallstreetbets/comments/lw9k7t/_/|{}|lw9k7t|True|False|False|False|True|True|False|#349e48|profit|[{'e': 'text', 't': 'Gain'}]|6bd9394c-0a95-11e9-82db-0eb3a11267a0|Gain|light|richtext|False||False|True|0|0|False|some_ads|/r/wallstreetbets/comments/lw9k7t/_/|False|7|1614711199|1|$CTRM $WNW|True|False|False|wallstreetbets|t5_2th52|9377864|public|confidence|self|||🚀🚀📈|0|[]|1.0|https://www.reddit.com/r/wallstreetbets/comments/lw9k7t/_/|some_ads|7||||||2021-03-02|CTRM
