all_awardings|allow_live_comments|author|author_flair_css_class|author_flair_richtext|author_flair_text|author_flair_type|author_fullname|author_patreon_flair|author_premium|awarders|can_mod_post|contest_mode|created_utc|domain|full_link|gildings|id|is_crosspostable|is_meta|is_original_content|is_reddit_media_domain|is_robot_indexable|is_self|is_video|link_flair_background_color|link_flair_css_class|link_flair_richtext|link_flair_template_id|link_flair_text|link_flair_text_color|link_flair_type|locked|media_metadata|media_only|no_follow|num_comments|num_crossposts|over_18|parent_whitelist_status|permalink|pinned|pwls|retrieved_on|score|selftext|send_replies|spoiler|stickied|subreddit|subreddit_id|subreddit_subscribers|subreddit_type|suggested_sort|thumbnail|thumbnail_height|thumbnail_width|title|total_awards_received|treatment_tags|upvote_ratio|url|whitelist_status|wls|post_hint|preview|author_flair_background_color|author_flair_text_color|gilded|date|ticker
[]|False|pmalla||[]||text|t2_lka8c|False|False|[]|False|False|2021-01-28 16:14:11|self.wallstreetbets|https://www.reddit.com/r/wallstreetbets/comments/l70ygq/from_robinhood/|{}|l70ygq|True|False|False|False|True|True|False|#ffb000|news|[{'e': 'text', 't': 'News'}]|519c3d26-4acc-11eb-8ce2-0ec530aa616d|News|light|richtext|False||False|True|0|0|False|some_ads|/r/wallstreetbets/comments/l70ygq/from_robinhood/|False|7|1611850468|1|We continuously monitor the markets and make changes where necessary. In light of recent volatility, we are restricting transactions for certain securities to position closing only, including $AAL, $AMC, $BB, $BBY, $CTRM, $EXPR, $GME, $KOSS, $NAKD, $NOK, $SNDL, $TR, and $TRVG. We also raised margin requirements for certain securities.|True|False|False|wallstreetbets|t5_2th52|4686803|public|confidence|self|||From Robinhood|0|[]|1.0|https://www.reddit.com/r/wallstreetbets/comments/l70ygq/from_robinhood/|some_ads|7||||||2021-01-28|CTRM
[]|False|dzonbeats||[]||text|t2_14evfp|False|False|[]|False|False|2021-01-28 16:04:29|self.wallstreetbets|https://www.reddit.com/r/wallstreetbets/comments/l70p15/official_statement_from_robinhood_regarding_gme/|{}|l70p15|True|False|False|False|True|True|False|#800080|question|[{'e': 'text', 't': 'Discussion'}]|96f6c79e-b853-11e5-a4cb-0ebdf030e05d|Discussion|light|richtext|False||False|True|6|0|False|some_ads|/r/wallstreetbets/comments/l70p15/official_statement_from_robinhood_regarding_gme/|False|7|1611849879|1|“Our mission at Robinhood is to democratize finance for all. We’re proud to have created a platform that has helped everyday people, from all backgrounds, shape their financial futures and invest for the long term.   We continuously monitor the markets and make changes where necessary. In light of recent volatility, we are restricting transactions for certain securities to position closing only, including $AAL, $AMC, $BB, $BBY, $CTRM, $EXPR, $GME, $KOSS, $NAKD, $NOK, $SNDL, $TR, and $TRVG. We also raised margin requirements for certain securities.  Amid significant market volatility, it’s important as ever that we help customers stay informed. That’s why we’re committed to providing people with educational resources. We recently revamped and expanded Robinhood Learn to help people take advantage of the hundreds of financial resources we offer and educate themselves, including how to make sense of a volatile market. In 2020, more than 3.2 million people read our articles through Robinhood Learn.  We’re committed to helping our customers navigate this uncertainty. We fundamentally believe that everyone should have access to financial markets. We’re humbled to have helped many people invest in the markets for the first time. And we’re determined to provide new and experienced investors with the tools and resources to help them invest responsibly for their long-term financial futures.”|True|False|False|wallstreetbets|t5_2th52|4675755|public|confidence|self|||Official Statement from Robinhood regarding $GME, $BBY, $BB, $CTRM, $SNDL, $NOK, $NAKD, $KOSS, $TR, $TRVG|0|[]|1.0|https://www.reddit.com/r/wallstreetbets/comments/l70p15/official_statement_from_robinhood_regarding_gme/|some_ads|7||||||2021-01-28|CTRM
[]|False|Dilexar||[]||text|t2_13f80q|False|False|[]|False|False|2021-01-28 15:59:17|self.wallstreetbets|https://www.reddit.com/r/wallstreetbets/comments/l70jro/current_rh_trade_restrictions/|{}|l70jro|True|False|False|False|True|True|False|#800080|question|[{'e': 'text', 't': 'Discussion'}]|96f6c79e-b853-11e5-a4cb-0ebdf030e05d|Discussion|light|richtext|False||False|True|24|0|False|some_ads|/r/wallstreetbets/comments/l70jro/current_rh_trade_restrictions/|False|7|1611849567|1|$AAL, $AMC, $BB, $BBY, $CTRM, $EXPR, $GME, $KOSS, $NAKD, $NOK, $SNDL, $TR, and $TRVG are all being purchase blocked buy RH, sell is the only option available.   scumbags.|True|False|False|wallstreetbets|t5_2th52|4669012|public|confidence|self|||Current RH trade restrictions|0|[]|1.0|https://www.reddit.com/r/wallstreetbets/comments/l70jro/current_rh_trade_restrictions/|some_ads|7||||||2021-01-28|CTRM
[]|False|coolio72||[]||text|t2_4xsc9r9x|False|False|[]|False|False|2021-01-28 15:53:16|self.wallstreetbets|https://www.reddit.com/r/wallstreetbets/comments/l70e6w/robinhoods_b_response_to_not_allowing_investors/|{}|l70e6w|True|False|False|False|True|True|False|#ffb000|news|[{'e': 'text', 't': 'News'}]|519c3d26-4acc-11eb-8ce2-0ec530aa616d|News|light|richtext|False||False|True|4|0|False|some_ads|/r/wallstreetbets/comments/l70e6w/robinhoods_b_response_to_not_allowing_investors/|False|7|1611849207|1|&gt; Keeping Customers Informed Through Market Volatility   &gt; Our mission at Robinhood is to democratize finance for all. We’re proud to have created a platform that has helped everyday people, from all backgrounds, shape their financial futures and invest for the long term.   &gt; We continuously monitor the markets and make changes where necessary. In light of recent volatility, we are restricting transactions for certain securities to position closing only, including $AAL, $AMC, $BB, $BBY, $CTRM, $EXPR, $GME, $KOSS, $NAKD, $NOK, $SNDL, $TR, and $TRVG. We also raised margin requirements for certain securities.  &gt; Amid significant market volatility, it’s important as ever that we help customers stay informed. That’s why we’re committed to providing people with educational resources. We recently revamped and expanded Robinhood Learn to help people take advantage of the hundreds of financial resources we offer and educate themselves, including how to make sense of a volatile market. In 2020, more than 3.2 million people read our articles through Robinhood Learn.  &gt; We’re committed to helping our customers navigate this uncertainty. We fundamentally believe that everyone should have access to financial markets. We’re humbled to have helped many people invest in the markets for the first time. And we’re determined to provide new and experienced investors with the tools and resources to help them invest responsibly for their long-term financial futures.   Protecting the ~~investor~~ suits...|False|False|False|wallstreetbets|t5_2th52|4662022|public|confidence|self|||Robinhoods B$ Response To Not Allowing Investors to Trade Certain Stonks.|0|[]|1.0|https://www.reddit.com/r/wallstreetbets/comments/l70e6w/robinhoods_b_response_to_not_allowing_investors/|some_ads|7||||||2021-01-28|CTRM
[]|False|spencercoffman||[]||text|t2_1a5wsmoe|False|False|[]|False|False|2021-01-28 15:37:13|self.wallstreetbets|https://www.reddit.com/r/wallstreetbets/comments/l6zy70/robinhood_blocks_buying_of_amc_gamestop/|{}|l6zy70|True|False|False|False|True|True|False|#365b8c|dd|[{'e': 'text', 't': 'DD'}]|5692ce02-b860-11e5-b542-0edc7016bbd3|DD|light|richtext|False||False|True|1|0|False|some_ads|/r/wallstreetbets/comments/l6zy70/robinhood_blocks_buying_of_amc_gamestop/|False|7|1611848248|1|Robinhood isn’t allowing anyone to buy these shares and the SEC is looking into both of the companies. They are all upset that the prices were controlled by the people.   They are trying to TAKE our voice away!  Let’s show them it can’t happen!  Move onto other stocks. Let’s repeat AMC and GameStop.   Based on different Reddit threads it seems that NAKD and CTRM are the popular choices. I bought some this morning. You should too!  Express our voice!|True|False|False|wallstreetbets|t5_2th52|4644304|public|confidence|self|||Robinhood Blocks Buying of AMC &amp; GameStop|0|[]|1.0|https://www.reddit.com/r/wallstreetbets/comments/l6zy70/robinhood_blocks_buying_of_amc_gamestop/|some_ads|7||||||2021-01-28|CTRM
[]|False|3billionyearsold||[]||text|t2_5799leh8|False|False|[]|False|False|2021-01-28 15:31:48|self.wallstreetbets|https://www.reddit.com/r/wallstreetbets/comments/l6zsfn/robinhood_manipulation/|{}|l6zsfn|True|False|False|False|True|True|False|#800080|question|[{'e': 'text', 't': 'Discussion'}]|96f6c79e-b853-11e5-a4cb-0ebdf030e05d|Discussion|light|richtext|False||False|True|4|0|False|some_ads|/r/wallstreetbets/comments/l6zsfn/robinhood_manipulation/|False|7|1611847919|1|We can’t buy GME CTRM BB NOK ETC!!! I’m going to put 10,000 in get or any other penny stock hoping to continue to kick these bastards asses somehow..|True|False|False|wallstreetbets|t5_2th52|4637464|public|confidence|self|||Robinhood manipulation|0|[]|1.0|https://www.reddit.com/r/wallstreetbets/comments/l6zsfn/robinhood_manipulation/|some_ads|7||||||2021-01-28|CTRM
[]|False|Aceba----------||[]||text|t2_a0mkwnax|False|False|[]|False|False|2021-01-28 15:20:57|self.wallstreetbets|https://www.reddit.com/r/wallstreetbets/comments/l6zh2o/fellow_robinhooders_hold_your_positions/|{}|l6zh2o|True|False|False|False|True|True|False|#800080|question|[{'e': 'text', 't': 'Discussion'}]|96f6c79e-b853-11e5-a4cb-0ebdf030e05d|Discussion|light|richtext|False||False|True|0|0|False|some_ads|/r/wallstreetbets/comments/l6zh2o/fellow_robinhooders_hold_your_positions/|False|7|1611847268|1|Don't take losses in GME BB NOK CTRM AMC  Let them 🚀🚀🚀🚀|True|False|False|wallstreetbets|t5_2th52|4628110|public|confidence|self|||Fellow robinhooders hold your positions|0|[]|1.0|https://www.reddit.com/r/wallstreetbets/comments/l6zh2o/fellow_robinhooders_hold_your_positions/|some_ads|7||||||2021-01-28|CTRM
[]|False|Whoiscash||[]||text|t2_a152w8ns|False|False|[]|False|False|2021-01-28 15:18:44|self.wallstreetbets|https://www.reddit.com/r/wallstreetbets/comments/l6zesm/ctrm/|{}|l6zesm|True|False|False|False|True|True|False|#349e48|profit|[{'e': 'text', 't': 'Gain'}]|6bd9394c-0a95-11e9-82db-0eb3a11267a0|Gain|light|richtext|False||False|True|0|0|False|some_ads|/r/wallstreetbets/comments/l6zesm/ctrm/|False|7|1611847135|1|⬆️⬆️CTRM🚀🚀|True|False|False|wallstreetbets|t5_2th52|4626556|public|confidence|self|||CTRM|0|[]|1.0|https://www.reddit.com/r/wallstreetbets/comments/l6zesm/ctrm/|some_ads|7||||||2021-01-28|CTRM
[]|False|Dusht_Wall||[]||text|t2_a1fdydfd|False|False|[]|False|False|2021-01-28 15:16:58|self.wallstreetbets|https://www.reddit.com/r/wallstreetbets/comments/l6zcxq/ctrm/|{}|l6zcxq|True|False|False|False|True|True|False|#349e48|profit|[{'e': 'text', 't': 'Gain'}]|6bd9394c-0a95-11e9-82db-0eb3a11267a0|Gain|light|richtext|False||False|True|1|0|False|some_ads|/r/wallstreetbets/comments/l6zcxq/ctrm/|False|7|1611847029|1|CTRM is going to be the next AMC get in now!!!!|True|False|False|wallstreetbets|t5_2th52|4625309|public|confidence|self|||CTRM|0|[]|1.0|https://www.reddit.com/r/wallstreetbets/comments/l6zcxq/ctrm/|some_ads|7||||||2021-01-28|CTRM
[]|False|wheredoiputthelabel||[]||text|t2_5how5vxx|False|False|[]|False|False|2021-01-28 15:15:01|self.wallstreetbets|https://www.reddit.com/r/wallstreetbets/comments/l6zatx/stocks_currently_not_supported_by_robinhood/|{}|l6zatx|True|False|False|False|True|True|False|#800080|question|[{'e': 'text', 't': 'Discussion'}]|96f6c79e-b853-11e5-a4cb-0ebdf030e05d|Discussion|light|richtext|False||False|True|3|0|False|some_ads|/r/wallstreetbets/comments/l6zatx/stocks_currently_not_supported_by_robinhood/|False|7|1611846912|1|GME AMC NOK BB BBBY NAKD CTRM SNDL EXPR  I just thought this should be known for people that are looking to join the fun.|True|False|False|wallstreetbets|t5_2th52|4623952|public|confidence|self|||Stocks currently not supported by Robinhood|0|[]|1.0|https://www.reddit.com/r/wallstreetbets/comments/l6zatx/stocks_currently_not_supported_by_robinhood/|some_ads|7||||||2021-01-28|CTRM
[]|False|TheBazaarTrades||[]||text|t2_37nwihy0|False|False|[]|False|False|2021-01-28 15:13:25|self.wallstreetbets|https://www.reddit.com/r/wallstreetbets/comments/l6z94m/ctrm_having_the_same_issues_as_gme_whats_going_on/|{}|l6z94m|True|False|False|False|True|True|False|#800080|question|[{'e': 'text', 't': 'Discussion'}]|96f6c79e-b853-11e5-a4cb-0ebdf030e05d|Discussion|light|richtext|False||False|True|3|0|False|some_ads|/r/wallstreetbets/comments/l6z94m/ctrm_having_the_same_issues_as_gme_whats_going_on/|False|7|1611846816|1|More than 4 trading platforms are having issues placing bids. Especially with GME &amp; CTRM. There's some form of enigma happening that's allowing buying orders to go through.|True|False|False|wallstreetbets|t5_2th52|4622850|public|confidence|self|||CTRM having the same issues as GME. What's going on here?|0|[]|1.0|https://www.reddit.com/r/wallstreetbets/comments/l6z94m/ctrm_having_the_same_issues_as_gme_whats_going_on/|some_ads|7||||||2021-01-28|CTRM
[]|False|Competitive-Still294||[]||text|t2_3dac5xqe|False|False|[]|False|False|2021-01-28 15:12:26|self.wallstreetbets|https://www.reddit.com/r/wallstreetbets/comments/l6z83l/sndl_ctrm/|{}|l6z83l|True|False|False|False|True|True|False|#0392cf|yolo|[{'e': 'text', 't': 'YOLO'}]|da18a43a-83c5-11e8-9b6c-0e287561ddb8|YOLO|light|richtext|False||False|True|1|0|False|some_ads|/r/wallstreetbets/comments/l6z83l/sndl_ctrm/|False|7|1611846756|1|$SNDL $CTRM MY PLAYS FOR TODAY... BUY BUY BUY BUY AND DONT SELL|True|False|False|wallstreetbets|t5_2th52|4622099|public|confidence|self|||$SNDL $CTRM|0|[]|1.0|https://www.reddit.com/r/wallstreetbets/comments/l6z83l/sndl_ctrm/|some_ads|7||||||2021-01-28|CTRM
[]|False|abanehita||[]||text|t2_5l03hzib|False|False|[]|False|False|2021-01-28 15:10:31|self.wallstreetbets|https://www.reddit.com/r/wallstreetbets/comments/l6z63f/ctrm/|{}|l6z63f|True|False|False|False|True|True|False|#0392cf|yolo|[{'e': 'text', 't': 'YOLO'}]|da18a43a-83c5-11e8-9b6c-0e287561ddb8|YOLO|light|richtext|False||False|False|2|0|False|some_ads|/r/wallstreetbets/comments/l6z63f/ctrm/|False|7|1611846643|1|$CTRM could use some help!|True|False|False|wallstreetbets|t5_2th52|4620758|public|confidence|self|||$CTRM|0|[]|1.0|https://www.reddit.com/r/wallstreetbets/comments/l6z63f/ctrm/|some_ads|7||||||2021-01-28|CTRM
[]|False|Lets_getthetuna11||[]||text|t2_9ycijgxe|False|False|[]|False|False|2021-01-28 15:09:30|self.wallstreetbets|https://www.reddit.com/r/wallstreetbets/comments/l6z504/lets_go_sndl_ctrm_nakd_xspa/|{}|l6z504|True|False|False|False|True|True|False|#800080|question|[{'e': 'text', 't': 'Discussion'}]|96f6c79e-b853-11e5-a4cb-0ebdf030e05d|Discussion|light|richtext|False||False|True|0|0|False|some_ads|/r/wallstreetbets/comments/l6z504/lets_go_sndl_ctrm_nakd_xspa/|False|7|1611846581|1|Let's go $SNDL $CTRM $NAKD $XSPA|True|False|False|wallstreetbets|t5_2th52|4620043|public|confidence|self|||Let's go $SNDL $CTRM $NAKD $XSPA|0|[]|1.0|https://www.reddit.com/r/wallstreetbets/comments/l6z504/lets_go_sndl_ctrm_nakd_xspa/|some_ads|7||||||2021-01-28|CTRM
[]|False|Thenasty9dawg||[]||text|t2_a0uok50p|False|False|[]|False|False|2021-01-28 15:08:44|self.wallstreetbets|https://www.reddit.com/r/wallstreetbets/comments/l6z486/ctrm_to_the_moon_today/|{}|l6z486|True|False|False|False|True|True|False|#0392cf|yolo|[{'e': 'text', 't': 'YOLO'}]|da18a43a-83c5-11e8-9b6c-0e287561ddb8|YOLO|light|richtext|False||False|True|0|0|False|some_ads|/r/wallstreetbets/comments/l6z486/ctrm_to_the_moon_today/|False|7|1611846535|1|CTRM|True|False|False|wallstreetbets|t5_2th52|4619482|public|confidence|self|||CTRM to the Moon today!|0|[]|1.0|https://www.reddit.com/r/wallstreetbets/comments/l6z486/ctrm_to_the_moon_today/|some_ads|7||||||2021-01-28|CTRM
[]|False|Smoove40||[]||text|t2_5ibt2yyf|False|False|[]|False|False|2021-01-28 15:08:43|self.wallstreetbets|https://www.reddit.com/r/wallstreetbets/comments/l6z47j/ctrm/|{}|l6z47j|True|False|False|False|True|True|False|#349e48|profit|[{'e': 'text', 't': 'Gain'}]|6bd9394c-0a95-11e9-82db-0eb3a11267a0|Gain|light|richtext|False||False|True|0|0|False|some_ads|/r/wallstreetbets/comments/l6z47j/ctrm/|False|7|1611846533|1|Thoughts on CTRM?|True|False|False|wallstreetbets|t5_2th52|4619460|public|confidence|self|||CTRM|0|[]|1.0|https://www.reddit.com/r/wallstreetbets/comments/l6z47j/ctrm/|some_ads|7||||||2021-01-28|CTRM
[]|False|Keapenuj||[]||text|t2_sd7c16y|False|False|[]|False|False|2021-01-28 15:08:26|self.wallstreetbets|https://www.reddit.com/r/wallstreetbets/comments/l6z3vz/guys_bb_get_on_bb/|{}|l6z3vz|True|False|False|False|True|True|False|#0392cf|yolo|[{'e': 'text', 't': 'YOLO'}]|da18a43a-83c5-11e8-9b6c-0e287561ddb8|YOLO|light|richtext|False||False|True|4|0|False|some_ads|/r/wallstreetbets/comments/l6z3vz/guys_bb_get_on_bb/|False|7|1611846517|1|And ofc GME AMC NOK NAKD SNDL CTRM U RETARDS|True|False|False|wallstreetbets|t5_2th52|4619275|public|confidence|self|||GUYS BB GET ON BB|0|[]|1.0|https://www.reddit.com/r/wallstreetbets/comments/l6z3vz/guys_bb_get_on_bb/|some_ads|7||||||2021-01-28|CTRM
[]|False|ChasingRockets1||[]||text|t2_a05sfnr4|False|False|[]|False|False|2021-01-28 15:05:59|self.wallstreetbets|https://www.reddit.com/r/wallstreetbets/comments/l6z16f/updated_list_of_stocks_being_blocked_by_rh/|{}|l6z16f|True|False|False|False|True|True|False|#ffb000|news|[{'e': 'text', 't': 'News'}]|519c3d26-4acc-11eb-8ce2-0ec530aa616d|News|light|richtext|False||False|True|1|0|False|some_ads|/r/wallstreetbets/comments/l6z16f/updated_list_of_stocks_being_blocked_by_rh/|False|7|1611846370|1|GME  CTRM  BB  SNDL  AMC  KOSS  NAKD  Dogecoin  NOK  &amp;#x200B;  Update as you find them. Also, word has it Webull is stopping the trading of some of these stocks too.|True|False|False|wallstreetbets|t5_2th52|4617299|public|confidence|self|||Updated List of Stocks being blocked by RH|0|[]|1.0|https://www.reddit.com/r/wallstreetbets/comments/l6z16f/updated_list_of_stocks_being_blocked_by_rh/|some_ads|7||||||2021-01-28|CTRM
[]|False|The-Ax-Pro||[]||text|t2_2quk9ps2|False|False|[]|False|False|2021-01-28 15:03:03|self.wallstreetbets|https://www.reddit.com/r/wallstreetbets/comments/l6yxyi/stock_together_we_have_them_by_the_balls/|{}|l6yxyi|True|False|False|False|True|True|False|#0392cf|yolo|[{'e': 'text', 't': 'YOLO'}]|da18a43a-83c5-11e8-9b6c-0e287561ddb8|YOLO|light|richtext|False||False|True|3|0|False|some_ads|/r/wallstreetbets/comments/l6yxyi/stock_together_we_have_them_by_the_balls/|False|7|1611846193|1|GME, BB, KOSS, BBBY, CTRM|True|False|False|wallstreetbets|t5_2th52|4615042|public|confidence|self|||Stock together we have them by the balls!!|0|[]|1.0|https://www.reddit.com/r/wallstreetbets/comments/l6yxyi/stock_together_we_have_them_by_the_balls/|some_ads|7||||||2021-01-28|CTRM
[]|False|wolfiani||[]||text|t2_50xv5n2d|False|False|[]|False|False|2021-01-28 15:00:30|self.wallstreetbets|https://www.reddit.com/r/wallstreetbets/comments/l6yv4f/ctrm_nakd_sndl/|{}|l6yv4f|True|False|False|False|True|True|False|#800080|question|[{'e': 'text', 't': 'Discussion'}]|96f6c79e-b853-11e5-a4cb-0ebdf030e05d|Discussion|light|richtext|False||False|True|3|0|False|some_ads|/r/wallstreetbets/comments/l6yv4f/ctrm_nakd_sndl/|False|7|1611846041|1|BUY BUY BUY    $CTRM, $NAKD, $SNDL|True|False|False|wallstreetbets|t5_2th52|4612994|public|confidence|self|||CTRM, NAKD, SNDL|0|[]|1.0|https://www.reddit.com/r/wallstreetbets/comments/l6yv4f/ctrm_nakd_sndl/|some_ads|7||||||2021-01-28|CTRM
[]|False|Hodl4deerlife||[]||text|t2_a1bvacgm|False|False|[]|False|False|2021-01-28 15:00:26|self.wallstreetbets|https://www.reddit.com/r/wallstreetbets/comments/l6yv1g/i_work_at_a_bank_and_cant_sell_for_30_days_with_a/|{}|l6yv1g|True|False|False|False|True|True|False|#0392cf|yolo|[{'e': 'text', 't': 'YOLO'}]|da18a43a-83c5-11e8-9b6c-0e287561ddb8|YOLO|light|richtext|False||False|True|0|0|False|some_ads|/r/wallstreetbets/comments/l6yv1g/i_work_at_a_bank_and_cant_sell_for_30_days_with_a/|False|7|1611846037|1|Set my load on GME, CTRM and NAKD to the moon... HODL and HODL some more I won’t let go, unlike Jack|True|False|False|wallstreetbets|t5_2th52|4612948|public|confidence|self|||I work at a bank and can’t sell for 30 days with a profit|0|[]|1.0|https://www.reddit.com/r/wallstreetbets/comments/l6yv1g/i_work_at_a_bank_and_cant_sell_for_30_days_with_a/|some_ads|7||||||2021-01-28|CTRM
[]|False|SweatyAd3558||[]||text|t2_88rn6kdr|False|False|[]|False|False|2021-01-28 14:54:56|self.wallstreetbets|https://www.reddit.com/r/wallstreetbets/comments/l6yovr/lets_take_a_stand_ctrm/|{}|l6yovr|True|False|False|False|True|True|False|#800080|question|[{'e': 'text', 't': 'Discussion'}]|96f6c79e-b853-11e5-a4cb-0ebdf030e05d|Discussion|light|richtext|False||False|True|1|0|False|some_ads|/r/wallstreetbets/comments/l6yovr/lets_take_a_stand_ctrm/|False|7|1611845707|1|We need to come together and show wall street not to fuck with us !!!! We aren’t gonna be pushed to the side !! They are stopping us but we won’t let them !! CTRM!! GO warriors|True|False|False|wallstreetbets|t5_2th52|4607475|public|confidence|self|||LETs take a STAND!!! CTRM !!!|0|[]|1.0|https://www.reddit.com/r/wallstreetbets/comments/l6yovr/lets_take_a_stand_ctrm/|some_ads|7||||||2021-01-28|CTRM
[]|False|FatalParsley||[]||text|t2_y5h3y|False|False|[]|False|False|2021-01-28 14:51:24|self.wallstreetbets|https://www.reddit.com/r/wallstreetbets/comments/l6yl53/we_going_up/|{}|l6yl53|True|False|False|False|True|True|False|#365b8c|dd|[{'e': 'text', 't': 'DD'}]|5692ce02-b860-11e5-b542-0edc7016bbd3|DD|light|richtext|False||False|True|0|0|False|some_ads|/r/wallstreetbets/comments/l6yl53/we_going_up/|False|7|1611845495|1|$NAKD AND $CTRM GOING INSANE, GOOD SIDE HUSSLE TO GO ALONG WITH THE BIG BOYS|True|False|False|wallstreetbets|t5_2th52|4603640|public|confidence|self|||WE GOING UP|0|[]|1.0|https://www.reddit.com/r/wallstreetbets/comments/l6yl53/we_going_up/|some_ads|7||||||2021-01-28|CTRM
[]|False|Carsonw72937||[]||text|t2_a0rax7w8|False|False|[]|False|False|2021-01-28 14:48:59|self.wallstreetbets|https://www.reddit.com/r/wallstreetbets/comments/l6yinn/ctrm/|{}|l6yinn|True|False|False|False|True|True|False|#ffb000|news|[{'e': 'text', 't': 'News'}]|519c3d26-4acc-11eb-8ce2-0ec530aa616d|News|light|richtext|False||False|True|0|0|False|some_ads|/r/wallstreetbets/comments/l6yinn/ctrm/|False|7|1611845350|1|CTRM is next|True|False|False|wallstreetbets|t5_2th52|4600702|public|confidence|self|||CTRM|0|[]|1.0|https://www.reddit.com/r/wallstreetbets/comments/l6yinn/ctrm/|some_ads|7||||||2021-01-28|CTRM
[]|False|Formal-Principle-510||[]||text|t2_74v0zf9l|False|False|[]|False|False|2021-01-28 14:44:18|self.wallstreetbets|https://www.reddit.com/r/wallstreetbets/comments/l6ye3n/robinhood_is_blocking_stocks/|{}|l6ye3n|True|False|False|False|True|True|False|#ffb000|news|[{'e': 'text', 't': 'News'}]|519c3d26-4acc-11eb-8ce2-0ec530aa616d|News|light|richtext|False||False|True|3|0|False|some_ads|/r/wallstreetbets/comments/l6ye3n/robinhood_is_blocking_stocks/|False|7|1611845069|1|They’re all of a sudden saying they’re not supporting BB AMC or CTRM. What are we using instead boys?|True|False|False|wallstreetbets|t5_2th52|4594513|public|confidence|self|||Robinhood is blocking stocks|0|[]|1.0|https://www.reddit.com/r/wallstreetbets/comments/l6ye3n/robinhood_is_blocking_stocks/|some_ads|7||||||2021-01-28|CTRM
[]|False|HurricaneFan13||[]||text|t2_7rz86|False|False|[]|False|False|2021-01-28 14:41:11|self.wallstreetbets|https://www.reddit.com/r/wallstreetbets/comments/l6yaxy/they_blocked_ctrm/|{}|l6yaxy|True|False|False|False|True|True|False|||[]|||dark|text|False||False|False|0|0|False|some_ads|/r/wallstreetbets/comments/l6yaxy/they_blocked_ctrm/|False|7|1611844882|1|They really dont want us to make money huh. CTRM was a penny stock with a good day yesterday. These crooks really went too far.|True|False|False|wallstreetbets|t5_2th52|4590084|public|confidence|self|||They blocked CTRM|0|[]|1.0|https://www.reddit.com/r/wallstreetbets/comments/l6yaxy/they_blocked_ctrm/|some_ads|7||||||2021-01-28|CTRM
[]|False|ryanjenny||[]||text|t2_8rdoyy14|False|False|[]|False|False|2021-01-28 14:35:50|self.wallstreetbets|https://www.reddit.com/r/wallstreetbets/comments/l6y5mq/they_took_my_house_in_2008_lost_my_business_in/|{}|l6y5mq|True|False|False|False|True|True|False|#800080|question|[{'e': 'text', 't': 'Discussion'}]|96f6c79e-b853-11e5-a4cb-0ebdf030e05d|Discussion|light|richtext|False||False|False|0|0|False|some_ads|/r/wallstreetbets/comments/l6y5mq/they_took_my_house_in_2008_lost_my_business_in/|False|7|1611844561|2|I can’t afford GME , I just found out about this yesterday... I’m all in my people!!! Let’s stick together, CTRM for the newbies, can’t wait to play this game...|True|False|False|wallstreetbets|t5_2th52|4582272|public|confidence|self|||They took my house in 2008, lost my business in 2011.... let’s take our money back!!!! CTRM, NOK, AMC, GME|0|[]|1.0|https://www.reddit.com/r/wallstreetbets/comments/l6y5mq/they_took_my_house_in_2008_lost_my_business_in/|some_ads|7||||||2021-01-28|CTRM
