[]|False|NoParlayNoFood||[]||text|t2_4zj12x7n|False|False|[]|False|False|2020-12-22 08:10:45|self.wallstreetbets|https://www.reddit.com/r/wallstreetbets/comments/ki16dp/srne_the_stage_is_set_for_sorrento_therapeutics/|{}|ki16dp|True|False|False|False|True|True|False|#365b8c|dd|[{'e': 'text', 't': 'DD'}]|5692ce02-b860-11e5-b542-0edc7016bbd3|DD|light|richtext|False|False|True|108|0|False|some_ads|/r/wallstreetbets/comments/ki16dp/srne_the_stage_is_set_for_sorrento_therapeutics/|False|7.0|1608624656|1|**Positions: SRNE** 1/15/2021 $10c 🚀 🚀  This post is focused on the non-Covid aspects of SRNE. There are some significant developments on that end as well, which I'll write up later this week. I'll leave you with a little teaser, though - [does this](https://jpeocbrnd.army.mil/docs/default-source/default-document-library/jpm-fact-sheet-surveillance-stick(3).pdf?sfvrsn=55cb2dd7_0) look strangely similar to **SRNE**'s CoviStix, right after they got $37m in funding from DARPA a few weeks ago? Will get to that in the next post...  **DD #1: Pending $1b+ Arbitration: Is it pending, or over and awaiting announcement? See DD2# last 3 cliffnotes...**  Patrick Soon-Shiong (referred to as PSS going forward) was CEO of NantPharma in 2015, and purchased the rights to [Cynviloq from **SRNE**](https://www.genengnews.com/news/sorrento-sells-cynviloq-for-1-3b/) for up to $1.3billion, pending milestones. Shortly afterwards, PSS discontinued development of the blockbuster drug. Why? [Because it benefitted him personally](https://www.fiercebiotech.com/biotech/sorrento-sues-soon-shiong-over-catch-and-kill-its-cancer-drug-a-potential-abraxane-rival).   Tl;dr:  * PSS sells company &amp; Abraxane to Celgene for over $1b in Celgene stock * Abraxane = success = Celgene stock goes up = PSS net worth go uppies * Cynviloq = Direct competitor to Abraxane = Bad news for PSS net worth  * PSS buys Cynviloq from **SRNE**, and halts all progress - aka “Catch and kill” * **SRNE** sues for fraud/breach of contract * PSS tries to get lawsuits dismissed, Judge ain’t having it and ruled it must go to arb * $1bill lawsuit + damages on table  **DD #2: SRNE and PSS’s fates are still intertwined.**   Yesterday (12/21/2020), NantKwest merged with ImmunityBio, and NK saw its stock price soar by 60% during the day. Why is this significant? **NantKwest’s CEO is PSS from DD#1.**  You may be wondering - well, so what, how does that affect **SRNE?** Great question. [**SRNE** owns 10 million shares of ImmunityBio](https://investors.sorrentotherapeutics.com/node/11421/html) (Ctrl+F “ issued 10 million shares of NantCell”). What the hell is NantCell? Ctrl+F “NantCell, Inc. (which subsequently changed its name to ImmunityBio, Inc.)”.  **SRNE** = Significant Shareholder (owns 10m shares, or $160m as of today after the 60% increase) of ImmunityBio. [Open this SEC filing ](https://investors.sorrentotherapeutics.com/node/11421/html)and Ctrl+F “issued 10 million shares of NantCell”  **NantCell = ImmunityBio** (in the same file above,Ctrl+F “NantCell, Inc. (which subsequently changed its name to ImmunityBio, Inc.)”.     ### 🚀🚀🚀🚀🚀🚀SRNE’s significant staked company just agreed to merge with the company owned by PSS, a guy they’re in a billion+ dollar arbitration with currently (DD#1) 🚀🚀🚀🚀🚀  Tl;dr:  * SRNE owns 10mill shares of NantCell * NantCell changed name to ImmunityBio * ImmunityBio just merged with NantKwest (stock went up 60% in one day) * NantKwest CEO is none other than PSS, the guy SRNE is in arbitration with * Reading between the lines, seems like a successful arbitration arrangement will be announced when you consider the filing on October 27th where [**SRNE** voluntarily dissolved agreement to sell up to $250m worth of shares to raise funds.](https://investors.sorrentotherapeutics.com/static-files/bef9e5a6-1189-4f20-844b-6d19b4f3a463) Why? Perhaps another source of funds was found? That filing came a couple days after the last meeting in the arbitration case - go to [LA Court Website](http://www.lacourt.org/casesummary/ui/index.aspx), type in these two case numbers: 20STCV08789,19STCV11328. Oh, and the next court date for both is a “Post-Arbitration” next year. * October 21: Court hearing for the $1b arbitration * October 27th: SRNE voluntarily cuts agreement to sell up to $250m in stock  **DD #3: SRNE rejected $7 a share buyout offer when stock was under $1.6 in November 2019.**  On Monday, November 25th 2019, Sorrento released [this PR](https://investors.sorrentotherapeutics.com/news-releases/news-release-details/sorrento-therapeutics-inc-received-and-rejected-unsolicited-all) stating that they received and rejected a $7/share buyout offer. The trading day prior, the stock price was $1.60. They rejected a buyout of almost 330% premium because they felt **“the offer significantly undervalued Sorrento”** and unanimously rejected it. Keep in mind, this was pre-Covid pipeline, so based on their ownership of their IP / products at the time.  **DD #4: Unusual options activity again!**  Back in March, when SRNE was trading at $1.8, I made a thread on r/options asking about [Unusual Options Activity](https://www.reddit.com/r/options/comments/fl38vh/question_about_unusual_options_activity_does_it/). On March 12th, [someone had purchased ](https://imgur.com/a/rwStwJJ)3700 calls 250% out of the money. SRNE a couple weeks later started its infamous run from $1.8 to $19, and our fellow autists learned about it.  Last week, I noticed unusual options activity again in SRNE. This time, [it was 8500 calls purchased for Jan 15, 2021](https://www.optionsonar.com/unusual-option-activity/srne) representing over $400k in volume for that strike/exp. After a little more digging, I noticed today that there was over $1.4m in Jan 2022 deep ITM calls purchased **just today.**|True|False|False|wallstreetbets|t5_2th52|1728077.0|public|confidence|self|SRNE: The stage is set for Sorrento Therapeutics once again - DD Post #1 - The Non-Covid story|0.0|[]|1.0|https://www.reddit.com/r/wallstreetbets/comments/ki16dp/srne_the_stage_is_set_for_sorrento_therapeutics/|some_ads|7.0|self|{'enabled': False, 'images': [{'id': 'Ayv0ZgLtNTSfesQGJFyn1BUxuY2eHqSJG_69C7nxId8', 'resolutions': [{'height': 70, 'url': 'https://external-preview.redd.it/I6s4p1tI3Rfx0AftNsMjJcUqV5j6LnUcjEucg2I9MZw.jpg?width=108&amp;crop=smart&amp;auto=webp&amp;s=12f357e8218c87e778ab2e7a944360f7847c0999', 'width': 108}, {'height': 140, 'url': 'https://external-preview.redd.it/I6s4p1tI3Rfx0AftNsMjJcUqV5j6LnUcjEucg2I9MZw.jpg?width=216&amp;crop=smart&amp;auto=webp&amp;s=0235878c705bc9383bb43d4577c3e93e933892c2', 'width': 216}, {'height': 208, 'url': 'https://external-preview.redd.it/I6s4p1tI3Rfx0AftNsMjJcUqV5j6LnUcjEucg2I9MZw.jpg?width=320&amp;crop=smart&amp;auto=webp&amp;s=0830f7da9f5c03f6d0fd5de7210c67adb621b733', 'width': 320}, {'height': 416, 'url': 'https://external-preview.redd.it/I6s4p1tI3Rfx0AftNsMjJcUqV5j6LnUcjEucg2I9MZw.jpg?width=640&amp;crop=smart&amp;auto=webp&amp;s=e338727b92a880add30b4f78ff63350e73710ce2', 'width': 640}], 'source': {'height': 504, 'url': 'https://external-preview.redd.it/I6s4p1tI3Rfx0AftNsMjJcUqV5j6LnUcjEucg2I9MZw.jpg?auto=webp&amp;s=c592f9e7f2d0fe9ea45e9bf506ff5086246e87fd', 'width': 775}, 'variants': {}}]}|||||||||||||2020-12-22|SRNE
[]|False|pgh1979||[{'e': 'text', 't': '\x1b201123:7:1'}]|201123:7:1|richtext|t2_4wj69nbh|False|False|[]|False|False|2020-12-14 21:43:19|self.wallstreetbets|https://www.reddit.com/r/wallstreetbets/comments/kd7aqe/covid_underreporting_and_the_bear_case_for/|{}|kd7aqe|True|False|False|False|True|True|False|#800080|question|[{'e': 'text', 't': 'Discussion'}]|96f6c79e-b853-11e5-a4cb-0ebdf030e05d|Discussion|light|richtext|False|False|True|2|0|False|no_ads|/r/wallstreetbets/comments/kd7aqe/covid_underreporting_and_the_bear_case_for/|False|0.0|1607982210|1|I have been a Vaccine bull till now with investments in NVAX, V\*RT, INO,SRNE,ALT (and previously MRNA, PFE, AZN). I have high hopes for NVAX for better safety, INO for better temperature stability and V\*RT and INO for better administration.  However something has started to scare me. Some Scientific studies are saying Covid is underreported by 12 to 1 and we have 12 million confirmed cases. if these studies are correct , 150 million or almost half the US population has already had Covid and recovered from it. Given the Thanksgiving and Christmas spread by January we could have 70% of the US population already exposed to Covid and developed immunity. 70% is herd immunity. At that point what is the market for Vaccines?|True|False|False|wallstreetbets|t5_2th52|1699298.0|public|confidence|self|Covid Underreporting and the bear case for Vaccines|0.0|[]|1.0|https://www.reddit.com/r/wallstreetbets/comments/kd7aqe/covid_underreporting_and_the_bear_case_for/|no_ads|0.0||||||dark|||||||||2020-12-14|SRNE
[]|False|BitterConcentrate9||[]||text|t2_6aoh965f|False|False|[]|False|False|2020-11-29 01:20:33|self.wallstreetbets|https://www.reddit.com/r/wallstreetbets/comments/k3035a/thoughts_on_spi_and_srne_this_week/|{}|k3035a|True|False|False|False|True|True|False|#800080|question|[{'e': 'text', 't': 'Discussion'}]|96f6c79e-b853-11e5-a4cb-0ebdf030e05d|Discussion|light|richtext|False|False|True|4|0|False|no_ads|/r/wallstreetbets/comments/k3035a/thoughts_on_spi_and_srne_this_week/|False|0.0|1606612844|1| Thinking of buying shares in both. SPI has had good in come and delivered 02 EV’s. SRNE has a good federal contract coming. Not sure what price point these two would reach by december 9 i wonder|True|False|False|wallstreetbets|t5_2th52|1628159.0|public|confidence|self|Thoughts on SPI and SRNE this week?|0.0|[]|1.0|https://www.reddit.com/r/wallstreetbets/comments/k3035a/thoughts_on_spi_and_srne_this_week/|no_ads|0.0|||||||||||||||2020-11-29|SRNE
[]|False|cmickle819||[]||text|t2_4x7k45i|False|False|[]|False|False|2020-11-27 18:48:44|self.wallstreetbets|https://www.reddit.com/r/wallstreetbets/comments/k272rg/robinhood_sold_option_automatically/|{}|k272rg|True|False|False|False|True|True|False|#800080|question|[{'e': 'text', 't': 'Discussion'}]|96f6c79e-b853-11e5-a4cb-0ebdf030e05d|Discussion|light|richtext|False|False|True|10|0|False|no_ads|/r/wallstreetbets/comments/k272rg/robinhood_sold_option_automatically/|False|0.0|1606502935|1|"I had a 11/27 7.50c option for SRNE that on Wednesday was red af but was mooning today. I got a notification outta nowhere from robinhood saying they executed a sell bc it was ""high risk."" I've had options expire worthless before so this was new to me. Has this happened to any of y'all and why would they do that"|True|False|False|wallstreetbets|t5_2th52|1624522.0|public|confidence|self|Robinhood sold option automatically|0.0|[]|1.0|https://www.reddit.com/r/wallstreetbets/comments/k272rg/robinhood_sold_option_automatically/|no_ads|0.0|||||||||||||||2020-11-27|SRNE
[]|False|Ankel88||[]||text|t2_2c0j34eq|False|False|[]|False|False|2020-11-27 12:41:35|self.wallstreetbets|https://www.reddit.com/r/wallstreetbets/comments/k20f2b/sorrento_the_only_good_covid_play_backed_by_an/|{}|k20f2b|True|False|False|False|True|True|False|#365b8c|dd|[{'e': 'text', 't': 'DD'}]|5692ce02-b860-11e5-b542-0edc7016bbd3|DD|light|richtext|False|False|True|22|0|False|no_ads|/r/wallstreetbets/comments/k20f2b/sorrento_the_only_good_covid_play_backed_by_an/|False|0.0|1606480906|1|[https://www.tradingview.com/chart/SRNE/LBDNVpga-SRNE-SORRENTO-THERAPEUTICS-BEST-CEO-EVER-10-SHORT-SQUEEZE/](https://www.tradingview.com/chart/SRNE/LBDNVpga-SRNE-SORRENTO-THERAPEUTICS-BEST-CEO-EVER-10-SHORT-SQUEEZE/)  Accurate Due Diligence in the links below. Best [CEO ](https://www.tradingview.com/symbols/NYSE-CEO/)ever, [dr ](https://www.tradingview.com/symbols/TSX-DR/)Henry Ji phd.   Target price 10$ so he can unload his shares and live like a golden millionarie!     The stock has 30% short interest. Short squeeze incoming.  dont short it! dont ruin your family!  [https://twitter.com/RagingBull/status/1298369002872410112?s=20](https://twitter.com/RagingBull/status/1298369002872410112?s=20)  [Sorrento Therapeutics CEO Henry Ji on potential coronavirus antibody - YouTube](https://www.youtube.com/watch?v=SSq5oZWSI0w&amp;%3Bab_channel=CNBCTelevision)   Deep analysis into Sorrento Therapeutics here:   [US stock SRNE! SRNE is Sorrento! Vaccine stock! SRNE! INO! ALT! - YouTube](https://www.youtube.com/watch?v=T3ciV79MGZw)   JAN 21 10C|True|False|True|wallstreetbets|t5_2th52|1622855.0|public|confidence|self|SORRENTO the only good covid play backed by an amazing visionary scammer, Dr. Ji phd|0.0|[]|1.0|https://www.reddit.com/r/wallstreetbets/comments/k20f2b/sorrento_the_only_good_covid_play_backed_by_an/|no_ads|0.0|self|{'enabled': False, 'images': [{'id': 'cDWsRTu1zKfjtfkLerlreyVVrzjfI4ZS9XT8x_3Pgjk', 'resolutions': [{'height': 57, 'url': 'https://external-preview.redd.it/5xWq4wfeK92Bgbn9DSrTlmoOiiYl_dkmKfALE65WN5g.jpg?width=108&amp;crop=smart&amp;auto=webp&amp;s=4e7e79fc6d565624fbe0d2db82f95c6d19f9a873', 'width': 108}, {'height': 114, 'url': 'https://external-preview.redd.it/5xWq4wfeK92Bgbn9DSrTlmoOiiYl_dkmKfALE65WN5g.jpg?width=216&amp;crop=smart&amp;auto=webp&amp;s=e73182d7fca13987defe09a39112c541c3148713', 'width': 216}, {'height': 169, 'url': 'https://external-preview.redd.it/5xWq4wfeK92Bgbn9DSrTlmoOiiYl_dkmKfALE65WN5g.jpg?width=320&amp;crop=smart&amp;auto=webp&amp;s=d7f62b36cb1a493f7f23d9b8516413b49a4daaeb', 'width': 320}, {'height': 339, 'url': 'https://external-preview.redd.it/5xWq4wfeK92Bgbn9DSrTlmoOiiYl_dkmKfALE65WN5g.jpg?width=640&amp;crop=smart&amp;auto=webp&amp;s=d38e76177ceeb26b557683eb248ee9c4a38ef06b', 'width': 640}, {'height': 508, 'url': 'https://external-preview.redd.it/5xWq4wfeK92Bgbn9DSrTlmoOiiYl_dkmKfALE65WN5g.jpg?width=960&amp;crop=smart&amp;auto=webp&amp;s=004785704666d649b0b756664cb3faddf0660f32', 'width': 960}, {'height': 572, 'url': 'https://external-preview.redd.it/5xWq4wfeK92Bgbn9DSrTlmoOiiYl_dkmKfALE65WN5g.jpg?width=1080&amp;crop=smart&amp;auto=webp&amp;s=d9e0b21d1bc27e3887ad7691e53ee3eedb69ac2c', 'width': 1080}], 'source': {'height': 855, 'url': 'https://external-preview.redd.it/5xWq4wfeK92Bgbn9DSrTlmoOiiYl_dkmKfALE65WN5g.jpg?auto=webp&amp;s=eeb37d61eae78d11db87c5b7db82a231d405c815', 'width': 1613}, 'variants': {}}]}|||||||||||||2020-11-27|SRNE
[]|False|WestWater6||[]||text|t2_65lfq4rt|False|False|[]|False|False|2020-11-24 00:31:33|self.wallstreetbets|https://www.reddit.com/r/wallstreetbets/comments/jzubzb/thoughts_on_any_i_should_add/|{}|jzubzb|True|False|False|False|True|True|False|#6189c0|stocks|[{'e': 'text', 't': 'Stocks'}]|234fbd78-ad54-11e5-b4c5-0e73c33c5a0b|Stocks|light|richtext|False|False|False|29|0|False|no_ads|/r/wallstreetbets/comments/jzubzb/thoughts_on_any_i_should_add/|False|0.0|1606177904|1|I just recently started investing. So far I’ve made a few good decisions...  FCEL @5.45 FSR @10.45 GE @9.66. (Meh) PLTR @8.95 FIT @7.05...  NIO and TSLA-sold it because I listened to my boyfriend instead of my gut... I’ve made a few good decisions (and some bad, thanks GME &amp; SRNE)... just wondering if there’s any you would suggest I add.  Thanks In advance.. and good luck!🍀|True|False|False|wallstreetbets|t5_2th52|1606696.0|public|confidence|self|Thoughts on any I should add?|0.0|[]|1.0|https://www.reddit.com/r/wallstreetbets/comments/jzubzb/thoughts_on_any_i_should_add/|no_ads|0.0|||||||||||||||2020-11-24|SRNE
[]|False|Ride_Like_Its_Hawt||[]||text|t2_roig8|False|False|[]|False|False|2020-11-20 16:55:35|self.wallstreetbets|https://www.reddit.com/r/wallstreetbets/comments/jxspki/solo_1218_10c_when_are_you_jumping_ship/|{}|jxspki|True|False|False|False|True|True|False|#800080|question|[{'e': 'text', 't': 'Discussion'}]|96f6c79e-b853-11e5-a4cb-0ebdf030e05d|Discussion|light|richtext|False|False|True|15|0|False|no_ads|/r/wallstreetbets/comments/jxspki/solo_1218_10c_when_are_you_jumping_ship/|False|0.0|1605891346|1|I'm loving these tendies! But holy shit... Up 400%. I learned my lesson by not jumping ship on SRNE at $19 lol.  Just trying to see what other retards are doing.|True|False|False|wallstreetbets|t5_2th52|1599372.0|public|confidence|self|SOLO 12/18 10c... When are you jumping ship?!|0.0|[]|1.0|https://www.reddit.com/r/wallstreetbets/comments/jxspki/solo_1218_10c_when_are_you_jumping_ship/|no_ads|0.0|||||||||||||||2020-11-20|SRNE
[]|False|BakedSteak||[]||text|t2_fsudj|False|False|[]|False|False|2020-10-21 17:55:27|self.wallstreetbets|https://www.reddit.com/r/wallstreetbets/comments/jfhx9i/quick_profit_to_make_this_months_rent/|{}|jfhx9i|True|False|False|False|True|True|False|#800080|question|[{'e': 'text', 't': 'Discussion'}]|96f6c79e-b853-11e5-a4cb-0ebdf030e05d|Discussion|light|richtext|False|False|True|15|0|False|no_ads|/r/wallstreetbets/comments/jfhx9i/quick_profit_to_make_this_months_rent/|False|0.0|1603302938|1|I know how this sub can be so please save any unnecessary comments. I have some cash in on SRNE. Bought in at $10 and it’s been a rollercoaster since  SRNE is only going down and that was money I had set aside to help me make rent this month. I don’t see any short term future with SRNE and need to move my funds  Anyone have any suggestions?|True|False|False|wallstreetbets|t5_2th52|1564179.0|public|confidence|self|Quick profit to make this months rent|0.0|[]|1.0|https://www.reddit.com/r/wallstreetbets/comments/jfhx9i/quick_profit_to_make_this_months_rent/|no_ads|0.0|||||||||||||||2020-10-21|SRNE
[]|False|davidmart0||[]||text|t2_3y1mou2g|False|False|[]|False|False|2020-10-21 05:53:32|self.wallstreetbets|https://www.reddit.com/r/wallstreetbets/comments/jf78ws/fuck_it_insider_info/|{}|jf78ws|True|False|False|False|True|True|False|#365b8c|dd|[{'e': 'text', 't': 'DD'}]|5692ce02-b860-11e5-b542-0edc7016bbd3|DD|light|richtext|False|False|True|31|0|False|no_ads|/r/wallstreetbets/comments/jf78ws/fuck_it_insider_info/|False|0.0|1603259623|1|Fuck this shit my grandma told me to invest in SRNE she’s old and old means wise thats insider info as far a as I know because old people know everything|True|False|False|wallstreetbets|t5_2th52|1563566.0|public|confidence|self|Fuck it, insider info|0.0|[]|1.0|https://www.reddit.com/r/wallstreetbets/comments/jf78ws/fuck_it_insider_info/|no_ads|0.0|||||||||||||||2020-10-21|SRNE
[]|False|DIRTY_MAGICIAN||[]||text|t2_5fmkjio2|False|False|[]|False|False|2020-10-11 23:16:08|self.wallstreetbets|https://www.reddit.com/r/wallstreetbets/comments/j9fphq/discussion_on_the_short_term_of_the_virus_come/|{}|j9fphq|True|False|False|False|True|True|False|#800080|question|[{'e': 'text', 't': 'Discussion'}]|96f6c79e-b853-11e5-a4cb-0ebdf030e05d|Discussion|light|richtext|False|False|True|43|0|False|no_ads|/r/wallstreetbets/comments/j9fphq/discussion_on_the_short_term_of_the_virus_come/|False|0.0|1602458178|1|We watched COVID wave across the earth 6 months ago. Europe is shutting down soon. The last time they started shutting down, we were turning down about 4 weeks later. Within a months time from now, we’re going to be back in the same boat. I feel that with DJI and S&amp;P on the come up, we shall assume that throwing chips on red 20 or 27, ATM, for whichever ETF you prefer, will most likely print.   LIKEWISE, high reacting bio’s/therapeutics, like MRNA, SRNE, NVAX, ASZN, etc., will go green.   Come Monday, I’m going long shares in bio/therapeutics, and putting the shit out of spy and DJI.   Discuss amongst ya’selves..!|True|False|False|wallstreetbets|t5_2th52|1547212.0|public|confidence|self|Discussion on the short term of the virus. Come leave your thoughts, come get some insight.|0.0|[]|1.0|https://www.reddit.com/r/wallstreetbets/comments/j9fphq/discussion_on_the_short_term_of_the_virus_come/|no_ads|0.0|||||||||||||||2020-10-11|SRNE
[]|False|namsilat||[{'e': 'text', 't': 'Putitzer Prize Winning Journalist'}]|Putitzer Prize Winning Journalist|richtext|t2_2rwyy|False|True|[]|False|False|2020-10-08 17:24:52|self.wallstreetbets|https://www.reddit.com/r/wallstreetbets/comments/j7hbiu/my_final_dd/|{}|j7hbiu|True|False|False|False|True|True|False|#365b8c|dd|[{'e': 'text', 't': 'DD'}]|5692ce02-b860-11e5-b542-0edc7016bbd3|DD|light|richtext|False|False|True|610|0|False|no_ads|/r/wallstreetbets/comments/j7hbiu/my_final_dd/|False|0.0|1602177903|1|"Alright dudes.  Last one - I'm going to give it a 70% chance of making everyone fucking rich.  You may know me as the father of ""Chad Robots from the Future"". A ridiculous thread that predicted the IVR pump and dump.  If you bought those calls and sold a week later, you made a 6300% return.  Or my SRNE pump and dump call, that one netted about 3100%.  Or KODK, or the AAPL madness right after the switch to apple silicon through the split.  I called them all as I saw them, and you guys were kind enough to let me know you'd made money.  I'm not going to link to it, because WSB is low effort these days, and I imagine my account is well known enough at this point that guys in this thread will vouch for me.   There is another massive P&amp;D on the horizon.  With as much disdain as there is for technicals in this sub these days, I'm not going to get into the weeds about why. Suffice to say that if GME remains elevated for the next month, or god forbid goes higher, a short squeeze the likes of which we haven't seen since VW will commence.  And you want to get in on it. Right fucking now.  I've picked a position that my crayons say provides the most time opportunity, while remaining cheap enough to really see some massive multiplication in the event of a short squeeze.  GME 9C 1/15/21.   I could have gone for a much more OTM strike price, but I didn't want you dudes to get fucked if this doesn't pop.  You can exit this position around December 15 if it doesn't pop by then and you should still have a fat fraction of your tendies.  But it's going to pop.  And you, my boys, are going to be less poor.  And then we'll all meet at burger king for hugs.   # GME 9C 1/15/21  Just fucking buy it, and you'll finally make your old pops proud."|True|False|False|wallstreetbets|t5_2th52|1538743.0|public|confidence|self|My final DD.|0.0|[]|1.0|https://www.reddit.com/r/wallstreetbets/comments/j7hbiu/my_final_dd/|no_ads|0.0|||||#3ebafc|light|28d11680-b4b7-11e8-8326-0e59e57bcd3e||||||||2020-10-08|SRNE
[]|False|HolyDiverx||[]||text|t2_4d6f51fr|False|False|[]|False|False|2020-09-23 01:23:59|self.wallstreetbets|https://www.reddit.com/r/wallstreetbets/comments/iy0pyv/sorry_tesla_but_that_sorrento/|{}|iy0pyv|True|False|False|False|True|True|False|#6189c0|stocks|[{'e': 'text', 't': 'Stocks'}]|234fbd78-ad54-11e5-b4c5-0e73c33c5a0b|Stocks|light|richtext|False|False|True|9|0|False|no_ads|/r/wallstreetbets/comments/iy0pyv/sorry_tesla_but_that_sorrento/|False|0.0|1600824249|1|"I know everyone is sad about papa musk and his Tesla cars. Stay positive. I promise it WILL work out....   BUT. Did anyone see what Sorrento did? I accidently swing traded it last week through the weekend and was quite pleased with the news and the rise. I'm not telling anyone to go buy it. You should though.   Thats what I call bag holding when it works ""swing trading"".  -HD"|True|False|False|wallstreetbets|t5_2th52|1515367.0|public|confidence|self|Sorry tesla BUT that Sorrento!|0.0|[]|1.0|https://www.reddit.com/r/wallstreetbets/comments/iy0pyv/sorry_tesla_but_that_sorrento/|no_ads|0.0|||||||||||||||2020-09-23|SRNE
[]|False|CuriousNecklaceGuy||[]||text|t2_3z7txuil|False|False|[]|False|False|2020-09-20 20:57:41|self.wallstreetbets|https://www.reddit.com/r/wallstreetbets/comments/iwm3pb/its_ok_to_ask_for_or_offer_price_predictions/|{}|iwm3pb|True|False|False|False|True|True|False|#800080|question|[{'e': 'text', 't': 'Discussion'}]|96f6c79e-b853-11e5-a4cb-0ebdf030e05d|Discussion|light|richtext|False|False|True|207|0|False|no_ads|/r/wallstreetbets/comments/iwm3pb/its_ok_to_ask_for_or_offer_price_predictions/|False|0.0|1600635474|1|I’m tired of seeing the same recycled retorts when someone asks your opinion on a stock’s future price action.   It’s either “nobody knows”, “if we knew, we’d be millionaires”, or “it will go up or down”. Your arrogance is cringe. Your staleness is cringe.  This is a fucking stock trading forum you idiots. We’re here to exchange ideas, build a thesis, confirm our biases, gauge sentiment, and so on.   Of course it’s all speculation and gambling. We know nobody KNOWS what’s going to happen. But what do you THINK is going to happen and why? If you have good DD, share it with the class. If not, then shut the fuck up, so the good DD does not drown in your self-important garbage.  TSLA $510 5/25 🐢 $60 10/16 NIO $24 10/30 SRNE $15 10/16|True|False|False|wallstreetbets|t5_2th52|1509761.0|public|confidence|self|It’s OK to ask for or offer price predictions|0.0|[]|1.0|https://www.reddit.com/r/wallstreetbets/comments/iwm3pb/its_ok_to_ask_for_or_offer_price_predictions/|no_ads|0.0|||||||||||||||2020-09-20|SRNE
