all_awardings|allow_live_comments|author|author_flair_css_class|author_flair_richtext|author_flair_text|author_flair_type|author_fullname|author_patreon_flair|author_premium|awarders|can_mod_post|contest_mode|created_utc|domain|full_link|gildings|id|is_crosspostable|is_meta|is_original_content|is_reddit_media_domain|is_robot_indexable|is_self|is_video|link_flair_background_color|link_flair_css_class|link_flair_richtext|link_flair_template_id|link_flair_text|link_flair_text_color|link_flair_type|locked|media_only|no_follow|num_comments|num_crossposts|over_18|parent_whitelist_status|permalink|pinned|pwls|retrieved_on|score|selftext|send_replies|spoiler|stickied|subreddit|subreddit_id|subreddit_subscribers|subreddit_type|suggested_sort|thumbnail|title|total_awards_received|treatment_tags|upvote_ratio|url|whitelist_status|wls|post_hint|preview|gilded|edited|author_flair_background_color|author_flair_text_color|author_flair_template_id|media_metadata|thumbnail_height|thumbnail_width|steward_reports|updated_utc|brand_safe|rte_mode|date|ticker
[]|False|Accomplished-Ad-1251||[]||text|t2_a12xkq8v|False|False|[]|False|False|2021-03-30 22:07:26|self.wallstreetbets|https://www.reddit.com/r/wallstreetbets/comments/mgra40/shorts_loserstermites/|{}|mgra40|True|False|False|False|True|True|False|#014980|meme|[{'e': 'text', 't': 'Meme'}]|0513bea8-4f64-11e9-886d-0e2b4fe7300c|Meme|light|richtext|False|False|True|0|0|False|some_ads|/r/wallstreetbets/comments/mgra40/shorts_loserstermites/|False|7.0|1617142057|1|I can’t stand termite cockroach shorts. SRNE 60 million shares shorted. We will 🚀💥🔥🔥💵💰💥💎💪🚀sooner or later the squeeze will happen. GLTAL.|True|False|False|wallstreetbets|t5_2th52|9695072.0|public|confidence|self|Shorts= #losers#termites|0.0|[]|1.0|https://www.reddit.com/r/wallstreetbets/comments/mgra40/shorts_loserstermites/|some_ads|7.0|||||||||||||||2021-03-30|SRNE
[]|False|Unique-bets||[]||text|t2_a2szvkjk|False|False|[]|False|False|2021-03-12 05:19:44|self.wallstreetbets|https://www.reddit.com/r/wallstreetbets/comments/m3ak0r/shares_in_street_name_vs_your_name_on_the_book/|{}|m3ak0r|True|False|False|False|True|True|False|#800080|question|[{'e': 'text', 't': 'Discussion'}]|96f6c79e-b853-11e5-a4cb-0ebdf030e05d|Discussion|light|richtext|False|False|True|7|0|False|some_ads|/r/wallstreetbets/comments/m3ak0r/shares_in_street_name_vs_your_name_on_the_book/|False|7.0|1615526395|1|"**All Shares when we purchase are registered by default by the Broker Street Name on the book. Hence, whoever owns the book deed, owns all rights including renting, borrowing funds, using them as collateral. We are only on the Broker internal pc and has insurance covering the number of Shares. But DRS is registering the Shares electronically on the Book deed under your name. This is Free. If enough of us transfer even a portion 50% into DRS then say the broker must register for us the legitimate shares. Then forces the dealer any remaining DRS shares requested to seek it from Shorts and forces the Squeeze. But DRS separate the shares as for us the broker must register the legitimate shares.**    **For example with TDAmeritrade, I filled this:**[**tdameritrade.com/retail-en\_...**](https://www.tdameritrade.com/retail-en_us/resources/pdf/TDA100557.pdf) **then attached it internally under my account to TD stating transfer number of shares (Stock Symbol) to ""AST"" American Security Transfer. There is also PST (Philadelphia Stock Transfer) here is the link:** [**us.astfinancial.com/Content...**](https://us.astfinancial.com/Content/articles/15537_50.pdf?7/3/20115) **Since it is a new account when I filled the TDAmeritrade under Transfer account Number I put ""AST"" then transferred out and I got a letter of my account No from PST (so later I use the number to transfer back and forth by using the DRS application and submit to TDAmeritrade. The SEC explanation about it is here:** [**sec.gov/reportspubs/investo...**](https://www.sec.gov/reportspubs/investor-publications/investorpubsholdsechtm.html) **but since we are under relentless Short Attack, the most advantage of this is forcing the broker to transfer and protect the legitimate Shares first and keep the naked shares at the broker.**    **Large brokers can do the DRS. email your broker and ask them. Because DRS needs to initiate whether you transfer the shares into your name or back into street name to sell them when you need to. It is for free with the companies I listed above. If your broker does not do DRS or refuse to do it to discourage you like Robinhood does not. So I opened a free account with a broker than does first like TDAmeritrade. Then from TDAmeritrade, I used the Transfer fund feature and select from another broker and then follow Robinhood instruction:** [**robinhood.com/us/en/support...**](https://robinhood.com/us/en/support/articles/transfer-stocks-out-of-your-robinhood-account/) **This stage Robinhood charged 75.**    **For example with TDAmeritrade, I filled this:** [**https://www.tdameritrade.com/retail-en\_us/resources/pdf/TDA100557.pdf**](https://www.tdameritrade.com/retail-en_us/resources/pdf/TDA100557.pdf)  Then attached it internally under my account to TD stating transfer number of shares SRNE to ""AST"" American Security Transfer. There is also PST (Philadelphia Stock Transfer) here is the link:  [https://us.astfinancial.com/Content/articles/15537\_50.pdf?7/3/20115](https://us.astfinancial.com/Content/articles/15537_50.pdf?7/3/20115)  Since it is a new account when I filled the TDAmeritrade under Transfer account Number I put ""AST"" then transferred out and I got a letter of my account No from PST (so later I use the number to transfer back and forth by using the DRS application and submit to TDAmeritrade. The SEC explanation about it is here:  [https://www.sec.gov/reportspubs/investor-publications/investorpubsholdsechtm.html](https://www.sec.gov/reportspubs/investor-publications/investorpubsholdsechtm.html)  So, from the time I filled the DRS and transferred out was 4 days. Then took 3 days to receive a letter by mail with my new account. Then to transfer back, I filled same DRS and stated to transfer back the shares and also scanned and attached the letter with my shares. It took about 3 days to see my shares back into my TDAmeritrade account. So the disadvantage one  can find is the few days needed to get the shares back into the account with the broker to be able to sell them."|True|False|False|wallstreetbets|t5_2th52|9513678.0|public|confidence|self|Shares in Street Name VS Your name on the Book like who owns the property Deeds controls lending out or not|0.0|[]|1.0|https://www.reddit.com/r/wallstreetbets/comments/m3ak0r/shares_in_street_name_vs_your_name_on_the_book/|some_ads|7.0|||||||||||||||2021-03-12|SRNE
[]|False|StocktraderDK||[]||text|t2_a1okascq|False|False|[]|False|False|2021-03-11 21:30:46|self.wallstreetbets|https://www.reddit.com/r/wallstreetbets/comments/m31alo/srne_this_article_mentioned_reddit_i_wonder_if/|{}|m31alo|True|False|False|False|True|True|False|#800080|question|[{'e': 'text', 't': 'Discussion'}]|96f6c79e-b853-11e5-a4cb-0ebdf030e05d|Discussion|light|richtext|False|False|True|0|0|False|some_ads|/r/wallstreetbets/comments/m31alo/srne_this_article_mentioned_reddit_i_wonder_if/|False|7.0|1615498256|1|[https://investorplace.com/2021/03/dip-opportunity-own-srne-stock/?mod=mw\_quote\_news](https://investorplace.com/2021/03/dip-opportunity-own-srne-stock/?mod=mw_quote_news)|True|False|False|wallstreetbets|t5_2th52|9510014.0|public|confidence|self|$SRNE this article mentioned reddit I wonder if that is true and SRNE is a Reddit strong play ?|0.0|[]|1.0|https://www.reddit.com/r/wallstreetbets/comments/m31alo/srne_this_article_mentioned_reddit_i_wonder_if/|some_ads|7.0|self|{'enabled': False, 'images': [{'id': 'mWgiLcmGsb5w2AYJqETAWEsUq9ogStL_AO190pvwqIY', 'resolutions': [{'height': 60, 'url': 'https://external-preview.redd.it/NYlYHY1MssmJmX9y24Roh6WIkE0UL4VgRj86oPPRC0s.jpg?width=108&amp;crop=smart&amp;auto=webp&amp;s=208e812c46c0bb4be8d0d74501e09cb243c11233', 'width': 108}, {'height': 121, 'url': 'https://external-preview.redd.it/NYlYHY1MssmJmX9y24Roh6WIkE0UL4VgRj86oPPRC0s.jpg?width=216&amp;crop=smart&amp;auto=webp&amp;s=07a13cc70654c02ba3a2a1c1ed20986776a526dd', 'width': 216}, {'height': 180, 'url': 'https://external-preview.redd.it/NYlYHY1MssmJmX9y24Roh6WIkE0UL4VgRj86oPPRC0s.jpg?width=320&amp;crop=smart&amp;auto=webp&amp;s=9a81e245088d3fff373fa9788e45eda8c1a623cd', 'width': 320}, {'height': 360, 'url': 'https://external-preview.redd.it/NYlYHY1MssmJmX9y24Roh6WIkE0UL4VgRj86oPPRC0s.jpg?width=640&amp;crop=smart&amp;auto=webp&amp;s=4b6adc2350a1fbbe96b5dc6f809e2b760bebaed2', 'width': 640}, {'height': 540, 'url': 'https://external-preview.redd.it/NYlYHY1MssmJmX9y24Roh6WIkE0UL4VgRj86oPPRC0s.jpg?width=960&amp;crop=smart&amp;auto=webp&amp;s=1590a76220b67512a8a9cc19435168984d9d8381', 'width': 960}, {'height': 607, 'url': 'https://external-preview.redd.it/NYlYHY1MssmJmX9y24Roh6WIkE0UL4VgRj86oPPRC0s.jpg?width=1080&amp;crop=smart&amp;auto=webp&amp;s=e14ce3b5d37f83245601cef1065a2b6198608406', 'width': 1080}], 'source': {'height': 900, 'url': 'https://external-preview.redd.it/NYlYHY1MssmJmX9y24Roh6WIkE0UL4VgRj86oPPRC0s.jpg?auto=webp&amp;s=482625a2bda014be4dca61ef013d4686016427ff', 'width': 1600}, 'variants': {}}]}|||||||||||||2021-03-11|SRNE
[]|False|KonsciousNJ||[]||text|t2_a1f7nooh|False|True|[]|False|False|2021-03-11 19:03:40|self.wallstreetbets|https://www.reddit.com/r/wallstreetbets/comments/m2xzi4/top_picks_for_next_3_months/|{}|m2xzi4|True|False|False|False|True|True|False|#800080|question|[{'e': 'text', 't': 'Discussion'}]|96f6c79e-b853-11e5-a4cb-0ebdf030e05d|Discussion|light|richtext|False|False|False|0|0|False|some_ads|/r/wallstreetbets/comments/m2xzi4/top_picks_for_next_3_months/|False|7.0|1615489430|1|#SRNE #PLTR #BNGO #HGEN #NNDM|True|False|False|wallstreetbets|t5_2th52|9508241.0|public|confidence|self|Top picks for next 3 months|0.0|[]|1.0|https://www.reddit.com/r/wallstreetbets/comments/m2xzi4/top_picks_for_next_3_months/|some_ads|7.0|||||||||||||||2021-03-11|SRNE
[]|False|profromdover2021||[]||text|t2_9xrmzw4z|False|False|[]|False|False|2021-03-10 13:06:57|self.wallstreetbets|https://www.reddit.com/r/wallstreetbets/comments/m1x281/srne_shorts/|{}|m1x281|True|False|False|False|True|True|False|#800080|question|[{'e': 'text', 't': 'Discussion'}]|96f6c79e-b853-11e5-a4cb-0ebdf030e05d|Discussion|light|richtext|False|False|False|0|0|False|some_ads|/r/wallstreetbets/comments/m1x281/srne_shorts/|False|7.0|1615381627|1|Is anybody following SRNE?  What does the group thing about this stock.|True|False|False|wallstreetbets|t5_2th52|9484771.0|public|confidence|self|SRNE Shorts|0.0|[]|1.0|https://www.reddit.com/r/wallstreetbets/comments/m1x281/srne_shorts/|some_ads|7.0|||||||||||||||2021-03-10|SRNE
"[{'award_sub_type': 'GLOBAL', 'award_type': 'global', 'awardings_required_to_grant_benefits': None, 'coin_price': 500, 'coin_reward': 100, 'count': 1, 'days_of_drip_extension': 0, 'days_of_premium': 7, 'description': 'Gives 100 Reddit Coins and a week of r/lounge access and ad-free browsing.', 'end_date': None, 'giver_coin_reward': None, 'icon_format': None, 'icon_height': 512, 'icon_url': 'https://www.redditstatic.com/gold/awards/icon/gold_512.png', 'icon_width': 512, 'id': 'gid_2', 'is_enabled': True, 'is_new': False, 'name': 'Gold', 'penny_donate': None, 'penny_price': None, 'resized_icons': [{'height': 16, 'url': 'https://www.redditstatic.com/gold/awards/icon/gold_16.png', 'width': 16}, {'height': 32, 'url': 'https://www.redditstatic.com/gold/awards/icon/gold_32.png', 'width': 32}, {'height': 48, 'url': 'https://www.redditstatic.com/gold/awards/icon/gold_48.png', 'width': 48}, {'height': 64, 'url': 'https://www.redditstatic.com/gold/awards/icon/gold_64.png', 'width': 64}, {'height': 128, 'url': 'https://www.redditstatic.com/gold/awards/icon/gold_128.png', 'width': 128}], 'resized_static_icons': [{'height': 16, 'url': 'https://www.redditstatic.com/gold/awards/icon/gold_16.png', 'width': 16}, {'height': 32, 'url': 'https://www.redditstatic.com/gold/awards/icon/gold_32.png', 'width': 32}, {'height': 48, 'url': 'https://www.redditstatic.com/gold/awards/icon/gold_48.png', 'width': 48}, {'height': 64, 'url': 'https://www.redditstatic.com/gold/awards/icon/gold_64.png', 'width': 64}, {'height': 128, 'url': 'https://www.redditstatic.com/gold/awards/icon/gold_128.png', 'width': 128}], 'start_date': None, 'static_icon_height': 512, 'static_icon_url': 'https://www.redditstatic.com/gold/awards/icon/gold_512.png', 'static_icon_width': 512, 'subreddit_coin_reward': 0, 'subreddit_id': None, 'tiers_by_required_awardings': None}, {'award_sub_type': 'GLOBAL', 'award_type': 'global', 'awardings_required_to_grant_benefits': None, 'coin_price': 100, 'coin_reward': 0, 'count': 1, 'days_of_drip_extension': 0, 'days_of_premium': 0, 'description': ""Shows the Silver Award... and that's it."", 'end_date': None, 'giver_coin_reward': None, 'icon_format': None, 'icon_height': 512, 'icon_url': 'https://www.redditstatic.com/gold/awards/icon/silver_512.png', 'icon_width': 512, 'id': 'gid_1', 'is_enabled': True, 'is_new': False, 'name': 'Silver', 'penny_donate': None, 'penny_price': None, 'resized_icons': [{'height': 16, 'url': 'https://www.redditstatic.com/gold/awards/icon/silver_16.png', 'width': 16}, {'height': 32, 'url': 'https://www.redditstatic.com/gold/awards/icon/silver_32.png', 'width': 32}, {'height': 48, 'url': 'https://www.redditstatic.com/gold/awards/icon/silver_48.png', 'width': 48}, {'height': 64, 'url': 'https://www.redditstatic.com/gold/awards/icon/silver_64.png', 'width': 64}, {'height': 128, 'url': 'https://www.redditstatic.com/gold/awards/icon/silver_128.png', 'width': 128}], 'resized_static_icons': [{'height': 16, 'url': 'https://www.redditstatic.com/gold/awards/icon/silver_16.png', 'width': 16}, {'height': 32, 'url': 'https://www.redditstatic.com/gold/awards/icon/silver_32.png', 'width': 32}, {'height': 48, 'url': 'https://www.redditstatic.com/gold/awards/icon/silver_48.png', 'width': 48}, {'height': 64, 'url': 'https://www.redditstatic.com/gold/awards/icon/silver_64.png', 'width': 64}, {'height': 128, 'url': 'https://www.redditstatic.com/gold/awards/icon/silver_128.png', 'width': 128}], 'start_date': None, 'static_icon_height': 512, 'static_icon_url': 'https://www.redditstatic.com/gold/awards/icon/silver_512.png', 'static_icon_width': 512, 'subreddit_coin_reward': 0, 'subreddit_id': None, 'tiers_by_required_awardings': None}]"|False|simmitysam1980||[]||text|t2_a11gyz4r|False|True|[]|False|False|2021-02-26 15:03:46|self.wallstreetbets|https://www.reddit.com/r/wallstreetbets/comments/lszhhw/short_intrest_friday/|{'gid_1': 1, 'gid_2': 1}|lszhhw|True|False|False|False|True|True|False|#365b8c|dd|[{'e': 'text', 't': 'DD'}]|5692ce02-b860-11e5-b542-0edc7016bbd3|DD|light|richtext|False|False|False|185|1|False|some_ads|/r/wallstreetbets/comments/lszhhw/short_intrest_friday/|False|7.0|1614453248|196|Data from https://highshortinterest.com/  GameStop (GME) - 41.22% Short Interest  Tanger Factory Outlet Centers (SKT) - 39.98%  Academy Sports &amp; Outdoors (ASO) - 37.18%  Rocket Companies (RKT) - 35.73%  Gogo (GOGO) - 35.04%  Clovis Oncology (CLVS) - 34.54%  Triterras (TRIT) - 32.04%  Madrigal Pharmaceuticals (MDGL) - 31.60%  GSX Techedu (GSX) - 31.19%  Ontrak (OTRK) - 30.86%  Lannett Company (LCI) - 28.97%  Accelerate Diagnostics (AXDX) - 28.95%  Revlon (REV) - 28.22%  Blink Charging (BLNK) - 28.18%  Corbus Pharmaceuticals (CRBP) - 27.81%  iSun (ISUN) - 27.37%  Intercept Pharmaceuticals (ICPT) - 26.95%  Carvana (CVNA) - 26.32%  Vaxart (VXRT) - 26.30%  SmileDirectClub (SDC) - 26.23%  SunPower (SPWR) - 25.86%  Tootsie Roll (TR) - 25.56%  Retractable Technologies (RVP) - 25.42%  Precigen (PGEN) - 25.21%  Bed Bath &amp; Beyond (BBBY) - 25.00%  Beyond Meat (BYND) - 23.53%  Rubius Therapeutics (RUBY) - 23.49%  Karyopharm Therapeutics (KPTI) - 23.36%  Sorrento Therapeutics (SRNE) - 23.09%  Opko Health (OPK) - 23.07%   |True|False|False|wallstreetbets|t5_2th52|9330536.0|public|confidence|self|Short intrest Friday|2.0|[]|0.94|https://www.reddit.com/r/wallstreetbets/comments/lszhhw/short_intrest_friday/|some_ads|7.0|||1.0||||||||||||2021-02-26|SRNE
"[{'award_sub_type': 'GLOBAL', 'award_type': 'global', 'awardings_required_to_grant_benefits': None, 'coin_price': 100, 'coin_reward': 0, 'count': 1, 'days_of_drip_extension': 0, 'days_of_premium': 0, 'description': ""Shows the Silver Award... and that's it."", 'end_date': None, 'giver_coin_reward': None, 'icon_format': None, 'icon_height': 512, 'icon_url': 'https://www.redditstatic.com/gold/awards/icon/silver_512.png', 'icon_width': 512, 'id': 'gid_1', 'is_enabled': True, 'is_new': False, 'name': 'Silver', 'penny_donate': None, 'penny_price': None, 'resized_icons': [{'height': 16, 'url': 'https://www.redditstatic.com/gold/awards/icon/silver_16.png', 'width': 16}, {'height': 32, 'url': 'https://www.redditstatic.com/gold/awards/icon/silver_32.png', 'width': 32}, {'height': 48, 'url': 'https://www.redditstatic.com/gold/awards/icon/silver_48.png', 'width': 48}, {'height': 64, 'url': 'https://www.redditstatic.com/gold/awards/icon/silver_64.png', 'width': 64}, {'height': 128, 'url': 'https://www.redditstatic.com/gold/awards/icon/silver_128.png', 'width': 128}], 'resized_static_icons': [{'height': 16, 'url': 'https://www.redditstatic.com/gold/awards/icon/silver_16.png', 'width': 16}, {'height': 32, 'url': 'https://www.redditstatic.com/gold/awards/icon/silver_32.png', 'width': 32}, {'height': 48, 'url': 'https://www.redditstatic.com/gold/awards/icon/silver_48.png', 'width': 48}, {'height': 64, 'url': 'https://www.redditstatic.com/gold/awards/icon/silver_64.png', 'width': 64}, {'height': 128, 'url': 'https://www.redditstatic.com/gold/awards/icon/silver_128.png', 'width': 128}], 'start_date': None, 'static_icon_height': 512, 'static_icon_url': 'https://www.redditstatic.com/gold/awards/icon/silver_512.png', 'static_icon_width': 512, 'subreddit_coin_reward': 0, 'subreddit_id': None, 'tiers_by_required_awardings': None}]"|False|Nomad79||[]||text|t2_r7v6p|False|False|[]|False|False|2021-02-21 03:18:41|self.wallstreetbets|https://www.reddit.com/r/wallstreetbets/comments/lonrjb/why_i_think_sorrento_therapeutics_will_go_to_the/|{'gid_1': 1}|lonrjb|True|False|False|False|True|True|False|#800080|question|[{'e': 'text', 't': 'Discussion'}]|96f6c79e-b853-11e5-a4cb-0ebdf030e05d|Discussion|light|richtext|False|False|False|42|0|False|some_ads|/r/wallstreetbets/comments/lonrjb/why_i_think_sorrento_therapeutics_will_go_to_the/|False|7.0|1613878794|9|Not only do they have several huge catalysts waiting for FDA approval, the UPS will be using their strips for pilots. The news broke AH on Friday and they also released their 10k. A rumor of a takeover bid, however I believe they will just sell the rights to all Covid projects to bigger PHarma. Not to mention good ole Biden is dumping billions into rapid testing, and that's exactly what Sorrento does, and may be FDA approved this upcoming week. So long story short, do your own DD but I'm rich on Monday lol, maybe you too if you get in in time. News article and link in the comments. https://www.whitehouse.gov/briefing-room/legislation/2021/01/20/president-biden-announces-american-rescue-plan/|True|False|False|wallstreetbets|t5_2th52|9182208.0|public|confidence|self|Why I think Sorrento Therapeutics will go to the moon on Monday.|1.0|[]|0.85|https://www.reddit.com/r/wallstreetbets/comments/lonrjb/why_i_think_sorrento_therapeutics_will_go_to_the/|some_ads|7.0|self|{'enabled': False, 'images': [{'id': 'ZNmtnK_lKgHB3spQIpgDtNznEADE6oLEzeeSxD2gjRA', 'resolutions': [{'height': 56, 'url': 'https://external-preview.redd.it/spaDswURq9g_RyRhvXvYjrjKl3CSZoz5wiuHccbfWNk.jpg?width=108&amp;crop=smart&amp;auto=webp&amp;s=1e6a1a09058a728467c838a3da551928e0cfd6dc', 'width': 108}, {'height': 113, 'url': 'https://external-preview.redd.it/spaDswURq9g_RyRhvXvYjrjKl3CSZoz5wiuHccbfWNk.jpg?width=216&amp;crop=smart&amp;auto=webp&amp;s=765a08f5be62e8a63d120257dd3a2f33015602fa', 'width': 216}, {'height': 168, 'url': 'https://external-preview.redd.it/spaDswURq9g_RyRhvXvYjrjKl3CSZoz5wiuHccbfWNk.jpg?width=320&amp;crop=smart&amp;auto=webp&amp;s=4271ab6efa59896070b846e6abc0513295f3c9ec', 'width': 320}, {'height': 336, 'url': 'https://external-preview.redd.it/spaDswURq9g_RyRhvXvYjrjKl3CSZoz5wiuHccbfWNk.jpg?width=640&amp;crop=smart&amp;auto=webp&amp;s=eacedf1618ef395a983aee164caf950ed6dd3917', 'width': 640}, {'height': 504, 'url': 'https://external-preview.redd.it/spaDswURq9g_RyRhvXvYjrjKl3CSZoz5wiuHccbfWNk.jpg?width=960&amp;crop=smart&amp;auto=webp&amp;s=4b9969e27c99dfe7c479764ed6241559826c76c6', 'width': 960}, {'height': 567, 'url': 'https://external-preview.redd.it/spaDswURq9g_RyRhvXvYjrjKl3CSZoz5wiuHccbfWNk.jpg?width=1080&amp;crop=smart&amp;auto=webp&amp;s=17f04a6d14491d0f7e072ae8473730300f76eb2c', 'width': 1080}], 'source': {'height': 630, 'url': 'https://external-preview.redd.it/spaDswURq9g_RyRhvXvYjrjKl3CSZoz5wiuHccbfWNk.jpg?auto=webp&amp;s=32ba56f14cb1b5e65116a9a1fb40c8ce37c585ae', 'width': 1200}, 'variants': {}}]}||1613878327.0|||||||||||2021-02-21|SRNE
[]|False|mjbeatz50||[]||text|t2_sz7bj|False|False|[]|False|False|2021-02-18 15:46:37|self.wallstreetbets|https://www.reddit.com/r/wallstreetbets/comments/lmpnkg/srne_squeeze/|{}|lmpnkg|True|False|False|False|True|True|False|#349e48|profit|[{'e': 'text', 't': 'Gain'}]|6bd9394c-0a95-11e9-82db-0eb3a11267a0|Gain|light|richtext|False|False|True|0|0|False|some_ads|/r/wallstreetbets/comments/lmpnkg/srne_squeeze/|False|7.0|1613663208|1|So much potential for this company to blow up!! SRNE is the new GME 🚀🚀 Cheap shares and potential for huge upside!! 💵💵 but these damn shorts keep bringing down the price. We need to rise up and burn these mofo shorts to the ground! SRNE for the win! 🚀🚀|True|False|False|wallstreetbets|t5_2th52|9131471.0|public|confidence|self|SRNE SQUEEZE|0.0|[]|1.0|https://www.reddit.com/r/wallstreetbets/comments/lmpnkg/srne_squeeze/|some_ads|7.0|||||||||||||||2021-02-18|SRNE
[]|False|treeditor||[]||text|t2_67p7z|False|False|[]|False|False|2021-02-14 14:09:40|self.wallstreetbets|https://www.reddit.com/r/wallstreetbets/comments/ljp1ai/srne_eventual_opportunity/|{}|ljp1ai|True|False|False|False|True|True|False|#800080|question|[{'e': 'text', 't': 'Discussion'}]|96f6c79e-b853-11e5-a4cb-0ebdf030e05d|Discussion|light|richtext|False|False|True|11|0|False|some_ads|/r/wallstreetbets/comments/ljp1ai/srne_eventual_opportunity/|False|7.0|1613311790|1|SRNE - Sorrento Therapeutics.  It is a biotechnology company with a market cap of $3.9Bln.   The stock had great volatile sessions during the last months.  As a lot of its peers, it has a line of COVID-related products, but not only - also has promising products on cancer and pain management. On January the stock soared with the news of a partnership with Mayo Clinic and some good data on its COVID trials.  Average consensus give it a potential upturn of 100%, furthemore 22.8% of its stock is shorted.  What do you think about it? Anyone here has some interest in Sorrento?  I bought this week at an average of $16.  Have a good Sunday ladies and gentlemen from WSB.|True|False|False|wallstreetbets|t5_2th52|9032260.0|public|confidence|self|$SRNE eventual opportunity?|0.0|[]|1.0|https://www.reddit.com/r/wallstreetbets/comments/ljp1ai/srne_eventual_opportunity/|some_ads|7.0|||||||||||||||2021-02-14|SRNE
[]|False|treeditor||[]||text|t2_67p7z|False|False|[]|False|False|2021-02-12 02:07:11|self.wallstreetbets|https://www.reddit.com/r/wallstreetbets/comments/li131j/srne_new_game/|{}|li131j|True|False|False|False|True|True|False|#800080|question|[{'e': 'text', 't': 'Discussion'}]|96f6c79e-b853-11e5-a4cb-0ebdf030e05d|Discussion|light|richtext|False|False|True|2|0|False|some_ads|/r/wallstreetbets/comments/li131j/srne_new_game/|False|7.0|1613095642|1|Sorrento Therapeutics - Good small sized biotech, potentially underappreciated stock. As all of them involved in COVID but it also has a good stream of inovative solutions underway on cancer therapeutics and pain management. Developing a partnership with Mayo Clinic which gave some stamina this week. Even if not successful, volatility is great with potential big wins or big losses. I am on it. What do you think of this corp? Greetings ladies and gentlemen WSbeters|True|False|False|wallstreetbets|t5_2th52|8951309.0|public|confidence|self|SRNE , new game?|0.0|[]|1.0|https://www.reddit.com/r/wallstreetbets/comments/li131j/srne_new_game/|some_ads|7.0|||||||||||||||2021-02-12|SRNE
