[]|False|TransSpeciesDog||[]||text|t2_4ia6aikw|False|False|[]|False|False|2020-05-18 20:21:47|self.wallstreetbets|https://www.reddit.com/r/wallstreetbets/comments/gm9chk/auto_dd_for_via_wsb_mentions/|{}|gm9chk|True|False|False|False|True|True|False|#365b8c|dd|[{'e': 'text', 't': 'DD'}]|5692ce02-b860-11e5-b542-0edc7016bbd3|DD|light|richtext|False|False|True|21|0|False|some_ads|/r/wallstreetbets/comments/gm9chk/auto_dd_for_via_wsb_mentions/|False|7.0|1589833311|1|Been working with a Python script to output the number of stock ticker mentions in a given subreddit (it checks posts and comments). Here's a list for the most mentioned stocks...  **In the past 24 hours (&gt;=30):**      SRNE	393     DIS	375     WMT	309     EOD	290     DKNG	253     LOW	239     BABA	232     NVDA	229     TSLA	224     MRNA	217     ACB	195     VTIQ	165     PCG	149     CRM	144     ATH	126     AMD	104     GSX	100     RTX	99     NAT	94     AMZN	86     HUYA	85     MSFT	83     SHOP	83     PTON	81     TGT	81     CEO	80     USA	78     VBIV	77     RESI	77     SPCE	66     AAPL	65     HPQ	62     BIDU	61     FOR	60     ARE	56     NOW	54     ALL	53     QQQ	52     NVAX	48     GDP	47     CCL	47     AAL	47     PLT	46     BYND	46     JCP	44     IMO	42     DAL	42     RCL	41     CSCO	41     DOW	41     EURN	39     SPG	38     AUY	35     TTWO	34     SBUX	34     STNG	33     WTI	32     JPM	31     SPLK	31     OUT	31     GILD	30     CGC	30     WORK	30  I**n the past week (&gt;=60):**      VTIQ	3014     DKNG	2480     TSLA	2074     CSCO	2022     EOD	1853     WMT	1379     DIS	1211     SDC	1194     SRNE	1146     BABA	1084     NVDA	964     CRM	959     AAPL	771     ATH	728     AMD	703     LOW	689     MSFT	666     CODX	653     ACB	624     CEO	620     QQQ	525     AMC	471     CSOD	468     NVAX	465     NAT	463     SHOP	456     SPCE	453     VBIV	442     AMZN	436     AAL	430     GRUB	424     RTX	409     USA	405     FOR	397     NET	396     PCG	364     BYND	349     DAL	348     JCP	341     LOGI	338     DDOG	327     TGT	327     MRNA	326     ALL	311     EURN	311     PLT	308     NOW	308     PDT	302     ARE	300     PTON	294     STNG	283     PPT	271     IMO	257     CCL	252     TQQQ	247     GDP	244     WFC	242     AMAT	238     JPM	237     PUMP	231     SNAP	214     LUV	207     DOW	207     UBER	195     BAC	182     ATVI	176     GSX	164     RCL	162     BIDU	156     TDA	151     WTI	151     OUT	150     HUYA	149     UAL	146     INO	145     APT	139     SBUX	139     TTWO	139     WORK	138     SAVE	137     WIX	137     GILD	133     TVIX	133     HPQ	133     RIOT	131     NFLX	131     NCLH	128     CAN	128     ONE	125     BIG	123     TWLO	122     MGM	120     EDIT	114     TLT	113     DHT	112     XOM	111     MARK	107     SPG	105     LULU	104     RESI	101     HAS	101     RVLV	99     BOX	98     NEWR	97     SQQQ	92     PANW	92     GOOG	91     AMCX	91     PENN	90     SPLK	89     ROKU	89     CMG	85     LVGO	82     DOCU	81     MAN	81     GOLD	79     CZR	79     CGC	78     CHK	75     PLAY	74     MVIS	74     VTIQW	73     TAK	73     GOOD	73     HTZ	72     BCRX	71     CDC	70     DTE	69     ULTA	68     FSLY	68     ENPH	68     HPE	66     VERY	66     CHWY	65     OKTA	62     NEW	62     ZUO	61     ARWR	61     PRPL	61     WOW	60|True|False|False|wallstreetbets|t5_2th52|1203114.0|public|confidence|self|Auto DD for via WSB mentions|0.0|[]|1.0|https://www.reddit.com/r/wallstreetbets/comments/gm9chk/auto_dd_for_via_wsb_mentions/|some_ads|7.0|||||||||||||||2020-05-18|SRNE
[]|False|wallstreet_cfa||[]||text|t2_5nru5tsb|False|False|[]|False|False|2020-05-18 11:50:35|self.wallstreetbets|https://www.reddit.com/r/wallstreetbets/comments/glzzva/ill_get_killed_for_this_but_idc_if_1_person_can/|{}|glzzva|True|False|False|False|True|True|False|#800080|question|[{'e': 'text', 't': 'Discussion'}]|96f6c79e-b853-11e5-a4cb-0ebdf030e05d|Discussion|light|richtext|False|False|True|14|0|False|some_ads|/r/wallstreetbets/comments/glzzva/ill_get_killed_for_this_but_idc_if_1_person_can/|False|7.0|1589802637|1|What is the benefit of buying calls with a strike price way below the current price ATM? I am looking at SRNE options and everyone and their mom is loading up on 2-2.5$ calls but the price of the stock is $10. Let’s say I buy 2 contracts for a strike price of 2.5. can I immediately exercise that option and sell each share for a 8$ gain? lol seems way too easy but idk wtf to make sense of this. I wanna join in too buying 2.5 calls or are they all just selling for premiums|True|False|False|wallstreetbets|t5_2th52|1202137.0|public|confidence|self|I’ll get killed for this but idc. If 1 person can answer I’ll appreciate it a lot|0.0|[]|1.0|https://www.reddit.com/r/wallstreetbets/comments/glzzva/ill_get_killed_for_this_but_idc_if_1_person_can/|some_ads|7.0|||||||||||||||2020-05-18|SRNE
[]|False|AnujSaharan||[]||text|t2_h5n8n|False|False|[]|False|False|2020-05-18 03:56:20|self.wallstreetbets|https://www.reddit.com/r/wallstreetbets/comments/glu3ur/most_talked_about_stonks_over_the_weekend/|{}|glu3ur|True|False|False|False|True|True|False|||[]|||dark|text|False|False|True|2|0|False|some_ads|/r/wallstreetbets/comments/glu3ur/most_talked_about_stonks_over_the_weekend/|False|7.0|1589774186|1|"  Symbol | Mentions | Bullish | Bearish | Neutral :- | :- | :- | :- | :- SPY:    11% 14 | 14 | 50 | 35 DIS:    5% 7 | 57 | 28 | 14 VBIV:    4% 5 | 0 | 20 | 80 TSLA:    4% 5 | 40 | 40 | 20 MSFT:    4% 5 | 20 | 80 | 0 SRNE:    3% 4 | 25 | 25 | 50 SLV:    3% 4 | 75 | 25 | 0 SPCE:    3% 4 | 50 | 25 | 25 EOD:    3% 4 | 25 | 50 | 25 DKNG:    2% 3 | 66 | 33 | 0 ZM:    1% 2 | 0 | 50 | 50 VTIQ:    1% 2 | 0 | 0 | 100 IN:    1% 2 | 100 | 0 | 0 NAT:    1% 2 | 0 | 0 | 100 NVDA:    1% 2 | 50 | 0 | 50 AMD:    1% 2 | 50 | 50 | 0 DAL:    1% 2 | 0 | 100 | 0 BAC:    1% 2 | 50 | 50 | 0 PINS:    1% 2 | 50 | 0 | 50 UVXY:    1% 2 | 50 | 50 | 0 LL:    &lt;1% 1 | 0 | 0 | 100 USO:    &lt;1% 1 | 0 | 0 | 100 DOA:    &lt;1% 1 | 0 | 100 | 0 ROKU:    &lt;1% 1 | 0 | 0 | 100 AAPL:    &lt;1% 1 | 0 | 100 | 0"|True|False|False|wallstreetbets|t5_2th52|1201586.0|public|confidence|self|Most Talked About Stonks Over The Weekend|0.0|[]|1.0|https://www.reddit.com/r/wallstreetbets/comments/glu3ur/most_talked_about_stonks_over_the_weekend/|some_ads|7.0|||||||||||||||2020-05-18|SRNE
[]|False|AnujSaharan||[]||text|t2_h5n8n|False|False|[]|False|False|2020-05-18 03:55:06|self.wallstreetbets|https://www.reddit.com/r/wallstreetbets/comments/glu37x/most_talked_about_stonks_over_the_weekend/|{}|glu37x|True|False|False|False|True|True|False|||[]|||dark|text|False|False|True|2|0|False|some_ads|/r/wallstreetbets/comments/glu37x/most_talked_about_stonks_over_the_weekend/|False|7.0|1589774112|1|"  Symbol | Mentions | Bullish | Bearish | Neutral SPY:    11% 14 | 14 | 50 | 35 VBIV:    4% 6 | 0 | 33 | 66 SRNE:    4% 6 | 16 | 33 | 50 DIS:    4% 5 | 60 | 20 | 20 TSLA:    4% 5 | 40 | 40 | 20 SLV:    4% 5 | 40 | 20 | 40 MSFT:    4% 5 | 20 | 80 | 0 SPCE:    3% 4 | 50 | 25 | 25 EOD:    3% 4 | 25 | 50 | 25 DKNG:    2% 3 | 66 | 33 | 0 VTIQ:    1% 2 | 0 | 0 | 100 IN:    1% 2 | 100 | 0 | 0 NAT:    1% 2 | 0 | 0 | 100 NVDA:    1% 2 | 50 | 0 | 50 AMD:    1% 2 | 50 | 50 | 0 DAL:    1% 2 | 0 | 100 | 0 BAC:    1% 2 | 50 | 50 | 0 PINS:    1% 2 | 50 | 0 | 50 UVXY:    1% 2 | 50 | 50 | 0 LL:    &lt;1% 1 | 0 | 0 | 100 DOA:    &lt;1% 1 | 0 | 100 | 0 ROKU:    &lt;1% 1 | 0 | 0 | 100 AAPL:    &lt;1% 1 | 0 | 100 | 0 RESI:    &lt;1% 1 | 100 | 0 | 0 VIX:    &lt;1% 1 | 0 | 100 | 0"|True|False|False|wallstreetbets|t5_2th52|1201585.0|public|confidence|self|Most Talked About Stonks Over The Weekend|0.0|[]|1.0|https://www.reddit.com/r/wallstreetbets/comments/glu37x/most_talked_about_stonks_over_the_weekend/|some_ads|7.0|||||||||||||||2020-05-18|SRNE
[]|False|theinternetishere12||[]||text|t2_2xuszjkc|False|False|[]|False|False|2020-05-16 03:12:06|self.wallstreetbets|https://www.reddit.com/r/wallstreetbets/comments/gkni9i/dd_on_sorrento_therapeutics_srne_thoughts_on_the/|{}|gkni9i|True|False|False|False|True|True|False|#365b8c|dd|[{'e': 'text', 't': 'DD'}]|5692ce02-b860-11e5-b542-0edc7016bbd3|DD|light|richtext|False|False|True|125|0|False|some_ads|/r/wallstreetbets/comments/gkni9i/dd_on_sorrento_therapeutics_srne_thoughts_on_the/|False|7.0|1589598732|1|"""**We want to emphasize there is a cure,**"" says CEO Henry Ji.    \_\_\_\_\_\_\_\_\_\_\_\_\_\_\_\_\_\_\_\_\_\_\_\_\_\_\_\_\_\_\_\_\_\_\_\_\_\_\_\_\_\_\_\_\_\_\_\_\_\_\_\_\_\_\_\_\_\_\_\_\_\_\_\_\_  Sorrento Therapeutics flew up today from it's closing price of $2.62 on 5/14 to an all-time high of $9.00 today.  There seems to be a lot of excitement made by these claims.  I am not.  Here is why.    **How did they do it**? **(and my response)**  Fox News Article: *""We want to emphasize there is a cure. There is a solution that works 100 percent,""*     Sorrento Website: *""* *These blocking antibodies were further tested for their ability to inhibit SARS-CoV-2 virus infection in an in vitro SARS-CoV-2 virus infection model pursuant to a preclinical testing agreement for COVID-19 therapeutic candidates that was previously announced on March 31, 2020.""  ""STI-1499, demonstrated 100% inhibition of SARS-CoV-2 virus infection in an in vitro virus infection experiment at a very low antibody concentration*. ""  From a clinical standpoint, it is misleading to suggest that there is a solution that works ""100 percent"".  These tests were done **in vitro**, that is to say, they were done by in cells.  This was not done in animals such as mice, and this was not tested in humans.  They claim that this was done at a ""low antibody concentration"".  The idea being suggested is that you don't need a lot of it to stop the virus from entering cells (given what it is targeting).    Strictly speaking, I have no idea what ""low antibody concentration"" means.  I have absolutely zero comparison or reference.  Does ""low"" mean ""low"" compared to the other not so great antibodies they tested?  Importantly, not addressed here is the concentration of SARS-CoV-2 being used for these experiments and how that compares to the concentrations used for other drugs in the same experiments.  In short, a lot of compounds might seem more effective and do a better job of ""inhibiting"" the virus, if there's a lot less virus around to be dealing with.  I would be far more impressed if it was stated that this was demonstrated to be effective despite increasing concentrations of virus etc.    **Judgement:**    *""We want to emphasize there is a cure. There is a solution that works 100 percent,""*     My counterpoint ""A solution that works 100% under what circumstances?"".    **How did they sell it?**  Fox News:   *Dr. Ji pointed out that the antibody can be used as preventative therapy since there are no side effects, and that it can be more effective than any vaccine that may be developed.*  *""This is the best solution,"" he said. ""The point of making a vaccine is to generalize a neutralizing antibody. So, if you already have one, you don't need to the body to generate one from a vaccine. You've already provided it. You're cutting out the middleman.""*  While the comment about ""no side effects"" is not a direct quote, I am going to take this article at face value.  On the face of it, it's a true statement.  There were no side effects to ""observe"".  Such a statement has, in my opinion, next to no meaning clinically.  They are using ""humanized antibodies"" and this means that they usually take the antibodies from a non-human species and adjust them to match up more closely with the structure of antibodies humans make.  I have yet to see any FDA approved monoclonal antibody that does not have ""any side effects"" listed.  You can look up the FDA approval for any monoclonal antibody such as adalimumab, dupilumab, tocilizumab, etc.    Every single one has many side effects, and those are often related to what is being targeted.  These medications and others are intentionally targeting proteins within our bodies, and that explains why many of them have unique side effects, as they are targeting different proteins, with different targets in our bodies.    While we do not have a ""spike"" protein like the *SARS-CoV-2* on our cells to interact with, and thus the likelihood of the antibodies on some other cells that look like the ""spike protein"" to have any notable effect is low, sometimes medications have side effects that could not have been predicted based on how the medication works.  For example, monitoring organ function such as liver function will likely be important in the initial studies given that the liver is often involved in the metabolism of a monoclonal antibody.  This is one of the reasons why the FDA approval is so comprehensive and lengthy.  Phase 4 clinical trials of a medication involves post-marketing surveillance (looking for side effects even after it is approved).    In other words, just because a clear prediction for what side effects of any might occur cannot be easily made beforehand, does not mean it would be reasonable to say up front that ""there are no side effects"".  Perhaps, one of the reasons this happened is that the CEO, is a PHD, and does not have clinical experience.   **Judgement:** It is extremely premature to say a medication has ""no side effects"" when it has never been tested beyond cells in a lab.  It begs the question how a comment like this could be comfortably made by a CEO.    **What's their plan?**  Fox News: *It was recently announced Sorrento had partnered with New York-based health care system Mount Sinai to develop an antibody cocktail. Dubbed Covi-Shield, the cocktail will be comprised of three different antibodies and, pending FDA approval, will be used as a prophylactic treatment for people returning to work and those who have been exposed to COVID-19.*  *Sorrento officials said that STI-1499 will likely be the first antibody in the cocktail. They are also looking to develop the antibody as a stand-alone therapy due to its high potency, according to a statement provided to Fox News.*  *""This is the best solution,"" he said. ""The point of making a vaccine is to generalize a neutralizing antibody. So, if you already have one, you don't need to the body to generate one from a vaccine. You've already provided it. You're cutting out the middleman.""*   This is not at all practical to suggest using **three monoclonal antibodies**, all that the same time from a preventative standpoint.  Why is this an issue?  Well unlike other medications that are taken on a daily basis, these monoclonal antibodies tend to stay in your system for a varied period of time depending on how they are metabolized.  Practically speaking, if they actually planned to administer them as a ""cocktail"" in one injection (only way this would make sense as a preventative), ideally you would want for all of those medications to last in your body for roughly the same period of time, so that they can be dosed at the same interval (all three medications every 3 months, or every 2 weeks etc).   There are a number relevant pharmacokinetic reasons why this would be silly as well.  From a manufacturing/cost standpoint, it's a surprising claim.  Put simply, monoclonal antibodies aren't cheap.  Depending on how long the antibodies stayed active, a repeat injection would likely be needed.    There are a number of reasons why a vaccine would be better than a monoclonal antibody.  Vaccines will induce fully human antibodies, and not ""humanized"" antibodies and therefore, in my opinion, the risks or side effects associated with ""humanized"" antibodies versus ""human"" antibodies would not be an issue.  Depending on how the vaccine is designed, it may do more than just induce antibodies, but also recruit other parts of the immune system such as the ""cellular immune response"" and not just a ""humoral immune response"".  In looking at how to defeat any virus, a cellular immune response is in many ways, just as important in my opinion, and sometimes more important depending on the virus and the vaccine design.  One of the beautiful things about our immune system is that it can ""ramp up"" an immune response depending on how much virus is present, and this would not really be possible to do with a monoclonal antibody approach.  One exception, might be, if used therapeutically in a hospital in continuing to provide this to the patient as has been done with tocilizumab etc.  I want to be very clear that this is NOT the same thing as the immune system being ""too active"" such as in the case of the so-called ""cytokine storm"".  In the case of the cytokine storm, the virus is essentially **dysregulating** the immune system to act in this way we wouldn't want them to.  A vaccine, a ""preventative"", or a therapeutic given very early could limit the ability of the virus to replicate and impact the immune system in this way.  In other words, you'd be stopping the virus near the entryway, instead of trying to come in after it has ravaged every floor of your house.  A potential downside to a vaccine is that it does take time for your body to build-up a sufficient immune response, usually one month or more.  **Judgement:** From a preventative standpoint, I would posit that a vaccine has far better risk/benefit profile compared to a the monoclonal antibody approach targeting the virus such as the one reported by Sorrento.  My response here is solely referring to the ""preventative"".  I am NOT saying that monoclonal antibodies are not effective, or would not be effective from a therapeutic standpoint.  I think there is promise/merit in trying to stop/correct the immune system dysregulation that the virus is causing, and these types of antibodies are wholly different from the one(s) being put forth by Sorrento.  **TLDR:**   \- It is clinically meaningless to say you achieved a ""cure"" in lab cells"".  \- I am skeptical of anything being ""100 percent effective"" without the conditions being stated.  \- A medication does not have any side effects until they do, that's why monitoring for side effects is important.  We don't know that we don't know.    \- Three monoclonal antibodies at once is not practical or cost effective.  The safety profile/pharmacokinetics of each one would need to be evaluated/verified, and then likely the same thing would have to be done when all of them are given together (unless they just skipped straight to the trio, which I doubt will happen).    \- **A well-designed vaccine** (both strong humoral and cellular immune responses) would be much better than a monoclonal antibody from a preventative standpoint.    \- Please do not confuse a strong immune response from a vaccine as being similar or related to the dysregulated immune response from the cytokine storm that is caused by the virus.    **Disclaimer:** My post is not intended here as investing advice or investment advice.  I have posted this solely to share my thoughts on the claims made by Sorrento.  **Sources:**  [https://www.foxnews.com/science/covid-cure-california-biopharmaceutical-coronavirus-antibody-breakthrough](https://www.foxnews.com/science/covid-cure-california-biopharmaceutical-coronavirus-antibody-breakthrough)   [https://investors.sorrentotherapeutics.com/news-releases/news-release-details/sti-1499-potent-anti-sars-cov-2-antibody-demonstrates-ability](https://investors.sorrentotherapeutics.com/news-releases/news-release-details/sti-1499-potent-anti-sars-cov-2-antibody-demonstrates-ability)"|True|False|False|wallstreetbets|t5_2th52|1197447.0|public|confidence|self|DD on Sorrento Therapeutics ($SRNE) - Thoughts on the company claims|0.0|[]|1.0|https://www.reddit.com/r/wallstreetbets/comments/gkni9i/dd_on_sorrento_therapeutics_srne_thoughts_on_the/|some_ads|7.0|||||||||||||||2020-05-16|SRNE
[]|False|ancillos||[]||text|t2_4gu3b|False|False|[]|False|False|2020-05-16 00:54:18|self.wallstreetbets|https://www.reddit.com/r/wallstreetbets/comments/gklfab/sorrento/|{}|gklfab|True|False|False|False|True|True|False|#ff0000|loss|[{'e': 'text', 't': 'Loss'}]|7d5f3586-0a95-11e9-a050-0efea8d9040e|Loss|light|richtext|False|False|True|16|0|False|some_ads|/r/wallstreetbets/comments/gklfab/sorrento/|False|7.0|1589590633|0|Sold 40,000 SRNE this morning at $4.91 basis was $2.61. Told the wife about it when I saw the jump in the am. She had no idea what I was doing with our money. We agreed on selling when we did then watched it hit $9 and settle at $7.   Made more tendies than I’ve ever imagined making in a few weeks trade but still can’t get a blower because of the woulda coulda shoulda. Please convince my wife with your comments that a blower is due based on realized gains and not missed opportunities.|True|False|False|wallstreetbets|t5_2th52|1197288.0|public|confidence|self|Sorrento|0.0|[]|0.5|https://www.reddit.com/r/wallstreetbets/comments/gklfab/sorrento/|some_ads|7.0|||||||||||||||2020-05-16|SRNE
