[]|False|chikid1993||[]||text|t2_12g4p6|False|False|[]|False|False|2021-01-27 17:10:40|self.wallstreetbets|https://www.reddit.com/r/wallstreetbets/comments/l698mw/srne_fanatics/|{}|l698mw|True|False|False|False|True|True|False|#800080|question|[{'e': 'text', 't': 'Discussion'}]|96f6c79e-b853-11e5-a4cb-0ebdf030e05d|Discussion|light|richtext|False|False|True|3|0|False|some_ads|/r/wallstreetbets/comments/l698mw/srne_fanatics/|False|7.0|1611767451|1|Hey I’m just wondering if anyone here sees $SRNE making a big run?|True|False|False|wallstreetbets|t5_2th52|3039623.0|public|confidence|self|$SRNE fanatics|0.0|[]|1.0|https://www.reddit.com/r/wallstreetbets/comments/l698mw/srne_fanatics/|some_ads|7.0|||||||||||||||2021-01-27|SRNE
[]|False|coolwin55555||[]||text|t2_803sr49w|False|False|[]|False|False|2021-01-27 17:01:57|self.wallstreetbets|https://www.reddit.com/r/wallstreetbets/comments/l690nq/srne/|{}|l690nq|True|False|False|False|True|True|False|#800080|question|[{'e': 'text', 't': 'Discussion'}]|96f6c79e-b853-11e5-a4cb-0ebdf030e05d|Discussion|light|richtext|False|False|True|4|0|False|some_ads|/r/wallstreetbets/comments/l690nq/srne/|False|7.0|1611766929|1|Guys how about SRNE, massively undervalued and always shorted by the biggies.  Multiple shots at COVID cures with antibodies, nasal spray, covid tests, awaiting EUA's could be a few coming very soon.  The biggies kept this under their thumb, but its starting to breakout.  This guy should be at least $30++ check this out could be the next GME. $$$$$$$ Lets screw the Old Boys Club.|True|False|False|wallstreetbets|t5_2th52|3026861.0|public|confidence|self|SRNE|0.0|[]|1.0|https://www.reddit.com/r/wallstreetbets/comments/l690nq/srne/|some_ads|7.0|||||||||||||||2021-01-27|SRNE
[]|False|HASM1015||[]||text|t2_9ecurtc6|False|False|[]|False|False|2021-01-27 16:57:45|self.wallstreetbets|https://www.reddit.com/r/wallstreetbets/comments/l68ws5/srne/|{}|l68ws5|True|False|False|False|True|True|False|#800080|question|[{'e': 'text', 't': 'Discussion'}]|96f6c79e-b853-11e5-a4cb-0ebdf030e05d|Discussion|light|richtext|False|False|True|0|0|False|some_ads|/r/wallstreetbets/comments/l68ws5/srne/|False|7.0|1611766675|1|SRNE is making vaccines and other covid related products to help the world right now. It's very heavily shorted, let's teach those short a lesson!!|True|False|False|wallstreetbets|t5_2th52|3020482.0|public|confidence|self|SRNE|0.0|[]|1.0|https://www.reddit.com/r/wallstreetbets/comments/l68ws5/srne/|some_ads|7.0|||||||||||||||2021-01-27|SRNE
[]|False|OnassisLondrezos||[]||text|t2_a0n2cl8n|False|False|[]|False|False|2021-01-27 16:55:29|self.wallstreetbets|https://www.reddit.com/r/wallstreetbets/comments/l68utm/srne_has_the_cure_check_it_out/|{}|l68utm|True|False|False|False|True|True|False|#349e48|profit|[{'e': 'text', 't': 'Gain'}]|6bd9394c-0a95-11e9-82db-0eb3a11267a0|Gain|light|richtext|False|False|False|0|0|False|some_ads|/r/wallstreetbets/comments/l68utm/srne_has_the_cure_check_it_out/|False|7.0|1611766541|1|You want to truly help people, then join $SRNE. Hugely shorted despite having a huge pipeline of Covid, and cancer solutions to be approved by FDA. That would make you a person who contributes to a real purpose.|True|False|False|wallstreetbets|t5_2th52|3017213.0|public|confidence|self|#SRNE has the cure! Check it out|0.0|[]|1.0|https://www.reddit.com/r/wallstreetbets/comments/l68utm/srne_has_the_cure_check_it_out/|some_ads|7.0|||||||||||||||2021-01-27|SRNE
[]|False|Capital-Entrance-119||[]||text|t2_9zn9tpeq|False|False|[]|False|False|2021-01-27 16:54:37|self.wallstreetbets|https://www.reddit.com/r/wallstreetbets/comments/l68u2l/srne/|{}|l68u2l|True|False|True|False|True|True|False|#349e48|profit|[{'e': 'text', 't': 'Gain'}]|6bd9394c-0a95-11e9-82db-0eb3a11267a0|Gain|light|richtext|False|False|True|0|0|False|some_ads|/r/wallstreetbets/comments/l68u2l/srne/|False|7.0|1611766489|1|$srne  real catalysts and high short% will blow top off soon|True|False|False|wallstreetbets|t5_2th52|3015938.0|public|confidence|self|$srne|0.0|[]|1.0|https://www.reddit.com/r/wallstreetbets/comments/l68u2l/srne/|some_ads|7.0|||||||||||||||2021-01-27|SRNE
[]|False|IVYleaguePHYSICIAN||[]||text|t2_5uymmon1|False|False|[]|False|False|2021-01-27 16:50:33|self.wallstreetbets|https://www.reddit.com/r/wallstreetbets/comments/l68ql4/get_into_srne_when_youre_done_with_gme_and_amc/|{}|l68ql4|True|False|False|False|True|True|False|#0392cf|yolo|[{'e': 'text', 't': 'YOLO'}]|da18a43a-83c5-11e8-9b6c-0e287561ddb8|YOLO|light|richtext|False|False|True|0|0|False|some_ads|/r/wallstreetbets/comments/l68ql4/get_into_srne_when_youre_done_with_gme_and_amc/|False|7.0|1611766245|0|https://stocktwits.com/Docvascepa888/message/278477956  Attention GME and AMC!!!  I’m an IVY league trained physician (yes you can trust me scientifically and medically), I’ve been reading about SRNE since March 2020 and this will truly help COVID and covid will be around for many many years unfortunately but SRNE has so many angles to help. We need WSB help to help society and our pockets.   SRNE is a play like MRNA, NVAX, GILD, CODX all in one package. And frankly each of their products is truly the best in class from diagnostics to reducing ICU stay and mortality to truly opening up society and TRAVEL (alone makes 25 pct of world’s GDP)   SRNE is a squeeze that will go up and stay up unlike GME and AMC  I’m sure you each know someone poorly affected by covid, health and economic wise, let’s do the right thing for ourselves and benefit society and our portfolios at the same time. This is your true golden ticket.   These short hedges are detrimental to society and scientific advancements.  Let’s all band together and $ufk over these crooks at our benefit and their pain that they have no chance to reach for their LUBE  Sincerely,   Your doc who always does the right thing|True|False|False|wallstreetbets|t5_2th52|3009597.0|public|confidence|self|Get into SRNE when you’re done with GME and AMC|0.0|[]|0.5|https://www.reddit.com/r/wallstreetbets/comments/l68ql4/get_into_srne_when_youre_done_with_gme_and_amc/|some_ads|7.0|self|{'enabled': False, 'images': [{'id': 'vGlJyS_TrQ6InfUqRweCI_U2GqdbkhxWjr7YEmaK-1U', 'resolutions': [{'height': 108, 'url': 'https://external-preview.redd.it/j4zy9I_M6J2lx3DzI-2wDJqDcyv1GMO3Tp9Xm3MRyHg.jpg?width=108&amp;crop=smart&amp;auto=webp&amp;s=4985e4563638d033cf3c053d8a130205c16b3515', 'width': 108}], 'source': {'height': 172, 'url': 'https://external-preview.redd.it/j4zy9I_M6J2lx3DzI-2wDJqDcyv1GMO3Tp9Xm3MRyHg.jpg?auto=webp&amp;s=06dc591cca71de62111fb44922ddffb5e2aadd48', 'width': 172}, 'variants': {}}]}|||||||||||||2021-01-27|SRNE
[]|False|Johnnytradezz4real||[]||text|t2_a0qyrah7|False|False|[]|False|False|2021-01-27 16:48:29|self.wallstreetbets|https://www.reddit.com/r/wallstreetbets/comments/l68osy/srne/|{}|l68osy|True|False|False|False|True|True|False|#0392cf|yolo|[{'e': 'text', 't': 'YOLO'}]|da18a43a-83c5-11e8-9b6c-0e287561ddb8|YOLO|light|richtext|False|False|True|0|0|False|some_ads|/r/wallstreetbets/comments/l68osy/srne/|False|7.0|1611766120|1|Can SRNE get some love?! This stock is 🚀🥳|True|False|False|wallstreetbets|t5_2th52|3006441.0|public|confidence|self|SRNE|0.0|[]|1.0|https://www.reddit.com/r/wallstreetbets/comments/l68osy/srne/|some_ads|7.0|||||||||||||||2021-01-27|SRNE
[]|False|kaoni42||[]||text|t2_imk8oil|False|False|[]|False|False|2021-01-27 16:47:44|self.wallstreetbets|https://www.reddit.com/r/wallstreetbets/comments/l68o6p/sorrento_therapeutics_above_to_explode/|{}|l68o6p|True|False|False|False|True|True|False|#365b8c|dd|[{'e': 'text', 't': 'DD'}]|5692ce02-b860-11e5-b542-0edc7016bbd3|DD|light|richtext|False|False|True|8|0|False|some_ads|/r/wallstreetbets/comments/l68o6p/sorrento_therapeutics_above_to_explode/|False|7.0|1611766074|1|Take your profits over to  $SRNE the company just released positive news yesterday and at home covid test kit is pending FDA approval any day now  . Kit already being manufactured to be distributed . Has over 30% short interest. The average price target consensus  from 3 analysts is over $24.00+ so no bag holding here.|True|False|False|wallstreetbets|t5_2th52|3005333.0|public|confidence|self|Sorrento Therapeutics above to explode|0.0|[]|1.0|https://www.reddit.com/r/wallstreetbets/comments/l68o6p/sorrento_therapeutics_above_to_explode/|some_ads|7.0|||||||||||||||2021-01-27|SRNE
[]|False|chikid1993||[]||text|t2_12g4p6|False|False|[]|False|False|2021-01-27 16:47:23|self.wallstreetbets|https://www.reddit.com/r/wallstreetbets/comments/l68nw6/sorrento_therapeutics_srne_situation/|{}|l68nw6|True|False|False|False|True|True|False|#800080|question|[{'e': 'text', 't': 'Discussion'}]|96f6c79e-b853-11e5-a4cb-0ebdf030e05d|Discussion|light|richtext|False|False|True|14|0|False|some_ads|/r/wallstreetbets/comments/l68nw6/sorrento_therapeutics_srne_situation/|False|7.0|1611766054|1|Hi wonderful people :) I was just wondering what everyone’s thoughts are on Sorrento Therapeutics ? They have a very nice pipeline and have been historically shorted this past year and manipulated to favor the shorts. Any chance the party can be moved to SRNE or what do you guys think?|True|False|False|wallstreetbets|t5_2th52|3004819.0|public|confidence|self|Sorrento therapeutics $SRNE situation|0.0|[]|1.0|https://www.reddit.com/r/wallstreetbets/comments/l68nw6/sorrento_therapeutics_srne_situation/|some_ads|7.0|||||||||||||||2021-01-27|SRNE
[]|False|Rufus_the_wise||[]||text|t2_o5u6o89|False|False|[]|False|False|2021-01-27 16:34:22|self.wallstreetbets|https://www.reddit.com/r/wallstreetbets/comments/l68ci0/following_the_attack_of_the_infamous_dropbears/|{}|l68ci0|True|False|False|False|True|True|False|#800080|question|[{'e': 'text', 't': 'Discussion'}]|96f6c79e-b853-11e5-a4cb-0ebdf030e05d|Discussion|light|richtext|False|False|True|0|0|False|some_ads|/r/wallstreetbets/comments/l68ci0/following_the_attack_of_the_infamous_dropbears/|False|7.0|1611765273|1|I never liked the concept of shorting a stock... yes I understand it´s value as a portfolio cover but the principle.... wrong.  Especially wrong would be to short the stock of a company fighting for an answer to the Covid Pandemic... one like $SRNE for example....   What do you think?|True|False|False|wallstreetbets|t5_2th52|2985735.0|public|confidence|self|Following the attack of the infamous dropbears|0.0|[]|1.0|https://www.reddit.com/r/wallstreetbets/comments/l68ci0/following_the_attack_of_the_infamous_dropbears/|some_ads|7.0|||||||||||||||2021-01-27|SRNE
[]|False|proteinwarrant||[]||text|t2_9yybq6o3|False|False|[]|False|False|2021-01-27 16:06:44|self.wallstreetbets|https://www.reddit.com/r/wallstreetbets/comments/l67ooc/sorrento_therapeutics_inc_nasdaq_srne/|{}|l67ooc|True|False|True|False|True|True|False|#800080|question|[{'e': 'text', 't': 'Discussion'}]|96f6c79e-b853-11e5-a4cb-0ebdf030e05d|Discussion|light|richtext|False|False|True|2|0|False|some_ads|/r/wallstreetbets/comments/l67ooc/sorrento_therapeutics_inc_nasdaq_srne/|False|7.0|1611763616|0|SRNE combines:  \- one of the most active and promising pipelines in the COVID space  \- a potentially transformative non-opioid pain pipeline  \- a deep oncology pipeline  &amp;#x200B;  &amp;#x200B;  Near-term menu:  \- EUA for COVI-STIX (a 15-minute nasal swab antigen test for SARS-CoV-2) has already been filed in the US and Mexico, and the test could be launched as early as 1H21. This could rapidly approach $500M in sales as soon as 2022.  \- SRNE's 8-minute SARS-CoV-2 antibody test COVID-TRACK could swiftly follow in its footsteps with an EUA anticipated to be filed in the year’s first half. Another $500million+ near term opportunity.  \- Two neutralizing antibody treatments, COVI-DROPS and COVI-AMG, against SARS-CoV-2, could be launched in 2022. Each of these have the potential to bring in more than $500 million in sales.  \- Phase 3 data for SP-102 (sciatica pain candidate) should be available this year.  \- RTX for OsteoArthritis knee pain and intractable cancer pain will kick-off Phase 2 and Phase 3 studies, respectively, in 2021. Both target substantial market opportunities.  \- Abivertinib (for non-small-cell lung cancer (NSCLC) and B-cell lymphomas), currently in Phase 3 trials in China with top line data anticipated in 1H21.  &amp;#x200B;  &amp;#x200B;  Is SRNE a buy?|False|False|False|wallstreetbets|t5_2th52|2948913.0|public|confidence|self|Sorrento Therapeutics Inc (NASDAQ: SRNE)|0.0|[]|0.5|https://www.reddit.com/r/wallstreetbets/comments/l67ooc/sorrento_therapeutics_inc_nasdaq_srne/|some_ads|7.0|||||||||||||||2021-01-27|SRNE
[]|False|Thee-Pacifist5||[]||text|t2_96fg72v3|False|False|[]|False|False|2021-01-27 16:02:40|self.wallstreetbets|https://www.reddit.com/r/wallstreetbets/comments/l67lbj/get_elon_to_mention_srne/|{}|l67lbj|True|False|False|False|True|True|False|#0392cf|yolo|[{'e': 'text', 't': 'YOLO'}]|da18a43a-83c5-11e8-9b6c-0e287561ddb8|YOLO|light|richtext|False|False|True|4|0|False|some_ads|/r/wallstreetbets/comments/l67lbj/get_elon_to_mention_srne/|False|7.0|1611763371|1|Comment under Elon musk last tweet with ticker symbol SRNE|True|False|False|wallstreetbets|t5_2th52|2944209.0|public|confidence|self|Get ELON TO MENTION SRNE|0.0|[]|1.0|https://www.reddit.com/r/wallstreetbets/comments/l67lbj/get_elon_to_mention_srne/|some_ads|7.0|||||||||||||||2021-01-27|SRNE
[]|False|maxdavids||[]||text|t2_9zo3w4n3|False|False|[]|False|False|2021-01-27 15:52:42|self.wallstreetbets|https://www.reddit.com/r/wallstreetbets/comments/l67d0k/srne_not_getting_traction_selling_it/|{}|l67d0k|True|False|False|False|True|True|False|#800080|question|[{'e': 'text', 't': 'Discussion'}]|96f6c79e-b853-11e5-a4cb-0ebdf030e05d|Discussion|light|richtext|False|False|True|1|0|False|some_ads|/r/wallstreetbets/comments/l67d0k/srne_not_getting_traction_selling_it/|False|7.0|1611762773|1|SRNE Not getting traction selling it.|True|False|False|wallstreetbets|t5_2th52|2933347.0|public|confidence|self|SRNE Not getting traction selling it.|0.0|[]|1.0|https://www.reddit.com/r/wallstreetbets/comments/l67d0k/srne_not_getting_traction_selling_it/|some_ads|7.0|||||||||||||||2021-01-27|SRNE
[]|False|tonoocala||[]||text|t2_4wwsvsa4|False|False|[]|False|False|2021-01-21 20:59:39|self.wallstreetbets|https://www.reddit.com/r/wallstreetbets/comments/l27mxk/srne_update_more/|{}|l27mxk|True|False|False|False|True|True|False|#ffb000|news|[{'e': 'text', 't': 'News'}]|519c3d26-4acc-11eb-8ce2-0ec530aa616d|News|light|richtext|False|False|False|48|0|False|some_ads|/r/wallstreetbets/comments/l27mxk/srne_update_more/|False|7.0|1611263071|3|Degenerates, my appologies. I forgot to include rockets 🚀🚀🚀🚀🚀🚀🚀 in my previous post about YOLOing on $SRNE (link below)   [https://www.reddit.com/r/wallstreetbets/comments/l16acz/yoloing\_on\_srne/](https://www.reddit.com/r/wallstreetbets/comments/l16acz/yoloing_on_srne/)   Big update: We got another price target: $35 🚀🚀🚀🚀🚀🚀🚀 THAT IS A 250% increase from where the stock sits (right about $10 right now) AND its a good opp to light some shorts on fire as the stock is quite shorted!!!|True|False|False|wallstreetbets|t5_2th52|1927069.0|public|confidence|self|🚀🚀🚀🚀🚀🚀🚀 $SRNE update. More 🚀🚀🚀🚀🚀🚀🚀|0.0|[]|0.71|https://www.reddit.com/r/wallstreetbets/comments/l27mxk/srne_update_more/|some_ads|7.0|||||||||||||||2021-01-21|SRNE
[]|False|tonoocala||[]||text|t2_4wwsvsa4|False|False|[]|False|False|2021-01-20 10:03:35|self.wallstreetbets|https://www.reddit.com/r/wallstreetbets/comments/l16acz/yoloing_on_srne/|{}|l16acz|True|False|True|False|True|True|False|#0392cf|yolo|[{'e': 'text', 't': 'YOLO'}]|da18a43a-83c5-11e8-9b6c-0e287561ddb8|YOLO|light|richtext|False|False|True|32|0|False|some_ads|/r/wallstreetbets/comments/l16acz/yoloing_on_srne/|False|7.0|1611137026|1|"All right degenerates, time to get serious. $SRNE is a power play. If you don't believe me, look at the volume over the last couple of days + this DD. ALSO FUCK THE SHORTS     **SRNE has cash on hand + cash coming its way from investments**:  ""Selvaraju \[some analyst who possibly knows what he is talking about\] also estimates that the company will be obtaining $320 million from its current investments. He cites Sorrento’s investments in biotech companies Celularity and NantKwest ([NASDAQ: NK](https://stockmarket.com/ticker?symbol=NK)). First, the former will be merging with GX Acquisition Corp ([NASDAQ: GXGX](https://stockmarket.com/ticker?symbol=GXGX)) to go public. This would entitle Sorrento to about $200 million in shares.""      ""Another point to consider would be the company’s solid financials. In its recent quarter fiscal, the company saw year-over-year jumps of 103% in total revenue and 116% in cash on hand. Its recent FDA application for its coronavirus test kit sets up exciting times ahead for SRNE stock.""  sauce: [https://www.nasdaq.com/articles/3-biotech-stocks-to-watch-this-week-2021-01-18](https://www.nasdaq.com/articles/3-biotech-stocks-to-watch-this-week-2021-01-18)  (Yeah article calling it a biotech stock to watch this week)     **SRNE is making power moves to defeat different health issues humanity faces \[Don't forget its always cool to donate to good causes\]** I am focused on 2020 and 2021, so I only am familiar with recent positive results from their studies pertaining to cancer and COVID.      There is a lot of anticipation for EUA approval for a couple of SRNE products that could combat this fucking pandemic. Mexico, Brazil, USA could use SRNE's help and apparently \[Noah Ritter is the man\] SRNE is working hard to penetrate those countries \[in a good way'  **COVID - Its a fucking pandemic**   With all of these strains, virus mutations, and other madness, shits not going anywhere anytime soon. Billions of people all over the world, not enough vaccines to go around before 4/20. Therapeutics are an alternative for people who are concerned about vaccines. Go use some fucking COVI-STIX then...guess who makes them YEAH SORRENTO.     **GOTTA LOVE MERGERS &amp; ACQUISITIONS**   In 2020, Sorrento announce that they acquired SmartPharm ""a gene-encoded therapeutics company developing non-viral DNA and RNA gene delivery platforms for COVID-19 and rare diseases with broad potential for application in enhancing antibody-centric therapeutics."" [https://apnews.com/press-release/globenewswire-mobile/3f2bc5fa6cb7419775f5afb19a622f10](https://apnews.com/press-release/globenewswire-mobile/3f2bc5fa6cb7419775f5afb19a622f10)       Also, already mentioned earlier... Sorrento is one of the owners of Celularity (list of Celularity stockholders: ""Celularity stockholders (including Sorrento Therapeutics, affiliates of Bristol Myers Squibb, Starr Insurance Companies, and Dragasac Limited, a wholly owned subsidiary of Genting Berhad)"" \[YEAH WE OWN STUFF ALONG WITH BIG NAMES\]....Celularity will be merging with GX Acquisition.     **PRICE TARGET**: HC Wainwright analyst gave it a $30 PT. We all know people hate on us, but why don't they hate on older degenerates that just buy into whatever an analyst says? Because they fuckin love the fuckin analysts and the big money. OK WELL I'M GETTING MY SLICE MOTHA FUCKASSSSSS     **CEO talking today**    I dont know what Dr. Ji (yeah he's some sort of Dr. which is cool because he probably ate crazy amounts of pussay in whichever school he went to). IDK what the hell he's gonna say there but all I know is some people will listen to him and they might decide to throw more money into the pit.     **SHORT SQUEEZE**   I hate shorts. Mother fuckers are getting lit on fire with the pre-market action (currently up over 13%) and we know that market action could get crazier once opens to all degenerates across the world. Not sure where its at now, but I think short interest was at 30% yesterday? (don' quote me - check for yourselves...do the DD cause I am not sure).     I honestly don't know what the fuck i am talking about. Do your own DD, I am serious. Its your money and you should care about and verify what you are getting into. I have been on a win streak, but its cause of luck. I hope everyone makes $, finds something nice to do with it, and make the world better."|True|False|False|wallstreetbets|t5_2th52|1908954.0|public|confidence|self|YOLOing on $SRNE|0.0|[]|1.0|https://www.reddit.com/r/wallstreetbets/comments/l16acz/yoloing_on_srne/|some_ads|7.0|self|{'enabled': False, 'images': [{'id': 'k-CKp3wIh0hCxtWWaAoorpgpK5ZqEUSrGUaJ1uG-3wU', 'resolutions': [{'height': 11, 'url': 'https://external-preview.redd.it/Iin4wLkNx6J2hNYlduC2ImEZhmGXUVk4t_07baTJzyY.jpg?width=108&amp;crop=smart&amp;auto=webp&amp;s=27594d395f3315b951ace2fad82d1ee6afd17085', 'width': 108}, {'height': 23, 'url': 'https://external-preview.redd.it/Iin4wLkNx6J2hNYlduC2ImEZhmGXUVk4t_07baTJzyY.jpg?width=216&amp;crop=smart&amp;auto=webp&amp;s=14f2795e52c81fb604aa512af51c9e8a61b2546c', 'width': 216}, {'height': 35, 'url': 'https://external-preview.redd.it/Iin4wLkNx6J2hNYlduC2ImEZhmGXUVk4t_07baTJzyY.jpg?width=320&amp;crop=smart&amp;auto=webp&amp;s=99552db7d3eb3da6bc14b4b58cec31dceadc66f6', 'width': 320}, {'height': 70, 'url': 'https://external-preview.redd.it/Iin4wLkNx6J2hNYlduC2ImEZhmGXUVk4t_07baTJzyY.jpg?width=640&amp;crop=smart&amp;auto=webp&amp;s=109989fea44209a977a2514783ea70ef64589997', 'width': 640}, {'height': 105, 'url': 'https://external-preview.redd.it/Iin4wLkNx6J2hNYlduC2ImEZhmGXUVk4t_07baTJzyY.jpg?width=960&amp;crop=smart&amp;auto=webp&amp;s=d1bf68bd8e68c369ceed723204aea1660a2755dd', 'width': 960}, {'height': 118, 'url': 'https://external-preview.redd.it/Iin4wLkNx6J2hNYlduC2ImEZhmGXUVk4t_07baTJzyY.jpg?width=1080&amp;crop=smart&amp;auto=webp&amp;s=1007a781274d6409b90b6efe4e9377379872d19b', 'width': 1080}], 'source': {'height': 195, 'url': 'https://external-preview.redd.it/Iin4wLkNx6J2hNYlduC2ImEZhmGXUVk4t_07baTJzyY.jpg?auto=webp&amp;s=526c8d12ad23c681526ba64357050fe7e8eb6fa4', 'width': 1779}, 'variants': {}}]}|||||||||||||2021-01-20|SRNE
